href,keyword,word_count,info,author,headline,article_text
https://www.pbs.org/newshour/nation/5-important-stories-that-have-nothing-to-do-with-the-white-house-5,asylum seeker,1901,2018-09-11T16:57:37-04:00,Joshua Barajas,5 important stories that have nothing to do with the White House,"These days it can be hard to keep up with the stories in your newsfeed. We take a moment each week to look at what’s happening outside of the Capitol and the White House. Here’s what we’re reading now.
Native American women are going missing at alarming rates, according to an investigation by the Associated Press, which focuses in part on the Flathead Indian Reservation in Montana, seen in this file photo. (Photo by Braunger/ullstein bild via Getty Images)
Native American women are going missing at alarming rates, according to an investigation by the Associated Press.
Last year, Native American women made up more than 0.7 percent of missing cases in the U.S., even though the group represents only 0.4 percent of the population, the AP reported. They are also a group that faces high rates of murder, sexual violence and abuse. According to a 2016 study from the National Institute of Justice, 80 percent of indigenous women have experienced violence in their lifetime.
One of AP’s reports details the case of Ashley HeavyRunner Loring, a 20-year-old woman who disappeared last June inside the Blackfeet Indian Reservation in Montana. More than a year later, the Bureau of Indian Affairs and the FBI, who have both led an investigation into her disappearance, are no closer to answering what happened. Loring’s older sister has organized dozens of searches in the mountains of the reservation. Missing posters continue to be displayed inside the reservation’s grocery stores.
Loring’s case is just one of many across the U.S., reports the Associated Press. [The Associated Press]
Why it matters: Much of the violence against Native women goes unreported. Missing person cases are not often filed, either, in part because of muddled jurisdiction and law enforcement protocols between agencies in and outside the reservations. When a person goes missing on tribal lands, which are considered sovereign nations, the case is referred to tribal police and the Bureau of Indian Affairs. FBI investigators step in in some cases, but when they don’t, tribal access to federal crime information databases is limited.
Federal and state lawmakers have put forward measures to address the problem, including a bill introduced last fall by Sen. Heidi Heitkamp, D-N.D.,that would establish new protocols for the Department of Justice to respond to these cases and increase tribal access to crime databases. More than a year later, the bill is still in committee.
Chicago police officer Jason Van Dyke listens during his 2017 hearing in the shooting case of Laquan McDonald at the Leighton Criminal Court Building in Chicago, Illinois. Photo by Antonio Perez/Chicago Tribune via Reuters
The murder trial for Chicago police officer Jason Van Dyke started with jury selection on Monday. The 40-year-old officer faces six counts of first-degree murder, one count of official misconduct and 16 additional counts of aggravated battery — one for each of the 16 shots fired — in the October 2014 fatal shooting of Laquan McDonald.
Police said McDonald was behaving erratically and holding a knife when he lunged at the officer, prompting the officer to shoot in self-defense. But video released a year later appears to show McDonald walking away from police, sparking widespread protests and ultimately Van Dyke’s trial.
Last week, prospective jurors were asked to fill out questionnaires that included about 125 questions. This week, attorney from both parties and prospective jurors will huddle in a small room next to the Judge Vincent Gaughan’s chambers for the process of jury selection.
The Chicago Tribune noted that this move is a departure from how juries are typically selected — inside a courtroom.
“[Judge Gaughan] believes the more intimate setting makes prospective jurors feel more comfortable answering sensitive questions,” the newspaper wrote, adding that the judge doesn’t want the jurors’ identities public, though attorneys, a small group of journalists and some members of the public will attend the proceedings. [The Chicago Tribune]
Why it matters: Four years after McDonald was shot, “trust in the police remains low, the homicide rate remains high, and new police shootings continue to bring tense protests,” the New York Times wrote this week.
Van Dyke spoke for the first time publicly about the shooting in recent weeks. After giving media interviews in the defense team’s offices, the judge issued Van Dyke a $200 fine, saying the interviews violated a court-imposed rule to not speak about the shooting publicly, the Associated Press reported. In those interviews, Van Dyke said the murder charge against him was political. The Tribune said Van Dyke lamented the “bandwagon of hated” on social media against him. Last week, the judge threatened to hold one of the defense team’s attorneys in contempt for “obstructing the administration of justice.”
After jury selection, the trial is expected to last for at least three weeks. How it plays out could have a notable impact on mistrust between local communities and the police.
People walk past election posters near the Swedish parliament in Stockholm, Sweden on September 10, 2018. TT News Agency/Soren Andersson via REUTERS
Sweden’s growing far-right party, the Sweden Democrats, saw its biggest gains yet in the country’s general election on Sunday. The anti-immigrant party with neo-Nazi roots ended with 17.6 percent of the vote and 63 seats in Sweden’s 349-seat parliament, according to Sweden public Broadcaster STV. That’s up 12.9 percent from the party’s hold in parliament after the last election.
The new surge came at the expense of the country’s two leading blocs. The center-left coalition, led by the ruling Social Democrats, captured 40.6 percent of the vote, and the opposition center-right Alliance, which took 40.3 percent of the vote.
With the remaining votes going to the Sweden Democrats, the far-right party stands in the way for either mainstream coalition to form a majority.
As results rolled in, Jimmie Akesson, the Sweden Democrats’ leader, told supporters at a rally he was willing to negotiate with the parties. But they both have previously said they would be unwilling to engage in talks — painting an uncertain picture of how the parliament’s eight parties will build a working government. [CNN]
Why it matters: Nearly 1 in 5 Swedish voters backed the Sweden Democrats, a party that campaigned hard-line immigration views and crystallized concerns among Swedish voters about crime and economy.
Much like other European countries, frustrations about immigration policy — that in part allowed roughly 163,000 asylum seekers to enter the Sweden in 2015 — fueled the populist party’s rise. Along with reinforcing shift toward ani-immigrant and far-right postures, Sweden’s election also underscored a fragmentation in Europe’s political landscapes — as the Guardian puts it, a “decline of the main parties is making it harder to form coalitions and pursue policies.”
Rescuers evacuate people from a flooded area to a safer place in Aluva in the southern state of Kerala, India, August 18, 2018. Photo by Sivaram V/Reuters
A political battle has ensued over the funding for efforts to recover from historic flooding in India’s Kerala state. The Kerala government has wanted to accept offers of foreign aid, but India’s central government has rejected help from other countries.
The United Arab Emirates, a country with a large population of expatriate Indian workers from Kerala, offered $100 million for flood relief. The offer was (politely) declined.
India “is committed to meeting the requirements for relief and rehabilitation through domestic efforts,” foreign ministry spokesman Raveesh Kumar said in a statement Wednesday night. “The government of India deeply appreciates offers from several countries, including from foreign governments, to assist in relief and rehabilitation efforts after the tragic floods in Kerala,” he continued.
Kerala’s Chief Minister Pinyari Vijayan said Wednesday that “it is only natural for nations to help each other.”
To this point, India’s central government has offered around $85 million in flood relief, about one-fourth of what Kerala has requested. Kerala’s finance minister argued that India’s government should compensate Kerala for the $100 million it rejected from UAE, the Associated Press reported.
Experts have said that the flooding could have been somewhat mitigated if dams were properly managed and began releasing water earlier, the BBC reported. It was only when flooding peaked that water from 80 plus dams was released, which may have actually worsened the flooding.
At least 50 high-power pumps have been deployed in affected areas, along with teams of plumbers and electricians working alongside 50,000 volunteers, the Times of India reported. [Associated Press and Times of India]
Why it matters: As of Aug. 22, the number of deaths caused by torrential rains surpassed 230, according to Reuters. More than 800,000 people were forced into relief shelters.
While floodwaters have slowed and begun receding, much of the state is still filled with slush, caked in mud and littered with debris. Many people in Kerala do not have clean drinking water, and the state is facing drug shortages to address a surge of waterborne diseases.
India has been refusing foreign aid since the 2004 tsunami struck and killed more than 12,000 people. The prime minister at the time set the policy that India would handle its own disasters and would only take aid if it reached out for it, according to The Indian Express.
If extreme weather patterns continue in Kerala, a southern state criss-crossed by a web of 44 rivers, and the Indian government continues to refuse foreign aid, it may complicate future flood relief efforts.
The Ocean Cleanup launched its first ocean trash collector from the San Francisco Bay on Saturday.The Ocean Cleanup / Banjamin Von Wong
A plastic-collecting machine departed the San Francisco Bay on Saturday and will be towed along 1,000 nautical miles until it reaches the Great Pacific Garbage Patch — a massive vortex of garbage collected by ocean currents between Hawaii and California.
The 2,000-foot long plastic-collecting system was developed by the Ocean Cleanup, a nonprofit that estimates its machine will clear half of the vortex’s plastic in the next five years.
Once it reaches the garbage patch and undergoes two weeks of testing, the unit’s giant tubes will be assembled into a U-shape to sit on the surface of the water and redirect debris that passes underneath it. A ship will visit every six weeks, and scoop up the accumulated plastic. If successful, the unit will be a solution to the millions of metric tons that are dumped into the ocean every year. [Business Insider]
Why it matters The Great Pacific Garbage Patch alone holds at least 87,000 tons of plastic and is twice the size of Texas.
While the Ocean Clean Up has deployed a number of prototypes since 2016 to test its plastic-collecting model, the system will be getting its first real test once it reaches the garbage patch.
Some members of the scientific community warn that the system might not be effective at collecting microplastics that make up the majority of oceanic plastic and sink deeper into the water. Others voiced concerns that the unit will pose a risk to marine life, by attracting fish and larger animals that could become entangled.
A preliminary environmental impact assessment commissioned by the Ocean Cleanup found some risk might come to sea turtles genting entangled as they seek shelter under the collected debris. But the report found that generally no serious harm will come to marine life surrounding the contraption.
Other skeptics have simply raised the point that the hyped-up technology will be a distraction from efforts to reduce excessive plastic consumption in the first place."
https://www.pbs.org/newshour/politics/michael-avenatti-visits-new-hampshire-as-he-considers-2020-bid,asylum seeker,572,2018-08-20T10:38:38-04:00,"Rob Wolfe, Associated Press",Michael Avenatti visits New Hampshire as he considers 2020 bid,"GREENFIELD, N.H. — An attorney who has bedeviled President Donald Trump during the past year over his personal relationships and immigration policies made a presidential pitch of his own to Democratic voters in New Hampshire on Sunday.
Michael Avenatti, who represents adult film actress Stormy Daniels in her case against Trump, told the Hillsborough County Democrats that he was considering matching Trump’s confrontational style with his own pugilistic brand in a 2020 presidential run.
“When they go low, we hit harder,” Avenatti said, modifying a former first lady Michelle Obama slogan.
Avenatti acknowledged that some of the roughly 200 voters at the outdoor barbecue might be thinking, “What is some porn lawyer doing here today?” But, he added, “As you all know, these are anything but usual times.”
Democrats today, he said, are fighting for “nothing short of the survival of our republic.”
Tracing his background, Avenatti said he had grown up in Missouri without a “golden toilet” — an allusion to the Trump family’s wealth — and was the first in his family to graduate from college.
As a trial lawyer, he said, he represented “Davids” against “Goliaths” — and still does now, he said, with his advocacy for Daniels, who says she was coerced into staying silent about her alleged relationship with Trump, and for immigrant families separated by the White House’s crackdown on asylum seekers at the border.
Michael Avenatti takes a picture with Helen Rice of Lake Mills, Iowa, during the Iowa Democratic Wing Ding in Clear Lake, Iowa. Photo by KC McGinnis/Reuters
Avenatti has put a toe in the 2020 race, posting a platform on Twitter and recently visiting Iowa, another key primary state that he will soon visit again. On Sunday, he said he was still seriously considering whether to run.
But “what I fear most is that (Democrats) have a tendency to bring nail clippers to a gunfight,” said Avenatti, who has gained notoriety for assailing Trump using the president’s favored medium, Twitter. Speaking to reporters later, Avenatti addressed some Democrats’ concerns about adopting Trump’s tactics, arguing that a successful challenger must be able to counter the president’s provocations. He praised Hillary Clinton’s resume and character, but noted that she lost the 2016 election despite being the most qualified candidate “in U.S. history.”
Avenatti was not the only politician at Sunday’s gathering to use Trump as a motivator for voters. Democratic candidates from county commissioner up to governor sought to tie local Republicans to the president.
Steve Marchand, a former mayor of Portsmouth running for governor, said the Republican incumbent, Chris Sununu, was linked to Trump “by complicity” with his policies on immigration, voter rights and education. Molly Kelly, a former state senator also competing in the Democratic gubernatorial primary, tied Sununu to Education Secretary Betsy DeVos through their support for an educational voucher system, which Kelly said “weakens public education and . will raise property taxes.”
Voters on hand appeared cautiously taken with Avenatti, who received a celebrity reception after arriving Sunday afternoon, stopping every few feet for a selfie photo as he slowly made his way through an energized crowd.
Kathy Boyer, a former law firm clerk from Amherst, said she liked Avenatti’s message and hoped he would prove a viable candidate, despite never having held political office.
“People said the same thing about Donald Trump,” she said. “Look what happened.”
READ MORE: Rudy Giuliani on hazards of Trump-Mueller interview: ‘Truth isn’t truth’"
https://www.pbs.org/newshour/nation/tears-hugs-and-help-church-groups-assist-reunited-families,asylum seeker,1147,2018-07-25T14:07:12-04:00,"Nomaan Merchant, Associated Press","Tears, hugs and help: Church groups assist reunited families","SAN ANTONIO — The immigrant parents arrived at Catholic Charities in white vans with their children, their paperwork and almost nothing else.
They needed food, clothing, a place to stay and a way to travel to family in the United States. Many were still shell-shocked from weeks in government detention. One father carried an infant who didn’t recognize him after two months apart. A mother held the hand of her 5-year-old daughter, who refused for a time to talk on the phone because she blamed her for their separation.
Scenes such as this are unfolding throughout Texas and Arizona as the Trump administration works to meet a Thursday deadline to reunite immigrant parents and children. The government is releasing hundreds of families to faith-based groups and leaving the groups to care for them.
The Associated Press observed newly reunited families spending their first day together Monday at Catholic Charities of the Archdiocese of San Antonio, which took them in after they were released from custody. The families included children as young as babies and old as teenagers, as well as asylum seekers fleeing violence in Central America and people who were shuttled around the country to various immigrant detention facilities.
___
THE REUNION
Natalia Oliveira da Silva, a mother from Brazil, waited nervously outside the immigration detention center in Pearsall, Texas, for her young daughter, Sara. She soon spotted the 5-year-old coming in a vehicle, a seatbelt over her chest.
Sara got out and was quickly in her mother’s arms, asking her, “They’re not going to take you away again, right?”
Since their separation in late May, the girl had been at a shelter for immigrant minors in Chicago, while Oliveira was moved through facilities across Texas.
Like other families reunited at Pearsall, Oliveira and her daughter were taken to Catholic Charities in San Antonio, about an hour’s drive away. Charity workers checked them into a hotel Sunday night and picked them up Monday morning, along with another immigrant family.
Oliveira, 30, had not slept the night before. Instead, she said, she watched Sara sleep next to her in bed.
At one point while they were detained, Sara refused to talk to her on the phone. She thinks it’s because Sara was angry about what had happened. She’s still angry herself.
“I hope she doesn’t have any memories of this,” Oliveira said.
___
THE DROP-OFF
When Oliveira and her daughter arrived at the Catholic Charities office, two people held open the doors and said “hola.” Inside, volunteers were folding donated clothes and preparing for the day ahead. A local restaurant had dropped off a catered meal of tortillas, beef and grilled vegetables. In a conference room upstairs, parents could pick from shopping racks of clothes and boxes of toys for the children.
U.S. Immigration and Customs Enforcement had notified Catholic Charities in the morning to expect seven families to be dropped off. Catholic Charities also takes in families that ICE drops directly at the local bus station, but who might otherwise have to stay there overnight or change several buses to reach their destination. Volunteers from a local interfaith group keep watch at the station for immigrant families and call Catholic Charities when they see them.
Drop-offs usually happen in the afternoon or early evening. But the first time that ICE sent families to Catholic Charities, two weeks ago, it didn’t release families until around 3 a.m. And Catholic Charities once found the families it was expecting to receive dropped off at the bus station instead.
“The logic behind how they decide that, we don’t know,” said Matthew Martinez, the group’s vice president of administration.
Caseworkers purchase plane tickets for families and have phones available to call the friend or relative sponsoring them. They also provide hotel rooms for families waiting for buses or planes.
To fund the effort, Catholic Charities has raised $127,000 and received the help of more than 300 volunteers.
___
THE BONDING
After the reunions, the mood inside the waiting area brightened from somber to joyful.
A group of boys started to play with a foam soccer ball. The younger children played with toy trucks and guitars. Parents holding their children laughed and swapped stories about where they were headed next. Most families were headed to distant locations, from California to Florida.
Many told horror stories about their ordeals, all while cherishing the fact that they had their children back.
Carlos Fuentes Maldonado of Honduras held his 1-year-old daughter, Mia. She and her 4-year-old sister had been taken to a shelter in Arizona shortly after they had tried to cross the Rio Grande about two months earlier. Their mother, Jennifer Maradiaga, said Mia was still breast-feeding at the time they crossed and she was taken away.
When they got her back Monday, the little girl didn’t immediately appear to recognize them, Fuentes said. By the evening, she was nestled on her father’s shoulder.
Around 8 p.m., Maradiaga’s mother and brother arrived to pick them up and take them home. Her mother began to cry as they hugged, holding her daughter’s cheek against hers for several seconds. The members of the family smiled and laughed, taking turns holding Mia.
Other parents recalled how the food in adult detention facilities was sometimes inedible and that detention officers disregarded their complaints or requests. Two mothers said officers told them they might never see their children again. They were watching Spanish-language television when they learned of the Trump administration’s announcement that it would end mass separations.
“Seeing the protests gave us all encouragement,” said Ildra Medrano Castillo, who brought her 9-year-old son from Guatemala. She said an officer at one facility told her son would be put up for adoption.
They had been reunited a few hours before and sat together, eating lunch. Her eyes filled with tears and she laughed when asked what that moment was like.
“It was wonderful,” she said.
___
THE TRIP
The group’s staff took other families to nearby hotels to await their flights the next day. Staff members instructed the families how to use the elevator, since some have never been in one before.
The first wake-ups were at 2 a.m. Tuesday, for a 5 a.m. departure.
“They were tired, but they were happy. They were excited,” said Thelma Gutierrez, the director of one of Catholic Charities’ local shelters for immigrant children.
The parents had their boarding passes and packets of information, along with an information card written in English that they could show if they needed help along the way. Some of them were nervous about what a flight would be like, Gutierrez said.
The staff did several rounds of drop-offs at the airport before dawn, taking a total of 32 people.
“We’re going to do what’s right for them,” Gutierrez said. “For now, this is all we can do.”
___
Associated Press photographer Eric Gay contributed to this report."
