href,keyword,word_count,info,author,headline,article_text
https://www.pbs.org/newshour/nation/fallout-grows-trumps-new-immigration-crackdown,asylum seeker,768,2017-01-28T16:11:54-05:00,"Alicia A. Caldwell, Associated Press",Fallout grows from Trump’s new immigration crackdown,"WASHINGTON — The fallout grew Saturday from President Donald Trump’s immigration crackdown as U.S. legal permanent residents and visa-holders from seven Muslim-majority countries who had left the United States found they could not return for 90 days.
It was a period of limbo for an unknown number of non-American citizens from Iraq, Syria, Iran, Sudan, Libya, Somalia or Yemen now barred from the country where they were studying or had lived, perhaps for years.
A federal law enforcement official who confirmed the temporary ban said there was an exemption for foreigners whose entry is in the U.S. national interest. It was not immediately clear how that exemption might be applied.
Trump’s order exempts diplomats.
Those already in the U.S. with a visa or green card will be allowed to stay, according to the official, who wasn’t authorized to publicly discuss the details of how Trump’s order was being put in place and spoke only on condition of anonymity.
Customs and Border Protection was notifying airlines about passengers whose visas had been canceled or legal residents scheduled to fly back to the U.S. Airlines were being told to keep them off those flights.
Trump’s order barred all refugees from entering the U.S. for four months, and indefinitely halted any from Syria. He said the ban was needed to keep out “radical Islamic terrorists.”
The next group of refugees was due to arrive in the U.S. on Monday, but the official said they would not be allowed into the country.
READ NEXT: ‘All our hopes and dreams vanished’ — Syrian refugees devastated as Trump bans them
The president’s order immediately suspended for four months a program that last year resettled in the U.S. roughly 85,000 people displaced by war, political oppression, hunger and religious prejudice. An immediately 90-day ban was put in place for all immigration to the U.S. from the seven Muslim majority nations.
Trump’s order singled out Syrians for the most aggressive ban, ordering that anyone from that country, including those fleeing civil war, are indefinitely blocked from coming to the U.S.
“We want to ensure that we are not admitting into our country the very threats our soldiers are fighting overseas,” Trump said as he signed the order at the Pentagon. “We only want to admit those into our country who will support our country and love deeply our people.”
Trump’s ban on asylum-seekers came down even as Iraqis endangered by work for the United States in their home country were midflight to their hoped-for refuge in the United States. As a result, they and countless other refugees, their families and aid workers scrambled Saturday as Muslim travelers were turned back on arrival at U.S. airports or blocked from boarding flights to America.
Organizations including the International Refugees Assistance Project, which helps former Iraqi translators for the U.S. military and other refugees seeking entry to the United States, and other organizations aiding asylum-seekers, rushed translators and lawyers to airports to try to help U.S.-approved asylum-seekers already on their way to the country as Trump’s ban came down.
Trump said the halt in the refugee program was necessary to give agencies time to develop a stricter screening system. While the order did not spell out what additional steps he wants the departments of Homeland Security and State to take, the president directed officials to review the refugee application and approval process and find any more measures that could prevent those who pose a threat from using the refugee program.
The U.S. may admit refugees on a case-by-case basis during the freeze, and the government will continue to process requests from people claiming religious persecution, “provided that the religion of the individual is a minority religion in the individual’s country.”
In an interview with CBN News, Trump said persecuted Christians would be given priority in applying for refugee status.
As a candidate, Trump called for a temporary ban on all Muslim immigration to the U.S. He later shifted his focus to putting in place “extreme vetting” procedures to screen people coming to the U.S. from countries with terrorism ties.
The Council on American-Islamic Relations said it would challenge the constitutionality of the executive order.
During the past budget year, the U.S. accepted 84,995 refugees, including 12,587 people from Syria. President Barack Obama had set the refugee limit for this budget year at 110,000.
According to Trump’s executive order, he plans to cut that to 50,000. Refugee processing was suspended in the immediate aftermath of the Sept. 11 attacks and restarted months later.
Associated Press writers Ken Thomas in Washington and Ellen Knickmeyer in San Francisco contributed to this report."
https://www.pbs.org/newshour/world/merkel-supports-international-cooperation-advance-trump-presidency,asylum seeker,480,2017-01-14T14:43:48-05:00,Associated Press,Merkel supports international cooperation in advance of Trump presidency,"BERLIN — German Chancellor Angela Merkel is stressing as she awaits Donald Trump’s inauguration that the world’s problems need solving in cooperation, rather than by each country individually.
Asked at a news conference Saturday about protectionist tendencies in the U.S., Merkel said she will seek a dialogue with the new president.
“I don’t want to get ahead of that, but I am very much convinced that we as partners benefit more if we act together than if everyone solves problems for themselves, and that is a constant fundamental attitude on my part,” she said.
Underlining the importance of the Group of 20 industrial powers, which Germany chairs this year, she said that the international response to the financial crisis “was not a response based on isolation, but a response based on cooperation, on common rules for regulating financial markets, and I think that is the promising path.”
Merkel has made clear that she’s unhappy about the possible demise of the Trans-Pacific Partnership trade agreement as a result of Trump’s desire to withdraw the United States. Trump has criticized Merkel’s decision to allow large numbers of migrants into Germany.
READ NEXT: Germany may spend $106 billion on refugees in next five years
Merkel said there are contacts “at adviser level” with Trump’s team, though there was no immediate word on any plans for a meeting beyond the summits of the Group of Seven and G-20 in May and July respectively. Merkel will host the latter summit in the German city of Hamburg.
“We’ll wait for the inauguration and then we will talk about this,” she said at a news conference. Trump will be inaugurated on Friday.
Merkel is seeking a fourth term in an election expected in September. Leaders of her conservative Christian Democratic Union met Friday and Saturday in Perl, in western Saarland state, to kick off the election year — which also features three state elections, the first in Saarland in March.
Merkel has said she expects her most difficult election yet, though she was confident Saturday that a simmering dispute with her allies in Bavaria, the Christian Social Union, won’t get in the way of a joint conservative campaign.
The CSU has demanded for the past year an annual cap of 200,000 on the number of refugees Germany accepts, an idea Merkel rejects. Germany saw 890,000 asylum-seekers arrive in 2015 and 280,000 last year.
Merkel said leaders of her party agreed “that we can live with such a disagreement.”
She renewed her pledge of improved security following last month’s deadly attack on a Berlin Christmas market. “We are making clear that every person has a right to security, and only those who are secure can live in freedom,” she said.
Germany’s 16 states must have the same security standards, Merkel said, arguing that it’s not sensible for regions to have different rules on matters such as video surveillance."
https://www.pbs.org/newshour/economy/column-italys-referendum-means-european-union,asylum seeker,1129,2016-12-01T08:12:12-05:00,Vikram Mansharamani,Column: What Italy’s referendum means for the European Union,"This weekend, Italians will vote on constitutional changes proposed by Prime Minister Matteo Renzi. And although the vote is technically about reforms the 41-year-old former Mayor of Florence wants to implement, Italians no longer see it that way. It’s now a vote about the nation, its leadership and possibly even its future relationship with Europe. Anti-establishment populists have rallied the citizenry against Renzi and the governing elites. This Sunday’s vote, The Economist notes, is effectively a “Renzi-ferendum.”
The irony is that Renzi rose to power on a promise to radically reform the Italian government. But even before he was elected Prime Minister in 2014, he was known as “Il Rottamatore,” meaning “The Demolition Man,” of Italian politics. He earned the nickname by incessantly lampooning the government and pledging to upend the country’s political establishment. Today, he’s deemed part of the establishment.
Believing institutional paralysis to be one of Italy’s biggest problems, Renzi is trying to improve the country’s governability by assuring greater political stability and streamlining the legislative process. Specifically, Renzi’s plan would reduce the size and authority of the Senate, clarify responsibilities in areas where regional and central government jurisdictions overlap and remove a layer of local government.
In part because of the Senate’s existing powers, the country has had 63 governments in the last 70 years (and no, that’s not a typo). But, as The Economist notes, “the mayfly-like lifespans of Italian governments is not the sole reason” that it is difficult to govern Italy. Legislative gridlock is another.
Because of equal powers given to both houses in the parliament, legislation can bounce between the two bodies until it is approved in identical form. It’s not unusual for bills to be debated for years. For example, a bill that makes torture an offense has been discussed in the Italian parliament for 27 years, most recently in July.
Given these dynamics, you might imagine support for the reforms would be strong. You’d be mistaken.
Renzi’s announcement that he would resign if the referendum failed changed the dynamics around the upcoming vote. It went from being about the reforms to being about him. One poll cited by The Guardian found “only 40% of Italians say they will vote on the reform package; 56% consider their vote to be more a verdict on the prime minister, his government and, by implication, the state of the nation.”
Italian Prime Minister Matteo Renzi attends a joint news conference with U.S. President Barack Obama in the Rose Garden of the White House in Washington, U.S., October 18, 2016. REUTERS/Carlos Barria/File Photo – RTX2U8W7
Further, Mario Margiocco asserts “to vote ‘no’ is to vote against the system and all its corruption…and who isn’t against corruption?” Even The Economist, citing risks to the emergence of a unaccountable strongman, advised, “No is how Italians should vote.” The last poll published before the vote indicated 55 percent opposition to the reforms.
The economy isn’t helping Renzi’s cause. The country’s GDP is smaller than it was before the financial crisis. But because of population growth, GDP per capita is today roughly where it was in the late 1990s. Employment levels in Italy are the second lowest in Europe, slightly better than Greece, and the country’s debt-to-GDP ratio is above 130 percent. And the banking industry, Europe’s fourth largest, is teetering under $400 billion of problem loans, equivalent to more than 20 percent of the country’s GDP. At one point earlier this year, Monte dei Paschi di Siena, the world’s oldest bank, had problem loans of more than 50 times its market capitalization. The overhang of bad loans is starving Italian entrepreneurs and small business owners of capital they need to grow.
There’s also the migrant crisis. According to the UN refugee agency and the Italian government, more than 170,000 asylum seekers have reached Italy by boat so far this year, exceeding the standing record set in 2014. One reason for the recent surge, notes The Guardian, is that greater Turkish policing and aggressive deportation threats by Greek officials have resulted in “the Italian route once again becoming the main migrant gateway into Europe.”
Unsurprisingly, the combination of economic malaise and record migrant inflows is bolstering populists. Two groups in particular stand to win if Renzi loses: the populist Five Star Movement and the anti-immigrant Northern League. Both are anti-establishment organizations that question the value Italy receives from being part of the European Monetary Union or from using the euro as its currency. As a result of this setup, the stakes of the December 4th vote are enormous. A Renzi defeat may affect Italy’s future relationship with Brussels.
Could this weekend’s vote lead to Italy’s exit from the European Union and a reversion to the lira? The logic is straightforward: Renzi loses, anti-establishment parties come to power, Italy exits. A believable story, for sure. Because of these dynamics, my friend John Mauldin has said “a ‘no’ vote would be the death knell for the euro.” And if you believe, as I do, that Europeans will ultimately choose individual countries with their own currencies instead of opting to join the United States of Europe, then a Renzi loss might help speed along an already unfolding process.
But on the other hand, it’s also possible that a ‘no’ vote doesn’t directly affect the euro’s short-term viability. A poll published earlier this month found that only 15.2 percent of Italians were in favor of leaving the single currency, “with 67.4% declaring themselves true single currency believers.” Although our recent experience with polls in the United States and the United Kingdom may lead us to skeptically interpret their conclusions, our prior faith in polls was based on their historical accuracy. It would be foolish to dismiss the data entirely.
If the referendum fails to pass and Renzi resigns, one thing is certain — market volatility and political uncertainty will increase. One report suggests that investor confidence would plunge, and up to eight Italian banks might fail if the reforms are rejected. The fear might spread to Europe more generally, leading to a materially weaker euro as capital flees the continent. If this happens, the U.S. dollar would likely strengthen. And Italy might call for an early election next year, creating a situation in which, as noted by Bloomberg, “governments accounting for more than 75% of the euro area GDP would be in play in just one year.”
A Renzi victory, on the other hand, might turn the anti-globalization tide and help Italy attract much needed capital for its banks and economy. It might even deter citizens of France, Austria and other countries from voting in populist leaders. As for the currency impact, that is less clear.
In either case, the hard work of reforming the Italian system (and fixing Europe) still lies ahead."
https://www.pbs.org/newshour/world/syrian-youth-come-of-age-through-five-years-of-war,asylum seeker,1591,2016-03-15T10:27:08-04:00,"Charles Sennott, The GroundTruth Project",Syrian youth come of age through five years of war,"Border of Despair: Lebanon from GroundTruth on Vimeo.
BEKAA VALLEY, Lebanon — They are two faces of what many here fear is a “lost generation” of Syrian refugees.
The tender, smooth face of Batoul, 14, was revealed when she adjusted a traditional headscarf, showing no physical wounds of the brutal war that began in her native Syria five years ago this month.
But as she wiped away a tear and explained the decision her parents made to offer her hand as a child bride at the age of 13, the wounds pushed to the surface: “I feel trapped now. I feel like I am in prison.”
Mohammed, 13, whose family also fled the war in neighboring Syria, tried his best to steel his face with confidence as he spoke of his days working in a metal shop, missing several years of schooling yet holding on to his dream to become a scientist. Still, the sorrow came through every word of a popular poem about the war, which he recited from memory:
“Syria, five years and more of a crazy and selfish and illogical war.
Five years in which souls, hearts and minds have been destroyed…”
These are two faces among more than 4.8 million refugees — about half of whom are children — who fled the war in Syria to neighboring countries and to Europe, spurring a refugee crisis which the United Nations High Commissioner for Refugees has called the worst since World War II.
The conflict began on March 15, 2011 in the cities of Damascus and Aleppo, when President Bashar al-Assad ordered armed troops to move in on what had been largely nonviolent protests.
In the five years since, Assad’s regime has steadily stepped up attacks with tanks and airstrikes against an armed opposition and the civilian population. An amalgam of armed groups fractured into militias and then splintered further into Islamic extremist insurgents including the self-proclaimed Islamic State group.
An estimated 300,000 people have been killed and hundreds of thousands more wounded. In addition to the 4.8 million refugees, there are some 6 million internally displaced people in Syria, according to the United Nations.
A tenuous “cessation of hostilities” was put in place last month, and peace talks are getting underway again in Geneva this month. But few international observers believe the end of the war is in sight. The neighboring countries of Lebanon, Jordan and Turkey are now restricting the wave of refugees trying to cross over from Syria.
And the European Union, which accepted a wave of asylum-seekers over the summer, is now grappling with a realization that the refugee crisis is untenable, and countries there are securing their borders as well.
Meanwhile, in the muddy warrens of the informal tented settlements, where refugees are scratching out an existence in Lebanon, the U.N. food subsidy of $184 per month per family is often not enough. Life is getting harder and harder, particularly for the children.
Syrian refugee Batoul was married to her cousin at age 13. Photo by Christopher Lee for The GroundTruth Project
Girls like Batoul are being married off as child brides because their parents can’t afford to keep them or because their families fear sexual assault and harassment, which advocates and aid workers say is rampant in the chaos of the camps. Children of both sexes, they add, also are exploited physically and sexually.
Because men are not permitted to work in the host countries like Lebanon, where official work permits are hard — if not impossible — to come by, children are often forced to work in agriculture or factories or peddle on the streets. Aid workers call it a “lost generation” of Syrian children who have fallen far behind in schooling and who suffer greatly from collective trauma.
“That is ultimately the saddest,” said Maeve Murphy, head of UNICEF in Lebanon’s Bekaa Valley, where many of these refugees have settled to wait out the war. “You see young people whose dreams will never materialize unless they have some stability and unless they are able to access education.”
Batoul sat beside her mother and father, who could not hold back tears as they described escaping the fighting that surrounded their home in Homs, Syria’s third largest city and a key battleground in the uprising against the regime. They recounted the troubles they’ve faced as refugees in Lebanon. Her father, Mohammad, 41, was a mason who made a decent living in Syria pouring foundations for new homes and buildings before the family fled Homs in 2012.
Now, they live in a corrugated tin hut with UNHCR canvas for a roof. Over the last four years, Batoul’s father said all of their savings disappeared. The economic desperation that set in, along with the parents’ deep concerns for their daughter’s protection, forced Mohammad to allow his beloved daughter to be taken as a child bride by her cousin. Both he and Batoul’s mother now regret that decision.
“If God would allow us to undo what we have done, we would do it,” said Batoul’s mother, Amina, 33, through tears which she dabbed with a traditional headscarf. “We put a burden on her that she can’t handle. It was a terrible mistake. We have stolen her childhood.”
Two brothers sell candy bars in Barelias, Lebanon, to try to earn some income for their family on Jan. 22. Photo by Christopher Lee for The GroundTruth Project
Aid workers and advocates say child marriages are happening at an alarming rate for Syrian girls as young as 12 years old. But because these marriages fall under Islamic religious laws, which by some Quranic interpretations permit brides as young as 9, the government in Lebanon looks the other way.
At the same time, women’s rights organizations have railed against the practice as a human rights violation and as a health risk. The second highest cause of death for girls 15 to 19 is complications during childbirth, according to the World Health Organization.
Amina is despondent over her daughter’s fate, and is worried about her psychological and physical wellbeing. Recently, Amina has begun working with an advocacy center for women and girls that tries to help refugee families avoid the mistake she made. She’s tried to instill this spirit of advocacy for the rights of women in Batoul, as well, who says she wants to be a lawyer.
“I want to help other women and be sure they know their rights,” said Batoul.
Patricia Mouamar, communications director for World Vision in Lebanon, explained that in her experience the number of child brides is on the rise: “There are no official statistics when it comes to early marriage. But I have been seeing refugees for the last five years. And every time I come I meet a family that has to make this difficult decision.”
Amina said she feels she has lost her daughter, adding, “I don’t think about the future, I don’t think about hope.”
But Batoul tried to comfort her mother on a visit home on a recent afternoon, saying, “I do have a lot of hope, hope in returning to Syria. There will be better days than these days. Even if there are problems, they will be better than the problems here.”
More than 1 million Syrian refugees have fled to Lebanon, some of whom live in this camp in the city of Barelias in central Lebanon. Photo by Christopher Lee for The GroundTruth Project
That sense of resiliency was not uncommon among many of the young people we interviewed in the ramshackle communities of tents that dot the landscape in the flat, fertile land of the Bekaa Valley. Syrian children seemed to be everywhere here, working in tire repair shops and gas stations and sweeping the floors at local produce markets.
“Child labor is a phenomenon that has been increasing. These children should not be on the streets, they should be playing and they should be going to school. Sadly, it is not happening because they have to survive. When it comes to basic instincts for survival, you have to do what you have to do to survive and help your family,” said Mouamar.
At one World Vision youth center, part of a program known as a Child Friendly Space which offers a protective community and remedial schooling, the 13-year-old Mohammed stood out from a crowd of young boys. He puts long hours in at the metal shop, and talked about memories of his home in Syria: “I remember my friends and I miss my school. Syria is so beautiful. More beautiful than here.”
Mohammed carried himself with great confidence, as he recited the poem titled “To Our Country.” The poem, he explained, was written by Syrian sisters Rihan and Faia Younan and became a viral sensation on YouTube.
Many Syrian children have committed it to memory, as he has:
“A war that sneaked through doors to settle down inside the home and humiliate their owners.
A war in which children and women were sold in slave markets.
A war that brought the nation’s mothers to tears, and exhausted its men.
A war that never knew its beginning.
A war that dreams of an end.”
This piece is part of a reporting fellowship that included photographer Christopher Lee and videographer Oscar Durand, whose work was supported in part by World Vision. You can read more about the project and the fellowship at GroundTruth: “Border of Despair: Syrians Fear Losing a Generation to War.” To protect their identity, the last names of children were not included in this story."
