href,keyword,word_count,info,author,headline,article_text
https://www.pbs.org/newshour/world/haitians-flock-to-canada-concerned-about-losing-protected-status-in-u-s,asylum seeker,316,2017-08-11T07:53:20-04:00,Larisa Epatko,"Haitians flock to Canada, concerned about losing protected status in U.S.","Canada is scrambling to prepare temporary housing for an influx of people entering from the United States and seeking asylum.
About 250 asylum seekers, mainly from Haiti, are entering Montreal in French-speaking Quebec province each day, Reuters reported.
Soldiers are setting up tents along the border while officials process the new arrivals.
RELATED: More people are entering Canada illegally, but no one knows for sure why
“We are aware of irregular border crossings by individuals who request refugee protection upon arrival in Canada,” the nation’s Immigration and Citizenship agency said in a Facebook post. “In some countries, messages have been circulating through channels such as WhatsApp which suggest that Canada is inviting individuals to seek refugee status here.
“In fact, the government of Canada discourages people from entering Canada outside of designated ports of entry as it can be dangerous and is a violation of the law.” The post links to the proper procedure to claim refugee protection.
An estimated 250 asylum seekers are entering Montreal, Canada, each day. Photo by Christinne Muschi/Reuters
Haitians in particular are flowing into the country because their temporary protected status will expire in January, unless the Department of Homeland Security extends it. The U.S. granted Haitians the protection from deportation following the massive 2010 earthquake.
When renewing the status in May, officials said conditions in Haiti were improving so the program might not be extended again.
A Royal Canadian Mounted Police officer instructs people waiting in line to enter Canada. Photo by Christinne Muschi/Reuters
Olympic Stadium in Montreal is being used as temporary housing for asylum seekers. Photo by Christinne Muschi/Reuters
Members of the Canadian Armed Forces are erecting tents to house asylum seekers at the Canada-U.S. border in Lacolle, Quebec, on Aug. 9. Photo by Christinne Muschi/Reuters
Members of the Canadian Armed Forces carry wooden flooring into the tents they set up for asylum seekers. Photo by Christinne Muschi/Reuters"
https://www.pbs.org/newshour/nation/5-stories-probably-missed-deserve-closer-look,asylum seeker,2341,2017-08-09T10:42:40-04:00,Joshua Barajas,5 stories you probably missed that deserve a closer look,"The White House had a difficult time last week defending some of the president’s statements. The issue: reconciling what he said happened with what actually happened.
The Boy Scouts of America pushed back Wednesday on a claim from the president that the organization had called him to say his address at their annual meeting the week before was the “greatest speech that was ever made to them.” In fact, the Boy Scouts said, they didn’t believe a call like that was ever made.
On Thursday, the Washington Post published a similarly contradictory transcript of the president’s January call with Australia’s prime minister. On Twitter, Trump had called the exchange “civil.” But according to the transcript, it was … not.
The Post also found discrepancies in a transcript of the president’s early call with Mexico President Enrique Pena Nieto.
While what the president says (or doesn’t say) continues to capture headlines, here are five important stories that deserve your attention, too.
1. Canada is struggling to deal with asylum seekers fleeing the U.S.
Refugees and some of their Canadians supporters mingle outside Olympic Stadium in Montreal, Quebec, August 5, 2017. Photo by Geoff Robins/AFP/Getty Images
Last week, officials in Montreal had to convert Olympic Stadium into a temporary shelter to house the influx of asylum seekers they’ve intercepted crossing the U.S. border into Canada. As of July, Canada has already admitted 75 percent as many asylum seekers as were admitted in 2016, and the rate of new arrivals recently jumped from about 50 per day to 150 per day, CNN reports. One hundred and fifty cots have been setup in the stadium to help house the new arrivals.
Haitians who were granted asylum in the U.S. after the 2010 earthquake have been unsure of their status since President Trump signaled he’d like to end the program that grants them residence and the right to work in May.
But handling the asylum seekers is a challenge for Canada as well, and the latest influx, who have to avoid crossing the border at official checkpoints to maintain their asylum status, is leading some Canadians to call for Prime Minister Justin Trudeau to review polices for refugee admittance, the New York Times reports.
Why it’s important
Immigrant communities are on edge in the U.S. after an uptick of ICE raids, deportations, and increasingly harsh rhetoric about immigration coming from the White House. Meanwhile, ICE has denied that much has changed about how they carry out deportations, despite evidence to the contrary. This uncertainty can have unexpected consequences.
Earlier this year, for instance, the Los Angles police department reported that Latinos have been less likely to report sexual assaults in this new environment, due to their fears of deportation.
Last week, ICE detained two brothers during a regular check-in with authorities and deported them to El Salvador. The men had been motivated to contact ICE to notify the agency of their plans to attend college, one on a scholarship.
PBS NewsHour Weekend explored the trend of immigrants fleeing the U.S. into Canada in April.
2. Why are acid attacks on the rise in the UK?
(function(d, s, id) { var js, fjs = d.getElementsByTagName(s)[0]; if (d.getElementById(id)) return; js = d.createElement(s); js.id = id; js.src = ""//connect.facebook.net/en_US/sdk.js#xfbml=1&version=v2.10""; fjs.parentNode.insertBefore(js, fjs);}(document, 'script', 'facebook-jssdk'));
Acid attack victim Jameel Muhktar tells his shocking story
“I honestly feel that if this was a white person attacked by an Asian…it’d be all over the news.” Jameel Muhktar and his cousin had acid thrown in their car eight days ago – he told Assed Baig the shocking story of the incident and its aftermath.
Posted by Channel 4 News on Thursday, June 29, 2017
On Friday, UK police arrested four teenagers in London who were thought to be involved in acid attacks, the BBC reported. Authorities said the teens were not detained in connection to a specific incident.
The arrests follow an incident in late June in which a man doused Resham Khan with acid on her 21st birthday. Khan and her cousin, Jameel Mukhtar, 37, were waiting in traffic when a man approached their vehicle and threw the corrosive substance at them.
Authorities are treating the incident as a hate crime.
Mukhtar, who doctors had to place in a medically-induced coma so they could treat his injuries, criticized the response from police.
“I honestly feel that if this was a white person that got attacked by an Asian person, he’d be caught within 24 hours. It would be all over the news, there’s be a national manhunt,” he told Channel 4 News.
No arrests have been made yet.
Khan has been documenting her recovery (with some levity) on Twitter.
“Throughout my treatment, I would question the doctors and police about my attack. How did the attacker get acid? Where is it from? Who does that? Is it a trend? Where did the idea come from? Is this common?” Khan said in a blog post on her website. “And the answers I got were the truth, but not enough.”
Why it’s important
Acid attacks are on the rise in the UK. According to latest figures from the Metropolitan Police, there were 261 acid attacks in 2015 and 454 in 2016, the BBC reported. This year, the number of attacks involving an attacker throwing corrosive liquid onto a victim is expected to surpass those levels.
Police told The Guardian they suspect the spike in attacks is related to organized crime, pointing to a similar mode of transportation — mopeds — to carry out the attacks as one piece of evidence that they are linked to gang activity.
Medical professionals are now offering guidelines on how bystanders can best treat victims in an acid attack, including washing the affected areas with lots of water.
For instance, many think a bottle of water is sufficient to wash away acid, when, in fact, it can take over 10 gallons of water to properly dilute it, Dr. Johann Grundlingh says.
“We’ve seen people who have had highly concentrated acids thrown at them but they washed it off so quickly with a lot of water, that they only really end up with what looks like a bad sunburn,” Grundlingh, a consultant in emergency medicine, told Stat News. “And then you get other people who have had a weaker acid on them, but they didn’t take it that seriously, they didn’t really wash it off effectively, and then they end up with quite severe scarring.”
Meanwhile, Parliament is planning to meet next week with police officials as it weighs tougher laws and sentencing around acid attacks, The Guardian reported.
3. Is the so-called “nuclear renaissance” slowing down in the U.S.?
The Vogtle Electric Generating Plant in Georgia signaled concerns about rising costs that nearly doubled their initial estimates. Photo by Pallava Bagla/Corbis via Getty Images
About a decade ago, South Carolina and Georgia green-lit nuclear power reactors in their states. These new reactors would be among the nation’s first additions to an aging nuclear fleet in three decades.
But early last week, the V.C. Summer nuclear plant in South Carolina announced that it was halting the project, citing ballooning costs. The project’s tab was heading toward $23 billion, analysts said, nearly double its initial estimate of $14 billion.
Days later, the Vogtle Electric Generating Plant in Georgia signaled similar concerns about rising costs that nearly doubled their initial estimates. While the utility company there has promised to press forward, the future looks bleak for what had once been promising nuclear reactors in the U.S.
Why it’s important
In both cases, the utility companies behind these projects cited problems beyond not being economically feasible. There were construction delays, manufacturing problems and, in particular, bankruptcy woes for the contractor connected to the nuclear project in South Carolina.
And other reactors have faced problems, too. The Tennessee Valley Authority’s Watts Bar 2 nuclear power plant first became operational in 2016 and was touted as the nation’s “first new nuclear generation of the 21st century.” But it shut down five months later for a broken condenser. It only became operational again last week.
Rochelle Becker, executive director of the Alliance for Nuclear Responsibility, referred to the reactors as “very expensive dominoes that are falling.”
“With the price of natural gas and the availability of renewable and new sources that are continuing to hit the market, nuclear is pretty much dead in this country,” Becker, a critic of the plants, told The San Diego Union Tribune.
“It doesn’t surprise me at all that these plants are getting canceled,” he added.
Now, with the project in South Carolina out, the Vogtle plant in Georgia could be the only new reactor under construction in the U.S.
On a conference call with analysts, the chief owner of Southern Co. emphasized the company’s resolve to finish the project, The Wall Street Journal reported.
“When you abandon, you have nothing to show for the amount of money you have spent,” Southern chairman Thomas A. Fanning said. “If you go forward, you have a nuclear plant that will serve us for decades to come.”
4. An ancient asteroid family reveals clues about the birth of the solar system
Illustration by NASA’s Goddard Space Flight Center Conceptual Image Lab
An international team of scientists tipped a long-standing debate Thursday with the discovery of an asteroid family nearly as old as the solar system.
Their work uncovers how some of the first asteroids formed 4 billion years ago and point to how planets like Earth came to be.
“This family is like a big missing piece of a puzzle that we found,” said Marco Delbo, a planetary scientist at the Observatoire de la Côte d’Azur in Nice, France, and the study’s lead investigator.
Asteroid families form when one asteroid hits another. The asteroid pieces that break off from the collision are a family — they orbit together as a scar of the original impact. Small pieces spread out farther and wider than larger fragments, which remain clustered near the point of impact. Together the pieces form a shape like the letter “V.”
This V formation can expose the age of an asteroid family. The longer it’s been since the initial collision, the more time smaller pieces have had to spread out into the belt.
In 2012, Delbo and his team launched an asteroid belt treasure hunt to learn as much as possible about dark asteroid families in the region of the belt closest to Earth and Mars.
The researchers discovered this ancient asteroid family based on its unique V shape.
“We discovered this family that is more ancient than anything we know,” Delbo said.
Why it’s important
The OSIRIS-REx probe is headed to Bennu, a roughly spherical asteroid measuring about 1,614 feet (492 meters) in diameter. Photo by NASA’s Goddard Space Flight Center Conceptual Image Lab
Beyond the edge of the newly-identified family is a void, where only a few orphan asteroids live.
“This is the holy grail of the asteroids,” Delbo said, in part because they are the “original settlers” — they existed in the inner belt before anything else.
These orphan asteroids are large, ranging from 21 to about 93 miles across. Their size suggests the solar system was likely formed by gravitational collapse — a recent hypothesis that posits sizable celestial bodies formed from an accumulation of space dust that gravity suddenly collapsed into large objects. In the past, people thought this space dust had aggregated over a much longer period of time.
Delbo’s study provides evidence for the gravitational collapse hypothesis by suggesting the oldest asteroids started out large, and then became smaller through collisions and other destructive forces happening in the ancient solar system. Planetary scientists have been debating this hypothesis for nearly a decade.
NASA’s OSIRIS-REx mission will visit the region Delbo studied when it stops at the near-Earth asteroid Bennu and collects a sample. Bennu is almost certainly a member of one of these dark asteroid families, Delbo said, and could offer even more clues about the origins of the solar system.
5. Do you know what’s in your eyeliner? The FDA says it has limited resources to inspect beauty products shipped to the U.S.
The Food and Drug Administration says it wants more thorough inspections of makeup imports. Photo by REUTERS/Lucas Jackson.
At least three million cosmetic shipments make their way to the U.S. every year. Unbeknownst to many beauty enthusiasts, some of those cosmetics — including nail polish, face powders, tattoo inks, eyeliners and lipstick — contain high levels of metal or contamination from things like mercury, bacteria and asbestos.
Now, the Food and Drug Administration says it wants more thorough inspections of makeup imports. But it told Congress last week that it has “limited resources” to make them happen, The New York Times reported.
The FDA only has approximately six full-time inspectors to monitor the millions of shipments of product it receives each year, the Times reported. That means fewer than 1 percent of the makeup that comes into the country is examined.
About 15 percent of what those employees were able to inspect was problematic, the FDA says.
Rep. Frank Pallone Jr., D-N.J., a top politician on the House Energy and Commerce Committee, has advocated for more FDA resources. The FDA sent a letter to Pallone on June 30 that detailed exactly what was escaping inspectors. The letter showcases a range of problems, including:
Why it’s important
The letter notes that some countries have notably increased their exports to the United States in the past five years. The FDA highlights China, where exports to the U.S. have increased by 79 percent; Canada and Mexico followed with increases of 60 percent or more. But of the approximately 29,000 foreign companies the FDA says ship cosmetics to the country, few have voluntarily registered, essentially shielding them from inspection for hazardous material.
Trump’s proposed 2018 FDA budget would cut spending for the testing of cosmetics imports, forcing the FDA to reduce the number of shipments inspected from 10,000 a year to about 1,600, The Times reported."
https://www.pbs.org/newshour/world/5-takeaways-from-the-new-u-n-report-on-refugees,asylum seeker,144,2017-06-19T06:05:22-04:00,Larisa Epatko,"Every minute, 20 people are displaced by violence, persecution: UN report","Despite peace agreements and efforts to address a growing refugee crisis, the number of people forcibly displaced around the world continued to climb last year, according to a U.N. report issued Monday.
In 2016, 65.6 million people had to leave their homes due to violence and persecution, up from 65.3 million in 2015, and 59.5 million in 2014, according to the U.N. refugee agency’s annual Global Trends report.
“By any measure this is an unacceptable number, and it speaks louder than ever to the need for solidarity and common purpose in preventing and resolving crises, and ensuring together that the world’s refugees, internally displaced and asylum seekers are properly protected and cared for while solutions are pursued,” said U.N. High Commissioner for Refugees Filippo Grandi.
Here are more highlights from the report:
READ MORE: U.N. refugee chief hopes for ‘robust’ resettlement programs in U.S."
https://www.pbs.org/newshour/nation/inside-casa-alitas-the-arizona-safe-house-for-central-american-families-seeking-asylum,asylum seeker,1086,2017-04-15T10:33:00-04:00,Joshua Barajas,"Inside Casa Alitas, the Arizona safe house for Central American families seeking asylum","Casa Alitas has all the hallmarks of a daycare.
The four-bedroom house in Tucson, Arizona, is stocked with stuffed animals, spare car seats and a small shelf of children’s books. Pantries are meticulously labeled in English and Spanish — latas de comida for canned food and leche en polvo for dry milk. A closet holds all the diapers and towels. Toys are scattered in the backyard.
Artwork drawn and colored by children hang in almost every room of the house, thanking Casa Alitas (Spanish for “wings”) for its charity.
Photo by Joshua Barajas/PBS NewsHour
But this isn’t a daycare; there are no children.
Instead, it’s a safe house, set up 2014 by Catholic Community Services to help address the record waves of Central Americans seeking asylum at the U.S.-Mexico border. An array of flags hang above the dining room, representing the many homelands of the families, largely mothers and their children, that are dropped off — many of them from Guatemala and Nicaragua, fleeing violence and poverty in their countries.
The latest family to come through this Tucson safe house left the day before I arrived last month. Co-coordinator Maritza Black, 19, said Casa Alitas has received only five families in the weeks since then. The slowdown is unusual for a safe house that used to host, on average, four families a day.
Photo by Joshua Barajas/PBS NewsHour
Black, along with co-coordinator Dora Haydee Lopez, 66, pointed to the Trump administration’s rhetoric and overall conversation around immigration as a direct factor in the noticeable dip they’ve seen in the number of families Immigration and Customs Enforcement drops off at their doorstep.
In January, when Trump signed an executive order to step up deportations, the program coordinator contacted ICE to ask whether policy changes were going to directly affect the agency’s arrangement with Casa Alitas. According to coordinators, the agency said it was not doing anything different in regards to its policy. Later, when coordinators started to see a decline in the number of families sent their way, they checked in again. The agency maintained its position.
ICE didn’t immediately respond to PBS NewsHour’s request for comment on whether it is changing its policy for asylum-seekers.
But numbers appear to be down. According to the latest figures from the U.S. Customs and Border Protection, the number of immigrants apprehended at the Southwest border as well as the number of those considered “inadmissibles,” immigrants who present themselves to agents at ports of entry, have been down for the past few months. In March 2017, CPB reported that 16,600 immigrants were apprehended or classified as inadmissible. The agency said this is a 64 percent drop from the same month in the fiscal year 2016.
But it’s hard to say whether the drop in numbers so far in 2017 can be attributed to the strong rhetoric and actions of the Trump administration or to the wait-and-see approach families may be adopting, said Doris Meissner, who heads the U.S. immigration policy program at the Migration Policy Institute in Washington, D.C. Families may be waiting to see whether the communicated plans about stepped up deportations and enforcement actually take place, she said.
During his tour of the U.S.-Mexico border Tuesday in Arizona, Attorney General Jeff Sessions cited a drop in border apprehensions this year, linking the decline to President Donald Trump.
“This is a new era. This is the Trump era,” Sessions said, before outlining new plans to enforce the country’s immigration laws.
But while Sessions spent a large amount of his time on immigration prosecutions, there was no mention of any policy changes on how to address Central American asylum seekers, who are processed differently from Mexican nationals. As described in this Council for Foreign Relations explainer, asylum seekers are granted a hearing before being possibly deported to their home country.
Photo by Joshua Barajas/PBS NewsHour
“There’s so much uncertainty, a fear of not knowing,” co-coordinator Dora Haydee Lopez told the NewsHour in March, nodding to the broad but strongly worded immigration plans signaled by the Trump administration.
Last month, Secretary of Homeland Security John Kelly said he doesn’t intend to separate mothers and children at the border, though he eventually walked back that statement.
Casa Alitas, too, is in a wait-and-see position.
Photo by Joshua Barajas/PBS NewsHour
Before the house existed, border officials dropped off families at a Greyhound bus depot in the city after they were processed and had a scheduled court date. Black said CSS began to work with Immigration and Customs Enforcement after Greyhound complained to the agency about people being left at the depot overnight.
With families now being redirected to the safe house, volunteers offer immediate assistance. Among their first tasks is to help families arrange phone calls and bus rides to their relatives in the U.S, until their court date. Volunteers also make sure a homecooked meal is waiting for the families when they arrive, along with a shower, clothes and a bed, should they need to rest or stay the night.
Photo by Joshua Barajas/PBS NewsHour
There was a time when volunteers were in short supply for the safe house. Two shelters opened up elsewhere in the city to help with overflow at Casa Alitas.
With fewer families being dropped off at Casa Alitas, that’s no longer the case. Volunteers haven’t been as needed; the two shelters are still open, but sometimes on a shorter schedule, depending on demand.
Despite the lack of families seen this year, though, the coordinators said Casa Alitas will remain flexible as a program.
It has also expanded its operation to taking in people with special needs, like a man with a feeding tube, and providing long-term shelter to those with complicated cases.
Photo by Joshua Barajas/PBS NewsHour
A woman from Cameroon, who has 3-month-old twins, has been at the house for about four weeks now. She and her husband presented themselves to Border Patrol agents and requested political asylum at the port of entry in Nogales, Arizona. The woman was granted a deportation hearing and dropped off at Casa Alitas with her twins. Her husband, however, was taken to a detention center in Eloy, Arizona, a city approximately halfway between Tucson and Phoenix.
Even if numbers continue to drop, Black said, Casa Alitas’ organizers want the safe house to remain open.
“We believe that no matter how much the numbers are down, there will always be a handful of people entering [the U.S.] on political asylum,” Black said.
See more of the PBS NewsHour’s dispatches from Arizona:"
