href,keyword,word_count,info,author,headline,article_text
https://www.thelocal.ch/20180518/eritreans-protest-in-bern-against-tough-new-asylum-rules,migrant,412,"
				18 May 2018
				14:27 CEST+02:00			 
					14:27 CEST+02:00				", The Local,Eritreans protest in Bern against tough new asylum rules,"Over a thousand Eritreans protested outside the Swiss national parliament on Friday against tough new rules that could see as many as 3,200 people returned to the autocratic African country.
After the demonstration, which Swiss People's Party politician Natalie Rickli filmed on her mobile phone, protesters handed authorities a petition signed by 12,000 people and addressed to Justice Minister Simonetta Sommaruga. The document called for the increasingly tough asylum rules targeting the group to be relaxed.
pic.twitter.com/2qMcK1rxcO
— Natalie Rickli (@NatalieRickli) May 18, 2018
Friday's protest comes after Bern announced in April it planned to review the status of 3,200 of the 9,400 Eritreans granted temporary residence in Switzerland.
That decision came after the Federal Administrative Court ruled in August last year that it was reasonable to return Eritrean citizens who had already previously performed military service to the African country as they were unlikely either to be required to re-join the military or to face other punishment.
Read also: Switzerland's tough stance on migrants criticised by Amnesty International
Swiss authorities stressed in April that all people affected by the new rule changes would have the right to a judicial hearing and that cases would be dealt with on an individual basis.
But on Friday, protesters carried banners with messages such as “Eritrea is one huge prison”, “Stop negotiations with the dictator” and “We did not flee for fun”.
Annelies Djiellal-Müller, one of the organisers of Friday's protest, stressed that the act of returning to Eritrea was highly dangerous. She told Swiss daily Der Bund that all people who left the country did so illegally, risking being shot when they did so then facing a dangerous journey to Europe across the Sahara Desert.
Voller bundesplatz. Eritreer demonstrieren auf dem bundesplatz gegen strengere asylpraxis. #srfrundschau pic.twitter.com/NW0fdC2UUz
— georg humbel (@georghumbel) May 18, 2018
When people did choose to return, the Eritrean embassy then demanded the names of family members and friends. Once back in Eritrea, returnees faced possible punishment for having left the country illegally.
“Would you take that risk for yourself and your loved ones?” Djiellal-Müller said.
Switzerland currently has no treaty with Eritrea regarding the return of migrants but State Secretary for Migration Mario Gattiker said in April that this did not mean such returns were not possible.
Switzerland only has a returns treaty with every second country, he said, and while Eritrea does not accept the forced return of migrants, voluntary returns were possible, he told Switzerland's Le Temps newspaper."
https://www.thelocal.ch/20171219/switzerland-helps-fund-programme-to-identify-migrants-lost-at-sea,migrant,426,"
				19 December 2017
				08:22 CET+01:00			 
					08:22 CET+01:00				",AFP,Switzerland helps fund programme to identify migrants lost at sea,"An organization that helps relatives trace loved ones who have gone missing in conflicts and disasters is launching an ambitious project to identify the thousands of migrants lost while trying to reach Europe.
Thanks to a donation of $400,000 (340,000 euros) from Switzerland announced on Monday, the International Commission on Missing Persons (ICMP) will work over the next two years to set up a programme to locate and identify people who have died during perilous journeys across the Mediterranean.
In October the organization, which was born out of conflicts in the former Yugoslavia, completed its move to The Hague from Sarajevo, unveiling state-of-the-art laboratories which will help trace missing people through sophisticated new DNA tests, as the non-governmental body broadens its work around the world.
About 8,000 migrants are known to have died on Italian shores alone in the past decade, ICMP director Kathryne Bomberger said.
With the new Swiss funding, the ICMP will work with Italy, Greece, Cyprus and Malta ""to take stock of where they stand"" in efforts to trace the missing.
""The numbers are huge,"" she told AFP, adding that finding ""the survivors of those who are missing is going to be difficult ... it does take an international organization to connect the dots.""
The first phase of the programme will be to assess the situation -- such as finding out how many unidentified bodies have been found in those four countries and where the remains are held or have been buried -- and boost cooperation among all nations and agencies involved.
A second phase -- which would most likely begin after 2019 depending on whether the programme secures funding -- would allow the organisation to start the laborious work of taking DNA samples and trying to match them with relatives who have reported a missing family member.
The ICMP also hopes to help track down thousands of children believed to have been trafficked after being separated from their families en route.
There is no complete estimate of the missing, dead and trafficked and ""so far no one has really been found because the issue is falling between the cracks,"" Bomberger said.
Last month, the International Organization for Migration (IOM) said 3,033 refugees had died crossing the Mediterranean this year, a 40-percent drop from last year's record of 5,000 known or suspected drownings.
""Italy and most likely Greece now are confronted with an abnormal situation, which absolutely exceeds their capabilities,"" said Bomberger.
She hopes the ICMP can help ""alleviate the burden"" on national police and forensic authorities by taking over the DNA analyses."
https://www.thelocal.ch/20160229/un-rights-chief-attacks-rising-xenophobia,migrant,422,"
				29 February 2016
				16:34 CET+01:00			 
					16:34 CET+01:00				",AFP,UN rights chief attacks rising xenophobia ,"A growing number of migrants worldwide are fleeing ""sickening atrocities"" and often encounter cruelty and xenophobia instead of compassion, the UN's rights chief said Monday.
""Conflicts in Syria, Iraq and elsewhere have unleashed a toxic brew of malevolent forces, including the commission of sickening atrocities, and the emergence of human trafficking gangs,"" Zeid Ra'ad Al Hussein said.
""These are the circumstances that migrants are increasingly fleeing. The trauma they have suffered is appalling, (and) they deserve the international community's sympathy and compassion,"" he told the opening of the UN Human Rights Council's main annual session in Geneva.
Instead, they were being met by ""a rising roar of xenophobia"", he said.
""To keep building higher walls against the flight of these desperate people is an act of cruelty and a delusion,"" he said.
His comments came against the backdrop of Europe's spiralling migrant
crisis, after more than one million people arrived on the continent last year, with the influx showing no sign of abating.
On Monday morning, Greek police said more than 7,000 people were massed at the border, in a buildup triggered by Austria and Balkan states capping the numbers of migrants entering their territory.
Zeid rejected such policies and the accompanying growing anti-immigrant and anti-minority rhetoric, warning that while this ""may offer instant political gratification in some quarters, (it results) in divisions that cut deep"".
""When leaders express, or ignite, waves of hate speech, as we have seen in recent months – hate speech against migrants, and specific ethnic and religious groups – they are setting off shockwaves whose impact will lead to violence,"" he said.
He warned against the ""distorted image of so-called invasion by people who are manifestly fleeing countries no longer safe for human life.""
""While I do not belittle the logistical difficulties (the arriving migrants) may create, they are a threat to no society,"" he insisted.
Zeid also cautioned against allowing the fear of terrorism to push countries to throw away the hard-won rights of their citizens.
""Crushing human freedoms will not protect us from terrorism,"" he said, pointing to the fear surrounding the brutal Islamic State (IS) jihadist group in particular.
""We must not throw our principles and our reason overboard because we are petrified by the grotesque abuses of a few thousand fanatics,"" he said.
Zeid said that while IS clearly ""is a powerful force for ill... Its behaviour and its mindset are so inhuman that it can only thrive in an atmosphere of deprivation and hate.""
""This is a threat that can be overcome."""
https://www.thelocal.ch/20170929/swiss-politician-convicted-of-helping-migrants-enter-illegally,migrant,265,"
				29 September 2017
				10:06 CEST+02:00			 
					10:06 CEST+02:00				",AFP/The Local, Swiss politician convicted of helping migrants enter illegally,"A Swiss regional politician was convicted Thursday for helping 24 migrants to illegally cross from Italy into
Switzerland and for repeatedly inciting others to do the same.
Lisa Bosia Mirra, a Socialist member of the Ticino parliament in southern Switzerland, was found guilty of the offences by a regional court and sentenced to a suspended fine, the ATS news agency reported.
She helped Eritreans and Syrians stuck at the train station in Como, near the Swiss border, in mid-2016.
""The facts have been admitted to by the defendant, who over a period of two weeks worked along with accomplices to organize a network to help accommodate the illegal entry of 24 illegal migrants,"" the judge in charge of the case, Siro Quadri, told ATS.
He acknowledged that Bosia Mirra's intentions were good, but stressed that she had nonetheless broken Swiss law.
While their circumstances may have been tragic, the judge stressed that the migrants ""were not in a country at risk but in Italy, and could have been helped there.""
He also pointed out that as a member of the Ticino parliament, Bosia Mirra was well aware that she was breaking the law.
Bosia Mirra told ATS she planned to appeal the verdict all the way up to the European Court of Human Rights if need be.
""According to international law, the State must enact all necessary measures to protect persons or associations that operate to defend human rights and denounce their violations,"" commented Amnesty International Switzerland on Mirra's actions, reports Swiss regional daily Ticino.
READ MORE: Asylum requests at lowest level for seven years"
https://www.thelocal.ch/20151018/swiss-parliament-seen-tilting-right-over-migrant-fears,migrant,682,"
				18 October 2015
				17:08 CEST+02:00			 
					17:08 CEST+02:00				",Nina Larson/AFP,Swiss parliament tilts right over migration fears,"UPDATED: Initial Swiss election results and projections on Sunday showed the populist right significantly strengthening its already dominant position in parliament amid concerns over migration and asylum rules.
The first results ticking in from Switzerland's 26 cantons showed the country's largest party, the populist right-wing anti-immigration Swiss People's Party (SVP), making gains that were expected to tip the scale in
parliament towards a slight centre-right majority.
Observers had predicted that SVP would gain ground from the 26.6 percent of the vote they won in 2011, but initial regional results showed their support swelling more than expected and even possibly passing their all-time high in 2007 of 28.9 percent.
In all, 246 seats are up for grabs — 200 in the lower chamber and the remainder in the upper chamber.
The expected shift comes as surging numbers of migrants and refugees moving through Europe have heightened the focus on the issue in Switzerland, even though the wealthy Alpine nation is yet to be significantly affected by the crisis.
About a quarter of Switzerland's eight million inhabitants are foreign nationals, and immigration and asylum policies tend to figure among voters' top concerns.
'A lot at stake'
The latest survey from the gfs.bern polling institute showed that nearly 50 percent of voters considered migration the most important issue facing the country.
""I think there is a lot at stake, not only when it comes to the reception of refugees, but also the entire problem of the large numbers on the move,"" Colette Morel, a 69-year-old retired teacher, told AFP as she cast her ballot in the central canton of Fribourg.
SVP vice president and its most outspoken member, Christoph Blocher, insisted earlier this month that his party was the only one that could solve Switzerland's ""asylum problem"" and ""eliminate the chaos"".
Blocher, a multi-billionaire who served in the Swiss government from 2004-2007 before being pushed out over his confrontational style, saw his daughter Magdalena Martullo Blocher win a parliamentary seat Sunday in the eastern canton of Graubunden, the early results showed.
The SVP, which has previously sparked outcry with campaign posters such as one showing three white sheep kicking a black sheep off the Swiss flag, has in its national push this year been less provocative, resorting mainly to posters featuring pictures of candidates with the slogan ""Stay free"".
But some regional divisions of the party have gone much further, with the Vaud youth unit putting out a poster featuring a caricature of a jihadist, wearing an EU armband, preparing to decapitate a bound and gagged blonde woman wearing a Swiss flag tank top, flanked by the caption: ""Keep your head on your
shoulders"".
That poster also plays to the second top concern among the Swiss, according to the latest gfs.bern poll.
Nine percent of those questioned in the survey said they were most concerned about Switzerland's relationship with the European Union, which was badly hit by a narrow Swiss popular vote in February 2014, championed by the SVP, in favour of restricting immigration from the bloc.
The centre-right Liberals, in third place, were also seen gaining ground, according to the first results, helping move the pendulum in parliament towards the right.
The party, which largely sees eye-to-eye with SVP on economic and energy issues, takes a very different stance on a range of subjects, including on the question of immigration.
Magic formula
The Socialists, Switzerland's second largest party, were meanwhile seeing mixed results Sunday, snatching an extra seat in Zurich but losing one seat in Valais and another in Vaud, early results showed.
The Christian Democrats, the Greens and other smaller parties were seen taking a hit.
Power-sharing and consensus rule are the norm in Switzerland and elections rarely lead to major shifts in parliament or the makeup of the government, which does not directly reflect the power balance in the house.
Once the new parliament is in place, it will in December elect the government, with the seven posts traditionally shared among the major parties from right to left under a tacit decades-old agreement dubbed ""the magic formula"", aimed at ensuring political stability."
https://www.thelocal.ch/20160905/disappearing-migrants-on-the-rise-in-switzerland,migrant,376,"
				5 September 2016
				10:28 CEST+02:00			 
					10:28 CEST+02:00				", The Local,‘Disappearing’ migrants on the rise in Switzerland ,"Over the past three months, up to 40 percent of migrants who told the authorities they wanted to claim asylum in Switzerland subsequently disappeared from Swiss reception centres.
A report in the SonntagsZeitung this weekend suggested that in some areas of Switzerland up to 90 percent of migrants allocated to reception centres to await the processing of their asylum application flee the centre shortly after arriving.
Responding to the paper, the Federal Migration Office (SEM) did not confirm exact numbers but acknowledged that in the last three months between 20 and 40 percent of asylum seekers have left the system in this way, their whereabouts now unknown.
Confirming the information to news agency ATS, SEM spokeswoman Chloe Kohlprath said phenomenon was not new, and that many migrants took advantage of the system by saying they wished to claim asylum in Switzerland and then disappearing before their request could be formally registered.
Under European rules, refugees are only allowed to enter Switzerland if they say they want to claim asylum here. All those who do are allocated to a SEM reception centre to be registered.
Anyone who does not state their intention to claim asylum in Switzerland is refused entry and must return to the first European country they entered.
The Swiss have been under fire over the summer for turning back thousands of migrants at the border with Italy at Chiasso. Its strict adherence to the rules is an attempt to stop it becoming a ‘transit’ country for migrants who wish to pass through Switzerland on their way Germany in order to apply for asylum there.
According to the SEM, most of those who disappear from Swiss reception centres are thought to be heading for Germany, reported ATS.
As a result, there’s nothing to suggest that there are more illegals living in Switzerland, it said.
But Christoph Neuhaus, head of the justice department in the canton of Bern, told the SonntagsZeitung that the increase in ‘disappearing’ migrants over the summer was “highly problematic”.
“We cannot be sure that they really migrate further and register elsewhere as asylum seekers,” he said.
Albert Rösti, president of the Swiss People’s Party (SVP) called for the border to be shut down altogether, saying the situation was “a massive security risk”."
https://www.thelocal.ch/20180115/number-of-eu-citizens-migrating-to-switzerland-hits-record-low,migrant,281,"
				15 January 2018
				09:49 CET+01:00			 
					09:49 CET+01:00				", The Local,Number of EU citizens migrating to Switzerland hits record low,"Fewer people migrated to Switzerland last year than at any point in the past 10 years.
Just over 53,000 people moved to Switzerland in 2017, of whom close to 31,000 came from the European Union
According to the “Tagesschau” programme of public broadcaster SRF, this is the lowest figure since the free movement of people accord with the ""old"" EU members came fully into effect in 2007.
The State Secretariat for Migration (SEM) confirmed the figures, which were first published in the Sunday papers.
The figures show the number of citizens of EU and European Free Trade Association (EFTA) countries coming to Switzerland last year was 20 percent lower than the year before.
The peak year for immigration was 2008 when net migration – the number of immigrants minus the number of emigrants – stood at almost 100,000 people.
Immigration has been steadily decreasing since 2014, when Switzerland voted to approve the initiative “against mass immigration” that sought to limit the number of migrants through quotas.
The SEM said the fall in immigration was clearest among the European countries that have traditionally supplied the labour market: Germany and Italy.
Daniel Bach of the SEM said this was connected to the economic situation in those countries.
“Spain and Portugal have seen a normalization of their economic situation with more jobs available and less unemployment, and Germany's strong growth means there is a high demand for labour there,” he said.
Bach said that the development of the Swiss economy and the economies of the EU countries would determine whether the trend towards lower immigration continued.
A little over two million foreigners lived in Switzerland last year, making up one quarter of the population."
https://www.thelocal.ch/20160811/amnesty-concerned-over-child-migrants-at-swiss-italian-border,migrant,423,"
				11 August 2016
				12:08 CEST+02:00			 
					12:08 CEST+02:00				", The Local,Amnesty fears for child migrants at Italian border,"Amnesty International has asked the Swiss federal government to investigate reports that child migrants arriving at the Swiss-Italian border are being prevented from joining family in Switzerland.
For the past few weeks the Italian city of Como has seen hundreds of migrants camped out by its rail station after being sent back from the Swiss border at Chiasso, in the canton of Ticino.
If refugees apply for asylum when they arrive at the Swiss border they are allowed to stay and will be registered as an asylum seeker in Switzerland.
But many don't want to, wishing instead to travel through Switzerland and apply for asylum in another country, such as Germany.
Applying EU rules, Switzerland is sending those people back to the country they travelled from, in this case Italy.
But this strict adherence to the rules has not impressed Italy, with Como officials saying in July that the Swiss stance was turning the city into “an open-air refugee centre”.
Now the Swiss branch of Amnesty International has expressed concern after hearing reports that children were being turned back from the Swiss border.
“We are concerned about reports from minors who tell us they have been sent back to Italy from the Swiss border and therefore prevented from joining relatives in Switzerland,” the organization said in a statement obtained by The Local.
“We are asking for clarity from the Swiss authorities regarding the practice of sending back minors to Italy.”
But the Swiss authorities stressed that the rules haven't changed, and that any migrant has the right to request asylum at the Swiss border, reported news agencies on Thursday.
Martin Reichlin of the Swiss migration office (SEM) told news agencies that any child arriving at the border to join family members in Switzerland would be taken into the care of the SEM.
Speaking to The Local on Thursday, a spokesman for Amnesty International said they were “monitoring the situation closely” but “cannot make further comments in this volatile situation”.
Quoting figures from the Swiss border guards office, news agencies said 3,560 people were sent back from Switzerland to Italy in July alone.
Speaking to Swiss paper 24 Heures, MP Cesla Amarelle said Switzerland found itself “stuck in the middle”.
“Italy can't welcome all the migrants that reach its coasts and Germany has specifically asked Switzerland to not become an open corridor, as Austria has done.”
However, though the situation in Como “is not Calais”, it shouldn't be allowed to get worse and Switzerland should work with Italy to avoid that happening, she said."
https://www.thelocal.ch/20150421/iom-fears-mediterranean-death-toll-will-rise,migrant,435,"
				21 April 2015
				18:42 CEST+02:00			 
					18:42 CEST+02:00				",AFP,IOM fears Mediterranean death toll will increase,"More than 1,750 migrants have perished in
the Mediterranean since the start of 2015, a 30-fold increase over the same period last year, the Geneva-based International Organization for Migration said on Tuesday.
The grim new statistic followed the deaths of some 800 people on Sunday when a boat packed with migrants capsized near Libya in the deadliest Mediterranean shipping disaster for decades.
""IOM calculates the 2015 death toll now is more than 30 times last year's total at this date . . . when just 56 deaths of migrants had been reported on the Mediterranean,"" spokesman Joel Millman told reporters in Geneva.
""IOM now fears the 2014 total of 3,279 migrant (deaths) on the Mediterranean may be surpassed this year in a matter of weeks, and could well top 30,000 by the end of the year, based on the current death toll,"" he said.
UNHCR spokesman Adrian Edwards said Sunday's migrant boat tragedy was ""the deadliest incident in the Mediterranean we have ever recorded.""
Edwards said there had been 1,300 deaths in April alone, making it the deadliest month on record.
See also: CAPTAIN'S ERRORS CAUSED MED SHIPWRECK
The IOM spokesman said traffickers were increasingly packing in more people on overcrowded vessels, thereby greatly adding to the risk factor.
""The way we see it is that if there were 800 people on that fishing boat that sank . . . we can imagine that the same boat last year would have had 200 people on it,"" Millman said.
""If there's a real shortage of crafts they're going to do these reckless things,"" he said.
""If that's the case, and it appears to be, there is no reason not to be afraid that death rates could soar astronomically, because they are taking these measures to move people.""
Volker Turk, the director of international protection at the UN refugee agency, said most of the migrants taking the perilous journey were refugees.
""If you look at the numbers last year, over 50 percent of the people who crossed the Mediterranean were people in need of international protection — mostly Syrians, Eritreans, some Somalis,"" he said.
Italy, one of the frontline European states for illegal immigration, suspended its Mare Nostrum search-and-rescue operation late last year in protest over its rising cost.
That was replaced by a smaller and much more restricted EU-led mission called Triton.
""With the end of Mare Nostrum, we indeed unfortunately predicted the types of scenarios that are playing out today, and we hope that the European council meeting on Thursday will give adequate attention to the search and rescue dimension of this issue,"" Turk said."
