href,keyword,word_count,info,author,headline,article_text
https://www.thelocal.ch/20180709/swiss-football-boss-reignites-debate-over-dual-nationality,migrant,492,"
				9 July 2018
				09:59 CEST+02:00			 
					09:59 CEST+02:00				", The Local,Swiss football boss fans flames of dual nationality debate,"Switzerland's footballing World Cup may be over, but the controversy certainly isn't.
The ongoing debate in Switzerland over whether the Swiss football team is ‘Swiss enough' has been given unwanted new life by a key figure in the sport's national federation.
“Maybe it should be asked: do we want dual nationals?” said the federation's general secretary (SFV) Alex Miescher in a recent interview with the Tages Anzeiger newspaper.
Read also: Increasingly international - number of Swiss dual nationals soars
The comment came after three Swiss footballers, including Granit Xhaka and Xherdan Shaqiri who have a Kosovo Albanian background, celebrated goals scored against in a World Cup match against Serbia with a hand gesture representing the “double eagle” of the Albanian flag.
The gesture divided the increasingly international Swiss public, many of whom are dual nationals.
Some supported the players whose families had come to Switzerland during the 1998-1999 war between Kosovo ethnic Albanian pro-independence guerrilla and Serbian forces. Others, meanwhile, said it showed that the players loyalties were divided.
The controversy appeared to die down but the comments from SFV general secretary Alex Miescher have escalated the situation.
“The incident with the double eagle shows there is a problem,” said the federation's second in command, suggesting only players who gave up their second nationality should be entitled to participate in trainee programs.
Although these comments were authorised by the SFV, the federation backtracked on Saturday. In a statement, it distanced itself from the debate by saying no one within the SFV had spoken out against dual nationality.
But it appears the damage has already been done. With around two thirds of the Swiss national team having a foreign background, and many having dual nationality, the comments have been greeted with anger.
“I hear in his [Miescher's] words that he doesn't trust dual nationals to give their all for Switzerland,” said Granit Xhaka in an interview published in the Blick newspaper.
“Just after we experienced a tough defeat in Russia, you don't do that,” he said.
“We are all Swiss and give everything for the Swiss national team – all of us, because we know, and are thankful for, everything Switzerland had done for us and our families,” he said in response to what he described as “Stone Age commentary” by the SFV general secretary.
Miescher's comments are unlikely to put an end to ongoing debate about the status of the Swiss football team, often attacked by conservatives as being too foreign.
The comments are also part of a larger debate over dual nationals in Switzerland.
While more than one in five Swiss citizens now holds a second passport – a number that has soared 40 percent to 1.48 million in the last decade – members of the conservative Swiss People's Party have periodically called for the right to dual nationality for Swiss people to be either limited or scrapped, arguing that the holding of two passports can mean reduced loyalty to Switzerland."
https://www.thelocal.ch/20160301/asylum-seeker-was-attacked-by-swiss-policeman,migrant,238,"
				1 March 2016
				10:01 CET+01:00			 
					10:01 CET+01:00				", The Local,Asylum seeker 'was attacked by Swiss policeman',"A 29-year-old asylum seeker from Tunisia was attacked in Therwil, Basel, earlier this month, leaving him in need of surgery on his hand.
The attack took place in the night of February 5th, close to an asylum seekers' accommodation and a pub.
Shortly after the incident, a 32-year-old man was arrested. Local police wrote in a statement that he was strongly under the influence of alcohol and that they were looking for witnesses who might have information on others involved in the incident.
Now it has been revealed that three people were involved in the attack on the man, reports Regionaljournal Basel. All three were Swiss citizens, and one is a policeman in Basel. The three now face criminal charges of grievous bodily harm.
""We know that there is a trial against a policeman from our department,"" Martin Schütz, a spokesperson for Basel's justice and security department, told The Local.
He was unable to go into more detail about the particular case due to professional confidentiality and protection of privacy, but explained that, in general, ""members of the police are obliged to inform their superiors promptly and of their own accord about any criminal proceedings against them"".
When asked if police education included training in xenophobia or handling aggression, he responded: ""Right now we don't see a need to change our training. We will review it after the end of the lawsuit.""
The criminal proceedings are still ongoing."
https://www.thelocal.ch/20151221/eu-and-bern-still-seeking-immigration-deal,migrant,309,"
				21 December 2015
				22:16 CET+01:00			 
					22:16 CET+01:00				",AFP/The Local,EU and Bern still seeking immigration agreement,"The European Union and close partner Switzerland said on Monday that they had made progress but reached no agreement over planned Swiss curbs on EU migrants, which violate the bloc's free movement rules.
Switzerland narrowly voted for the unspecified curbs in early 2014 with implementation to be made before February 2017.
The issue is newly topical as Europe faces its worst refugee crisis since the Second World War and Britain seeks migrant restrictions of its own to stay in the EU.
Swiss Federal President Simonetta Sommaruga said after talks in Brussels with European Commission head Jean-Claude Juncker that both sides wanted an accord but it was easier said than done.
""We have cleared the ground but we have no solution . . . there is still a difficult way to go and a lot of work to be done,"" Sommaruga told reporters.
""We might succeed, we might not.""
Juncker said it was in the interests of both sides to find agreement.
""We hope that by February we will be able to set out what progress has been made,"" he said.
""We are confident of reaching an agreement.""
The Swiss vote in February 2014 jeopardized years of close ties with the 28-nation European Union, which is founded on the core principle of free movement for all its citizens.
Switzerland is not an EU member state but it signed the Schengen agreement, agreeing to become part of Europe's passport-free zone which has come under huge pressure as the migrant
crisis has deepened this year.
In February, the Swiss government presented legislation to try and reconcile voters' wishes with EU rules by allowing in migrants under specific exceptions to some of the restrictions.
Around 80,000 immigrants, most from the EU, have settled in Switzerland annually in the past few years and almost a quarter of its 8.2 million people are foreign nationals."
https://www.thelocal.ch/20170608/swiss-mp-failed-asylum-seekers-are-avoiding-deportation,migrant,203,"
				8 June 2017
				11:11 CEST+02:00			 
					11:11 CEST+02:00				", The Local,Swiss MP: failed asylum seekers are avoiding deportation,"Migrants who are refused asylum are not always deported and could prove a threat to society, according to an MP who wants the Swiss government to address the issue in a report.
On Thursday the Swiss upper house of parliament backed a motion by Liberal-Radical Damian Müller in which he asked the Swiss government to examine the problem, reported news agencies.
According to the text of Müller's motion, some migrants are refused asylum but then manage to avoid being deported, including some who are criminal offenders or may have jihadist sympathies and therefore pose a terror threat.
The Swiss government should find ways to improve current deportation rates and ensure that potentially dangerous people whose deportation is delayed are sufficiently monitored, he said.
The report should also examine whether the costs for this should be borne by the federal government rather than the cantons.
Addressing the issue, justice minister Simonetta Sommaruga said there was no “recipe” for combatting terrorism and that just because someone is refused asylum doesn't mean they are a terrorist.
But the Council of States supported Müller's request.
It will be addressed by the Federal Council as part of a report on police measures related to the fight against terror."
https://www.thelocal.ch/20170831/there-are-now-21-million-foreigners-in-switzerland,migrant,296,"
				31 August 2017
				10:08 CEST+02:00			 
					10:08 CEST+02:00				", The Local,There are now 2.1 million foreigners in Switzerland,"The number of foreigners in Switzerland increased at a faster rate than the number of Swiss in 2016, according to new figures released on Wednesday.
As of January 1st 2017 the population of Switzerland was over 8.4 million, up 1.1 percent from the previous year, the Swiss statistics office said in its annual report.
However while the number of Swiss citizens grew by 0.6 percent in 2016, the number of foreign residents was up by 2.6 percent, it said.
There are now more than 2.1 million foreigners living in Switzerland, up from just under 2.05 million a year earlier, comprising 24.9 percent of the total population.
The percentage of foreigners in the Swiss population has grown steadily. Source: Swiss statistics office
The growth rate for foreigners in Switzerland (2.6 percent) was slightly higher than in 2015, however it has been much higher in the recent past, reaching 4.2 percent in 2008.
More foreign babies were born in Switzerland last year than ever before (26,313) while fewer foreign residents died in 2016 than in the previous year, resulting in a ‘natural growth’ – the difference between the number of births and deaths – of 20,060.
In addition, 167,407 foreigners chose to make Switzerland home in 2016, while just over 90,000 left the country.
In comparison, the number of Swiss who left the country in 2016 was higher than the number who came back.
What’s more, due to the wider age demographic of Swiss citizens, their ‘natural growth’ was only 2,859.
Italians remain the largest diaspora within Switzerland, followed by Germans, Portuguese and French.
Since babies born to foreign citizens in Switzerland do not automatically get Swiss citizenship, the figures in the table below also include Swiss-born foreigners.
READ ALSO: Where in Switzerland do foreigners choose to live?"
https://www.thelocal.ch/20180926/swiss-police-opposed-roman-abramovich-residency-bid-official,migrant,468,"
				26 September 2018
				16:48 CEST+02:00			 
					16:48 CEST+02:00				",AFP/The Local,Swiss police opposed Roman Abramovich residency bid: official,"Russian billionaire Roman Abramovich had sought to move to Switzerland but withdrew his residency bid when it looked set to be rejected, a Swiss migration official said on Wednesday.
The saga surrounding the Chelsea owner's attempt to relocate to the country was first reported by the Tribune de Geneve (TdG) newspaper, which claimed Abramovich was turned away after Swiss police claimed he posed a security risk.
In a rare move, the TdG newspaper published the article in both French and English, highlighting Abramovich's high profile internationally. The story was also published in English by other newspapers in the Tamedia group, which owns the TdG,
Abramovich had applied for residency in Valais canton, which includes the luxury ski resort of Verbier, Jacques de Lavallaz, the head of the cantonal migration service, told the AFP new agency in an email.
Valais gave Abramovich the green light, de Lavallaz said, but federal authorities have the final say on Swiss migration decisions.
""The (federal) secretariat of migration was going to make a negative decision but Mr. Abramovich's representatives withdrew their client's application before a decision was issued,"" de Lavallaz said.
The migration secretariat's decision was based on an analysis conducted by Swiss federal police, de Lavallaz explained, without discussing details of their conclusions.
He stressed that the application was withdrawn before a final decision was rendered.
According to the TdG, Abramovich applied to move to Verbier in 2016.
The newspaper said that police argued he was linked to ""alleged money laundering and alleged contacts to criminal organisations.""
Police claimed ""that Abramovich's presence in the country would constitute a reputational risk for Switzerland – and possibly even a public security risk,"" the newspaper further reported.
The newspaper also posted a statement from an individual identified as Abramovich's lawyer, criticising Swiss officials and the release of his personal information.
""We have filed a request for correction of facts to the Swiss Federal Police and will be filing a criminal complaint against unknown persons responsible for dissemination of this confidential information,"" the lawyer, Daniel Glasl, said in the statement.
""Any suggestion that Mr. Abramovich has been involved in money laundering or has contacts with criminal organisations is entirely false,"" he added.
It also noted that Abramovich has no criminal record.
The TdG said Swiss police raised concern over a commodities trading company that had been controlled by Abramovich called Runicom, which was the subject of a money laundering investigation by Geneva prosecutors in the 1990s.
Glasl stressed that the company was ""long-ago cleared of any wrongdoing.""
The TdG said that Switzerland's federal court gave it permission last week to publish the story, after a seven month legal battle with Abramovich's lawyers.
Abramovich, who bought Chelsea in 2003, was granted Israeli citizenship earlier this year after the British authorities reportedly delayed approving a visa for him."
https://www.thelocal.ch/20160712/ticino-tackles-record-number-of-illegal-immigrants,migrant,286,"
				12 July 2016
				11:55 CEST+02:00			 
					11:55 CEST+02:00				", The Local,Ticino tackles record number of illegal immigrants,"More than 1,300 illegal immigrants attempted to get into Switzerland via a border with Italy in the first week of July, a new record.
According to figures received by news agency ATS from the Swiss border guards office (EZV) on Monday, 1,321 people entered Switzerland illegally via a border in the canton of Ticino between July 4th and 10th.
Of those, the largest number (665) were Eritrean.
In 996 cases they were sent back over the border, since those who enter the country illegally are not considered as having refugee status.
Those who requested asylum were sent to one of Switzerland's asylum centres for processing.
In total, 14,602 people tried to enter the country illegally in the first four months of 2016, up from 10,362 during the same period last year.
Most of them came through the border with Italy in the canton of Ticino.
The border at Chiasso has long seen high numbers of people attempting to enter Switzerland illegally, and numbers are on the rise.
In late June, the situation led the president of Ticino's government, Norman Gobbi, to call for the border to be shut altogether.
Speaking at the time, Gobbi said other countries including Italy were not properly abiding by the Dublin system, which requires immigrants to be registered at their first point of entry to the Schengen zone, of which Switzerland is a part.
Other cantons are also considering sending border guards to Ticino to help out.
Last week Ticino's border guards made international headlines when an Eritrean immigrant was busted trying to smuggle himself over the border in a suitcase.
Switzerland has around 24,000 Eritreans living in the country (2014 figures), the largest diaspora outside the North African country itself."
https://www.thelocal.ch/20170725/survey-immigrants-in-switzerland-are-happy-to-be-here,migrant,658,"
				25 July 2017
				09:31 CEST+02:00			 
					09:31 CEST+02:00				", The Local,Survey: immigrants in Switzerland are happy to be here,"More than a third of immigrants living in Switzerland say they have experienced discrimination, but most feel their lives have improved here, according to a new survey.
On the Move, a nationwide survey on immigration, is due to be published next year but initial results were revealed by Blick on Monday as part of the paper’s week-long focus on foreigners in Switzerland.
Led by the universities of Neuchâtel and Geneva, the survey asked 6,000 immigrants of 11 nationalities (from across Europe, North and South America, India and West Africa) how they felt about living in Switzerland.
Some 35 percent said they had experienced discrimination here, not always because of their status as a foreigner but also due to their gender, race and age.
Nevertheless, the vast majority (90 percent) said they were satisfied or very satisfied that they came here, according to Blick.
Some 70 percent of those questioned said coming to Switzerland had been a professional advantage and they were in a better situation than in their home country.
The figure was higher (75 percent) for people from the southern European countries Portugal, Italy and Spain, but less pronounced for British people and those from North and South America.
Level of satisfaction (improved/stayed the same/reduced) after emigrating. Source: On the Move/NCCR
Most immigrants (62 percent) said they came to Switzerland for professional reasons, with 38 percent saying it was to change their lifestyle or have new experiences. Twenty-nine percent cited family reasons and eight percent education.
But the stats varied widely depending on the country of origin, with 65 percent of Brits saying they came here for professional reasons compared with only around 20 percent of West Africans and South Americans.
READ ALSO: Immigration: fewer EU citizens are coming to Switzerland
The survey also questioned immigrants about their feelings towards Switzerland and their home countries.
Despite living in the alpine country, over half (52 percent) said they still felt a strong attachment to their home country.
Two notable exceptions were the French and the South Americans, a majority of whom said they felt a stronger attachment to Switzerland than to their home country.
The Portuguese, Austrians and Germans felt least attached to Switzerland, at 30 percent.
Speaking to Blick, researcher Philippe Wanner said the strength of feeling towards Switzerland depended on how the immigrant viewed their move – for example, if migration is considered a professional opportunity, the feeling of connection to the adopted country is stronger.
That explains why the French, who often come to Switzerland because they are dissatisfied with France, feel a strong attachment to their adopted country while the Portuguese, who usually come out of necessity, do not.
“The degree of affinity with Switzerland does not say anything about the level of integration of migrants,” he stressed.
READ ALSO: Eight things you should know about applying for Swiss citizenship
Just under half of those questioned said they wanted to become Swiss, though the results varied considerably depending on where the immigrant was from.
West Africans and South Americans were more likely to want to pursue Swiss citizenship (69 percent and 62 percent respectively). At the other end of the scale a majority of Austrians and Portuguese said they did not want to become Swiss. The Austrian result could be partly explained by the fact that Austria does not allow double nationality.
Among those who said they wanted to become Swiss, 26 percent said it was because they wanted to vote, 25 percent because they felt attached to Switzerland, while 22 percent cited practical reasons.
Introducing its series of articles on foreigners in Switzerland, Blick editor Andreas Dietrich said “we should not forget the contribution that foreigners make” to the country.
“There are Swiss people who would prefer to live without foreigners,” he added. “Such a Switzerland has never existed and thankfully will never exist. That would be a country where we would feel alien.”
READ ALSO: Would you pass a Swiss citizenship test?"
https://www.thelocal.ch/20171110/un-urges-switzerland-to-fight-harder-against-discrimination-and-racism,migrant,284,"
				10 November 2017
				09:21 CET+01:00			 
					09:21 CET+01:00				", The Local,UN urges Switzerland to fight harder against discrimination and racism,"A UN panel on Thursday quizzed a Swiss government delegation about the country's efforts to improve human rights in the past four years, urging it to work further on combating violence against women, racism, xenophobia and the discrimination of migrants.
Pascale Baeriswyl of the Swiss foreign affairs department stood before the panel in Geneva to defend Switzerland's human rights record as part of the UN's universal periodic review system, a four-yearly process in which every member state must outline what it has done and is still doing to improve human rights.
The Swiss government's plan to establish a national human rights institution – a draft bill for which was opened for consultation earlier this year – was hailed by several UN member states, reported news agencies.
An independent body attached to one or more of Switzerland's higher education institutions, it would serve to protect and promote human rights in the country.
However several countries called on Switzerland to work harder to combat racism, xenophobia and intolerance, pointing to the rise of the “extreme right”.
A national plan or even a new law to protect against discrimination, particularly towards migrants, should be considered, said some, a suggestion Baeriswyl rejected, saying current legislation was sufficient.
Switzerland was also criticized for not yet adopting the European convention on preventing and combating violence against women, though parliament is currently working towards its ratification.
Speaking to the panel Baeriswyl said Switzerland considered itself to have a good level of human rights but that “no country should be complacent” and protecting these rights was a continual process.
The review panel will compile a report, due next week, before Switzerland must say which of the panel's recommendations it agrees to pursue."
