href,keyword,word_count,info,author,headline,article_text
https://www.thelocal.fr/20131005/syrian-refugees-call-off-calais-protest,asylum seeker,636,"
				5 October 2013
				09:45 CEST+02:00			 
					09:45 CEST+02:00				",AFP,Syrian refugees call off Calais protest,"A group of some 60 Syrian asylum seekers blocking a gangway at a ferry terminal in the French port of Calais in
a desperate attempt to get to Britain on Friday ended their protest.
They backed down after talks with British border police who ruled out group entry for the Syrians. The group dispersed with the vast majority gathering their belongings and heading back into the centre of Calais. Eight of the group, five adults and three children, took a bus to the town of Arras to seek shelter there. Earlier in the day, the three-member team of the Border Force held talks with the refugees. British officials said they could only examine on a case-by-case basis the requests of those who already had family in Britain, according to Denis Robin, the top government official for France's northern Pas-de-Calais region. The negotiations included two representatives from the refugees, who had blockaded the terminal since Wednesday. Robin said the British officials indicated that the entry of the entire group ""without any checks or examinations of the different cases"" was out of the question. ""However, the representatives of the Border Force said that they are open to examining on a case-by-case basis if there are Syrian nationals with family on British territory."" His statements sent a wave of gloom among the refugees. Two men joined two others already perched on a port building and threatened to jump but all four later came down. The talks also drew in representatives from the Medecins du Monde and Secours Catholique charities. Mariam Guerey, of Secours Catholique, said the Syrians were ""shocked"" by the British refusal to take them in. ""They had another image of England. For them, this is the dream,"" she said. The mayor of Calais, a Channel port from where many ships and ferries leave for Britain, said the protest highlighted the need for a concerted European strategy. ""It's unacceptable that it is in France and at Calais that one has to control immigration."" The protest, which has seen 20 people go on hunger strike, prompted French authorities to offer to legalise the refugees' status. Some 50 police from an anti-riot squad moved in early Friday to try and clear the protestors from a footbridge but backed off when two of them threatened suicide. Pas-de-Calais prefect Robin then went to the site and offered the Syrians, currently illegal immigrants, the right to asylum. ""Today, the Syrians present here are caught in a stalemate. What we can do is to offer them a status on French territory... in other words to make a request for asylum,"" he told reporters. He said every asylum demand had a ""95 percent chance of success"". French Foreign Minister Laurent Fabius has pledged to fast-track the applications of Syrians fleeing their war-torn country.
But some refugees said they would still try to get into the UK. One of the group, Zakarya, 45, said: ""I want to go as soon as possible to England."" The protesting refugees, most of whom arrived in Calais a month ago, have voiced disappointment at the way they have been treated in France. They affixed cardboard signs reading ""Take us to the UK"", and ""We want to talk to David Cameron"". ""We live outside like dogs, hunted down by the police, we see we are not welcome, how can we seek asylum here?"" said 19-year-old Tarik. Ali, a 38-year-old, said although French President Francois Hollande had taken a strong stand against the regime of President Bashar al-Assad for using chemical weapons, the French were not welcoming at all. ""Why does the president say one thing and the police another?"" Ali said, adding that he had spent $13,000 (€9,500) to come to a country where the ""president said 'we must help Syrians'"". ""Here even animals are better treated than us,"" he said."
https://www.thelocal.fr/20150821/eu-ministers-to-hold-migrant-crisis-talks-in-october-france,asylum seeker,433,"
				21 August 2015
				08:47 CEST+02:00			 
					08:47 CEST+02:00				",AFP,EU ministers to hold migrant talks: France,"Europe's interior and foreign ministers will meet in mid-October to discuss how to respond to the huge influx of migrants and refugees arriving at EU borders, French Interior Minister Bernard Cazeneuve said on Thursday.
The meeting, to be followed by further talks in Berlin, will pave the way for broader discussions at an EU summit in Malta in November which will also be attended by African leaders, Cazeneuve said after talks with his German counterpart Thomas de Maiziere in the German capital.
De Maiziere said it was ""unacceptable that European institutions continue to work at their current slow pace"" in finding a joint solution to the crisis, adding that ""too little"" was being done to implement decisions that have already been taken.
EU border agency Frontex reported on Tuesday that a record 107,000 migrants were massed at the bloc's borders last month, as the continent faces its biggest migration crisis since World War II.
De Maiziere said he hoped new centres set up to determine whether new arrivals are refugees fleeing war, or economic migrants simply looking for work, would be operational by the end of the year in Greece and Italy, the countries bearing the brunt of the crisis.
Cazeneuve, meanwhile, called for a ""harmonisation"" of asylum laws in Europe and the creation of ""a list of safe countries of origin at the European level"" to make it easier to send home asylum-seekers whose countries are considered at peace.
He also urged a ""deepening of cooperation among police and intelligence services"" along the lines of a deal agreed Thursday between France and Britain to combat people smuggling at Calais.
European leaders are expected to use the Malta summit to encourage their African counterparts to do more to stem the flow of migrants heading across the Mediterranean in rickety boats in search of a better life in Europe.
They will also seek assurances that African countries will actually implement agreements signed with European countries to take back migrants who have been denied leave to remain in the EU.
De Maiziere expressed hope that the European Commission will be able to move forward with agreements allowing rejected asylum-seekers to return to their home countries ""without fear of persecution"".
Cazeneuve added that this will require ""discussions with the countries of origin"".
The two foreign ministers also discussed Ukraine, Cazeneuve said, adding that they prepared new initiatives on the conflict that will be presented to European institutions.
The leaders of France, Germany, Russia and Ukraine held telephone discussions Thursday, with all sides calling for the full implementation of a ceasefire deal, according to the French presidency."
https://www.thelocal.fr/20130524/amnesty-demands-more-from-hollande-on-human-rights,asylum seeker,609,"
				24 May 2013
				16:09 CEST+02:00			 
					16:09 CEST+02:00				",The Local,Amnesty wants Hollande to up human rights effort,"Rights watchdog Amnesty International has filed its end of year report on French President François Hollande's record on tackling human rights issues. Its conclusion was: Could do better.
Amnesty has called on French President Francois Hollande to fulfill the commitments he made during his electoral race to shore up human rights. However, the rights watchdog nonetheless noted a change in governmental attitude toward human rights since the days of Nicolas Sarkozy. In April 2012, the human rights organization sent a letter to all the presidential candidates vying for entry to the Élysée Palace, asking that they consider ten points of improvement to help safeguard human rights in the country. ""Well, firstly, Mr Sarkozy did not reply,"" Amnesty International France spokesman Patrick Delouvin told The Local. ""Mr Hollande sent us a long letter in response. We have some expectations on the new government."" In a report entitled ""Francois Hollande - One year later,"" released this week, the human rights organization went through its list of recommendations - ranging from asylum seekers to Roma, and looking at civil liberties. It said that while Amnesty welcomed the legalization of same-sex marriage in France, there was nonetheless the need for further efforts to tackle homophobia. The treatment of asylum seekers and of the Roma people were also mentioned among the areas where France needed to take action to ensure human rights were protected. The organization had addressed its concerns with the French prime minister in November, after several high-profile evictions of Roma took place over the summer. Amnesty noted that dismantling their settlements endangered the rights of those expelled to get access to housing, health and education. In the report, Amnesty said that the then presidential candidate's response at the time was to try to find ""alternative solutions"". ""We must find solutions to combine the respect of private property, the safety of those affected(...) with the task of integrating the (Roma) population,"" Hollande is quoted as saying in the letter he sent Amnesty last year. Delouvin said the situation for the Roma was probably the toughest point on the list of suggested improvements, and welcomed the inter-ministerial push for action, which tied the interior minister and six other ministers to a steering document on the issue. The government had also appointed a special rapporteur. ""Unfortunately, the situation for Romas is sill very difficult we hope that in the future the (rapporteur's) work will permit some improvements locally,"" Delouvin said. Amnesty also said the procedures for how to welcome and house asylum seekers, as well as ensuring their access to the asylum application system, needed review. As did laws concerning foreign nationals in France. ""The recommendations we made in 2012 came from difficulties in laws in France because of the presence of Mr Sarkozy,"" said Delouvin. ""We had worse laws on asylum and foreigners in general, now we have recently had consultations with officials in the home office and we are awaiting new laws."" There was also praise for concrete action from the French president. The report authors credited Hollande with making sure France signed up to the International Covenant on Economic, Social and Cultural Rights, as well as to the Arms Trade Treaty. Feedback on Hollande's push to speak up for human rights on the global scene was more tempered, however. Amnesty said that while a speech at the Francophone Summit had highlighted such issues with the Congolese delegates, the French president had not followed through in certain key bilateral talks, including with Russia, Morocco and China ""Amnesty finds it regrettable that the president showed reluctance to address human rights on official visits,"" the report read. Ann Törnkvist Follow Ann on Twitter here"
https://www.thelocal.fr/20151216/two-men-connected-to-paris-attacks-arrested-in-salzburg,asylum seeker,331,"
				16 December 2015
				11:09 CET+01:00			 
					11:09 CET+01:00				", The Local,Salzburg arrests 'linked to Paris attacks',"Two people believed to be linked to the terror cell which carried out the Paris attacks have been arrested at a refugee centre in the Austrian city of Salzburg.
The Kronen Zeitung newspaper reported that the pair are French citizens posing as refugees, who travelled with some of the Paris attackers through Greece and the Balkans in early October, using fake Syrian passports.
They were arrested over the weekend after police received a tip-off from a foreign intelligence service. There is some speculation that they were waiting in Salzburg for orders to carry out further terrorist attacks.
A spokesman for the state prosecutor, Robert Holzleitner, said he cannot confirm if they planned to carry out terror attacks and declined to comment on their nationalities, saying that they had ""come from the Middle East"".
He did confirm that ""indications of a possible link to the Paris attacks are currently being investigated"".
In a related story, two asylum seekers suspected of being members of the Isis terror group were taken into custody in Salzburg just a few weeks ago.
The pair, aged 20 and 21, are reported to have boasted to other refugees and volunteers that they had fought with Isis in Syria.
Prosecutors have said that so far there is no evidence that they planned to carry out attacks in Europe or that they had any links to previous attacks.
Salah Abdeslam, a 26-year-old French citizen who is thought to have played a key logistical role in the Paris attacks, is still on the run and subject to an international arrest warrant.
Abdeslam was also registered as having been in Austria on September 9th after being stopped in a routine traffic check in a car with Belgian number plates with two other men, Austrian authorities said on November 17th. Abdeslam told police he was ""on holiday"" in Austria.
He also travelled to Hungary before the attacks where he ""recruited a team"" from unregistered migrants passing through, Hungarian officials said on December 3rd."
https://www.thelocal.fr/20130801/senator-slammed-for-closing-door-on-foreign-children,asylum seeker,410,"
				1 August 2013
				18:08 CEST+02:00			 
					18:08 CEST+02:00				",Ben McPartland,Senator slammed for 'locking out' foreign kids,"An asylum seekers rights group has blasted a French senator for ""discrimination"" after he passed a decree banning foreign children found abandoned in his region from being taken into care by local social services.
Earlier this month Senator Jean Arthuis, who is president of the council of the Mayenne department in the west of France decided enough was enough. Arthuis, from the centre right UDI party decided the authorities could no longer deal with the number of foreign children found without a parent or guardian in his region. The former minister under ex-French president Jacques Chirac signed a decree to “put an end to accepting any new unaccompanied foreign child” in the territory of Mayenne. Assylum seekers rights group France Terre d’Asile (France Earth Asylum) has slammed the politician for acting “outside the law”. “After the travelling community, the Roma, now it’s the turn of abandoned foreign children,” an angry Pierre Henry, head of the organisation told The Local. ""There's been some scandalous things said this summer about the Roma, the travellers and now its the turn of the foreign children. “This decree against unaccompanied foreign children is indisputably discriminatory. It is illegal and needs to be annulled,” Henry said, adding that it was a shameful first for France. ""It's outrageous. The law obliges them to look after the needs of children who in danger no matter what nationality they are. ""There is no justification for this,"" Henry said. “Unaccompanied foreign children” as they are referred to in official language refers to children who for one reason or another end up without any parent or legal guardian to look after them. They can end up alone in France for a number of reasons, whether it’s because they were abandoned by their parents or family or they may have been victims of trafficking.
Most children found in France without any parents or guardian are from India, Pakistan or Mali. In all there are around 6,000 in France, with a third of those in the Paris region. For his part Arthuis says he took the decision because the two care centres for abandoned children were at saturation point. “Today I no longer have the means to accommodate them,"" he said. ""With this decree I sounded the alarm. I want to warn the government . The reception of foreign children is their responsibility not the responsibility of the regional authorities,” he added. But Terre d’Asile’s Henry slammed Arthuis for putting politics before children."
https://www.thelocal.fr/20160722/police-clear-out-2500-migrants-from-paris-camp,asylum seeker,509,"
				22 July 2016
				10:21 CEST+02:00			 
					10:21 CEST+02:00				",AFP/The Local,"Police clear out '2,500' migrants from Paris camp","Police in Paris carried out their 26th eviction order on a migrant camp on Friday with 2,500 mainly young men from Syria and east Africa evacuated.
The eviction took place on Friday morning near Juares Metro station on the border of the 10th and 19th arrondissements where the camp had built up underneath the overground train line.
Scores of riot police were drafted in to help with the operation that resulted in tense scenes due to the sheer number of migrants and refugees involved.
While official estimates on the number of migrants in the camp were around 1,500, Le Parisien newspaper suggested the was as high as 2,500 after hundreds more moved into the area on Thursday in order to be part of the eviction.
Tear gas was used as the crowd of migrants pushed forward to get on some of the buses that had been laid on.
The camp had built up over recent months after police had cleared out several others in the neighbouring area and more refugees and migrants arrived in the French capital.
In recent days tensions have flared as the summer heat only worsened the squalid conditions underneath the Metro tracks.
Many migrants and refugees pass through Paris on their way to northern France from where they hope to make it to the UK, while others head for northern Europe from the nearby Gare du Nord train station.
The migrants were put on buses and taken out of the area with around 1,500 short term accommodation places being made available for them around the country.
However many are expected to end of up living on the streets of the capital once again, probably in another squalid makeshift camp that will no doubt emerge.
The head of the French Immigration and Integration Office, Didier Leschi, said some were passing through France and were planning to seek asylum in other European countries.
Others, however, had already been granted asylum in France ""but cannot find work and don't know where to live.""
Migrant support groups complain of a dire shortage of accommodation for asylum-seekers, saying the 20,000 spaces created in the past two years are insufficient in the face of a constant stream of new arrivals.
Over the past year, squalid camps have repeatedly cropped up in northern Paris -- with the police intervening each time to dismantle them.
In May, the city's mayor Anne Hidalgo announced plans to create a refugee camp with proper facilities, scheduled to be up and running in September.
The other main destination in France for refugees and migrants is the northern port of Calais, where thousands of people are camped out in the hope of stowing away in a truck bound for Britain.
Pierre Henry, head of France Terre d'Asile, a charity that helps refugees and asylum seekers, called for other French cities to step up to the plate.
""We need (accommodation) centres in all the regional capitals, to receive the refugees and help them get their bearings, so that people are not drawn just to Paris and Calais,"" he said."
https://www.thelocal.fr/20150120/french-police-slammed-for-abuse-of-migrants,asylum seeker,291,"
				20 January 2015
				11:42 CET+01:00			 
					11:42 CET+01:00				",Ben McPartland,French police accused of 'beating' Calais migrants,"The NGO Human Rights Watch have accused the police in Calais of ""harassment and abuse"" towards migrants in the northern port city, in a highly critical report released on Tuesday.
“Asylum seekers and migrants living in the poverty in the port city of Calais are victims of harassment and abuse by French police,” Human Rights Watch claim. The report is based on the accounts of 44 migrants who say they have witnessed the abuse. However it has been criticised by France’s Interior Ministry, who have suggested it is biased. “Nineteen people, including two children said that police had abused them at least once, including through beatings,"" the report says. “Eight were left with broken limbs or other visible injuries, which according to them were caused by police in Calais and the surrounding area."" “Twenty-one, including two children, have said that the police sprayed them with tear gas,” Human Rights Watch say. The NGO’s report includes several testimonies, including that of Rosa, aged 25, who says she was beaten after police found her in a truck. HRW have called on the French government to launch an immediate investigation and also provide police with guidance over the use of force and when it is “unjustified and disproportionate”. However France’s Minister of Interior Bernard Cazeneuve hit back on Tuesday and slammed the NGO for “not trying to verify the allegations of police violence to which it refers”. “The seriousness of the charges against the public security forces contained in this document should have led the association to approach those in charge of the police with specific facts,” the minister said. The minister asked Human Rights Watch to take their testimonies to the correct authorities so a “thorough and impartial” investigation can be carried out."
https://www.thelocal.fr/20151208/paris-convinced-of-need-to-reduce-migrant-flow,asylum seeker,229,"
				8 December 2015
				12:45 CET+01:00			 
					12:45 CET+01:00				",AFP,Paris 'convinced' of need to reduce migrant flow,"France and Germany are ""firmly convinced"" of the need to reduce the flow of migrants into Europe, they wrote in a joint letter to the EU Commission seen by AFP on Tuesday.
""It is clear that the control of common external borders should be rapidly reinforced,"" said interior ministers Bernard Cazeneuve and Thomas de Maiziere in the letter, dated December 3, calling for a ""substantial reinforcement"" of the EU's Frontex border agency.
The ministers said Frontex should be able to call on ""rapid intervention forces"" in emergencies, and have access to EU security databases.
It may also need to carry out missions in countries outside the EU where necessary.
Germany announced this week that it has welcomed around 960,000 asylum seekers so far in 2015.
""We very strongly reject confusing migrants for terrorists,"" the ministers said.
The migrant crisis has become an even more polarising issue since two of the jihadists that attacked Paris last month were found to have used the refugee route to enter the continent.
Experts say this may have been deliberately done to provoke animosity against migrants, but it has been seized upon by far-right parties such as France's National Front (FN), which saw record results in regional elections on Sunday.
The two ministers also criticised the slow pace of building arrival centres for refugees, calling for them to be operational ""without the least delay""."
