href,keyword,word_count,info,author,headline,article_text
https://www.thelocal.fr/20180620/germany-france-eurozone-reform-ideas,asylum seeker,621,"
				20 June 2018
				09:01 CEST+02:00			 
					09:01 CEST+02:00				",AFP,From migration to defence: Germany and France announce EU reform ideas,"France's President Emmanuel Macron and Germany's Chancellor Angela Merkel on Tuesday announced common plans on a plethora of EU reforms ahead of a crunch end-June summit that could determine the future of the bloc.
Here's an outline of Europe's two biggest economies' proposals for a post-Brexit Europe:
Migration
A record influx of migrants, many fleeing war in Syria and Iraq, has become a defining issue for politics in many EU nations.
Merkel is facing down a domestic rebellion over her liberal policy that led to the arrival of more than a million asylum seekers since 2015, while Italy last week sparked an outcry by refusing aid ships carrying rescued migrants to dock in its ports.
Coming to Merkel's aid, Macron said that Paris and Berlin had agreed that EU countries must be able to turn back at their borders all asylum seekers who previously registered in another member country -- usually their Mediterranean first port of call.
Merkel, asked earlier what Berlin can offer other EU countries in return for such cooperation, cited the EU-Turkey deal in which the bloc paid Ankara for housing and schooling refugees.
They are also calling for a European Asylum Office that harmonizes practices across the bloc, and which will be responsible for ""asylum procedures at external borders"".
Meanwhile, Paris and Berlin also vowed steps to better protect the EU's outside borders by boosting the Frontex agency, to fight human traffickers and create a fairer system of burden-sharing within the bloc.
The German leader had initially championed a quota system to distribute migrants across the bloc, but this has been torpedoed by several central European nations.
SEE ALSO: Just how 'open' are Germany's borders?
Economy
Macron's ambitious ideas for a eurozone finance minister or parliament have been shot down by Berlin.
But the French leader won Merkel's backing for a eurozone budget which will be used to finance things like projects on innovation and education in poorer EU countries.
The eurozone budget will have its own governance structure, and be a ""real budget with annual revenues and spending"", said Macron, adding that Paris and Berlin hoped to have it in place by 2021.
He would however not be drawn into giving a figure for the budget, saying that its size would be discussed with other members of the bloc.
How it would be funded was also up for discussion with other eurozone members, said Merkel, suggesting that it could involve regular transfers made by individual countries or a tax on financial transactions.
Macron had previously called for a budget of several hundred billion, while Merkel has spoken of some tens of billions of euros.
Beyond that, in order to better cope with future crises, the two leaders agreed to expand the remit of the current European Stability Mechanism (ESM).
The twin EU engines now want the ESM to become a European version of the International Monetary Fund that could provide emergency loans to countries that fall victim to crises not linked to their debt levels.
Defence
In the face of US President Donald Trump's ""America First"" policy, a traditionally pacifist and Atlanticist post-war Germany has drawn closer to France's call for a sovereign Europe, including in the military aspect.
Merkel backs Macron's idea for an European intervention initiative, with armies to collaborate before eventually forming a common force.
But France wants this force outside the framework of the EU, to allow Britain to join in even after it leaves the bloc.
Germany prefers it to remain within the EU.
As a compromise, both sides agreed for the force to be ""linked as closely as possible"" with the EU's framework.
READ ALSO: From NATO to Europe: What to know about the coalition deal for new Merkel government"
https://www.thelocal.fr/20150519/hollande-no-question-of-migrant-quotas-in-europe,asylum seeker,410,"
				19 May 2015
				15:50 CEST+02:00			 
					15:50 CEST+02:00				",AFP,Hollande rejects migrant quotas for Europe,"UPDATED: French President Francois Hollande said on Tuesday there was ""no question"" of introducing a migrant quota system in Europe, as proposed by the European Commission.
Speaking at a joint press conference with German Chancellor Angela Merkel, Hollande said there was ""no question of having immigrant quotas"" because rules on border checks and policies for controlling immigration already existed.
The European Commission's plan, unveiled last week, called for asylum grants for 20,000 refugees in Europe over the coming years.
Each EU country should accept their fair share of asylum seekers, the commission said, based on a series of factors, such as that country's population, economic output, and unemployment rates.
France would be asked to take in 14.17 percent of all asylum seekers to reach the EU, second only to Germany at 18.42 percent. Italy at just under 12 percent and Spain at 9 percent were close behind.
Hollande continued:
""People who come because they think that Europe is a prosperous continent, even when they are not hired by companies... must be escorted back, that's the rule.""
""So one cannot talk of quotas, there can't be quotas for these migrants,"" he said, adding that quotas for ""the right to asylum"" would not make sense.
However, with refugees arriving in great numbers in certain countries, Hollande said, citing Germany, France or Sweden, ""we must ensure that other countries can also play their part.
""This is what we call distribution,"" Hollande said.
The proposal was already opposed by France's Prime Minister Manuel Valls over the weekend.
""I am against the introduction of quotas for migrants. This has never been in line with French proposals,"" he told reporters.
Valls said that France had ""already done a lot"" when it came to helping asylum seekers, pointing to the fact that 5,000 refugees from Syria and 4,500 from Iraq had been resettled in Frace since 2012.
""Asylum is a right, attributed according to international criteria ... That is why the number of its beneficiaries cannot be subject to quotas, one is an asylum seeker or not,” he added.
The Commission plan last week came amid concerns at the growing numbers of refugees, especially from war-torn countries like Syria, after weeks in which hundreds have died attempting to cross the Mediterranean Sea by boat to reach the continent.
Other proposals within the plan include better targeting of people smugglers, whose unsafe and over-crowded boats have been blamed for recent tragedies, and expanding resources for search and rescue."
https://www.thelocal.fr/20121025/france-and-germany-eu-must-stem-serb-asylum-claims,asylum seeker,331,"
				25 October 2012
				15:17 CEST+02:00			 
					15:17 CEST+02:00				",AFP,France: EU must stem Serb asylum claims,"France and Germany want the European Union to take steps to stop the tide of asylum seekers from Serbia and Macedonia, their interior ministers said in interviews published Thursday.
France's Manuel Valls and Hans-Peter Friedrich of Germany said Brussels had to increase aid to the two nations to stop the phenomenon, which was stretching the resources of their countries. ""Our two countries have been subject to a worrisome trend: a flood of asylum seekers from countries which have recently benefited from an easing of visa rules,"" Valls told France's Le Figaro and German newspaper Frankfurter Allgemeine Zeitung. ""Their nationals can move in the Schengen zone freely. This rush of asylum demands, often groundless, is threatening our system,"" he said, when asked specifically about Bosnians and Macedonians. Macedonia, Montenegro and Serbia were granted visa-free status by the European Union in December 2009, thereby allowing their citizens to travel unhampered in the passport-free Schengen zone. Valls complained that domestic laws forced the two countries – the economic heavyweights of the eurozone – to house and feed the asylum seekers ""even though it's almost sure that their demand will be rejected."" ""This problem should be met with a European response,"" he said. Friedrich said the European Union ""could offer Serbia and Macedonia adequate aid."" He said if this did not resolve the problem, the visa-free travel would be lifted in line with decisions taken in the European Council. ""There, that's our message to Serbia and Macedonia. We are asking these two countries to resolve the problem."" In a separate interview on German broadcaster ARD, Friedrich said the two nations had to better integrate their sizeable Roma population into the mainstream. ""If they want to belong to Europe, they must cooperate on who ultimately takes care of these people,"" he said. ""They have to do things so that these people ... don't feel discriminated against."" Several EU nations, especially Sweden, Belgium and Germany have been swamped by asylum seekers from Balkan countries in recent years."
https://www.thelocal.fr/20150601/france-calls-for-revision-of-eu-asylum-plan,asylum seeker,573,"
				1 June 2015
				11:32 CEST+02:00			 
					11:32 CEST+02:00				",Oliver Gee,France demands revision of EU asylum quotas,"France and Germany have asked Brussels to take a second look at the EU's plans to relocate tens of thousands of asylum seekers across Europe, in which France was told to take in over 9,000 refugees over the next two years.
The two European powerhouses said there was insufficient ""balance"" in the European Commission's controversial emergency measures for relocating tens of thousands of migrants around Europe.
""Deep discussions are necessary at the European level"" to achieve a balance between ""responsability"" and ""solidarity"", said a joint statement from the French and German interior ministers, who said countries' ""efforts already undertaken"" in welcoming asylum-seekers should be ""better taken into account"".
Brussels released plans for EU countries to open doors to around 60,000 refugees - 40,000 who are arriving or set to arrive in Italy and Greece and to grant asylum to another 20,000 who are currently outside the EU.
France was told to open its doors over 9,000 refugees over the next two years, with Germany's figure closer to 12,000.
The mandatory relocation scheme which will apply to refugees from Syria and Eritrea to relieve the pressure on Greece and Italy, is only intended for those “in clear need of international protection” and will be put in place for two years.
With each country effectively given a quota, France has been told to take in 4,000 migrants fleeing Africa and the Middle East who have arrived in Italy and another 2,700 that have spilled across the border into Greece - meaning almost 7,000 in total.
That compares to Germany which has been set a quota of 8,700 from the two countries and Sweden which must take in around 1,300 migrants from Italy and Greece.
The quotas were worked out on a special calculation that looked at each country's population size, GDP, unemployment rate and the number of refugees it had already accepted.
But Paris and Berlin said: ""Additional solidarity is only possible if the member states at the first point of entry... take, with support from the European budget, all the financial and legal measures possible to boost surveillance of the external borders.""
France and Germany proposed the establishment of so-called ""hotspots"" to process asylum-seekers close to the point of entry to identify them and then decide where to place them.
""Part of the asylum-seekers in obvious need of protection will be relocated in other member states, using the redistribution ratio agreed,"" said the Franco-German proposal.
""Irregular migrants"" will quickly be returned or removed, according to the proposal, adding that ""better contacts"" needed to be established with their countries of origin to ensure an easier returns process.
""Migrants that do not belong in either category will have their situation examined within the framework of the common asylum procedures, in the country of first entry,"" proposes the Franco-German plan.
Additionally, the two countries called for ""solutions to limit secondary migration movements"" which is putting at risk the idea of sharing the burden between EU states.
French president François Hollande has recently said that he was against any kind of migrant quotas, echoing concerns raised in both Spain and the UK.
""People who come because they think that Europe is a prosperous continent, even when they are not hired by companies... must be escorted back, that's the rule,"" said Hollande.
""So one cannot talk of quotas, there can't be quotas for these migrants,"" he said, adding that quotas for ""the right to asylum"" would not make sense."""
https://www.thelocal.fr/20160804/paris-police-on-alert-over-threat-to-beach-festival,asylum seeker,332,"
				4 August 2016
				15:15 CEST+02:00			 
					15:15 CEST+02:00				",The Local,Paris on alert over 'specific threat to beach festival',"Paris police and intelligence officials have held an emergency meeting over a specific threat to attack the beach festival, reports in France say, as police in the capital are also searching for an Afghan asylum seeker.
According to Le Point news site authorities called the emergency meeting on Wednesday night because they had got wind of a specific threat to stage an attack on Paris Plage beach festival that is taking place in the city.
Le Point did not reveal any details of the threat but said all the major actors involved in the fight against terrorism were present at Wednesday's meeting.
At the meeting it was decided that the usual river police boat would be boosted by presence of specialist SWAT teams from the BRI brigade, who are called on when a terror attack or siege is underway.
It is not clear whether Wednesday's meeting was directly linked to an alert that was put out on Tuesday regarding an Afghan asylum seeker, suspected of intending to launch an attack.
There are no further details about the suspect and it is not believed police have launched an active manhunt. He has not been named and no photo has been released to the media.
The Paris Plages festival which sees parts of the River Seine and the canal at the Bassin de la Villette in the 19th arrondissement turned into a beach is being held amid unprecedented security measures.
All roads leading to the beach areas are either blocked by police vans or concrete blocks to prevent a Nice-style truck attack.
Everyone heading into the event is searched and soldiers have been deployed to patrol along the river and canal banks.
The number of police on patrol either on bike or on foot has been noticeably increased from previous years.
France has boosted security at the summer events across the country by drafting in 23,000 extra officers and soldiers however many smaller events and shows have been cancelled because of the terror threat."
https://www.thelocal.fr/20160509/how-france-is-failing-to-protect-foreigners-human-rights,asylum seeker,548,"
				9 May 2016
				13:29 CEST+02:00			 
					13:29 CEST+02:00				",Catherine Edwards,How France is failing to protect foreigners' rights,"France is failing to uphold fundamental rights of foreigners living in the country, according to a report by the country's Ombudsman for human rights.
A “logic of suspicion” towards foreigners impinges upon even the most basic rights of those not born in France, from asylum seekers trying to enter the country, to foreigners already living in France and suffering from discrimination.
These are the findings of a damning report published on Monday by France's Défenseur des droits, an Ombudsman tasked with protecting the rights of French citizens.
Jacques Toubon, the Défenseur des droits, urged France to tackle the “preconceived ideas” and “myths” about foreigners which lead to discrimination, such as the idea of the “French identity” being under threat by mass migration.
The first part of the 305-page report focussed on the foreigners entering the country and the issuing of French visas, while the second part examined the rights of those foreigners already living in France.
“No historical period of immigration, however intense, has changed the basis for the common Republican values,"" said the report, adding: ""Immigration is essential for the construction of France”.
The Ombudsman was critical of the newly made EU-Turkey deal on refugees, and criticized France for reducing legal migration channels in the midst of the Syrian crisis.
It claims that there had been ""violations of the law"" in issuing visas and barriers to the right to seek asylum at the border, also argued that those seeking asylum were ""deprived of rights"" in waiting areas and forced to wait for ""excessive"" lengths of time for their claims to be processed.
The report argued that even the vocabulary used by the media and the French public to refer to migrants led to ""discredit and suspicion"" of those trying to move to France, by creating distinctions ""between 'good' refugees and 'bad' economic migrants"".
Toubon highlighted the plight of unaccompanied child refugees and the ""worrying"" lack of a specific procedure to help them, saying: “These minors should be protected unconditionally - which is not always the case.”
The report argued that the suspicion towards foreigners affects not only France’s immigration policy, but also the everyday life of foreigners living in France, denouncing ""the measurable gap between the proclamation of rights and their effectiveness.”
As well as ""illegal practices"", Toubon points out that different interpretations of the law, or limiting criteria not related to nationality, can also limit the access of non-nationals to basic services. He called on the Interior Minister to intervene and ""prevent the spread of divergent interpretations of the law"" across the country at a local level.
The report highlighted a range of issues faced by foreigners, including children with non-resident or homeless parents being unable to enroll in the school system, spouses of French citizens facing a ""precarious right of residence"" if they suffer domestic violence, and ""barriers"" stopping foreigners from benefitting from family benefits or free healthcare - or even from accessing the competitive job market.
""The fact that the law and practices perceive individuals as 'foreign' before considering them for who they are as people, children, invalids, workers or users of public services, significantly weakens their access to basic rights.""
The report, ‘The fundamental rights of foreigners in France’ was published on Monday by Jacques Toubon and can be viewed here (in French)."
https://www.thelocal.fr/20150923/europe-accuses-france-of-asylum-violations,asylum seeker,339,"
				23 September 2015
				13:06 CEST+02:00			 
					13:06 CEST+02:00				",The Local,Europe accuses France of flouting asylum laws,"The European Commission said on Wednesday it had opened an investigation into France as well as 18 other countries, accusing Paris of not respecting the laws around the right to asylum.
The Commission accuses the 19 member states, including Germany, Austria, Italy and Spain of infringing laws regarding the recognition of refugees, minimum standards for asylum procedures and inadequate conditions for receiving refugees.
""It's high time the member states do what they need to do,"" said the Commission's number two Frans Timmermans.
""The pieces of legislation concerned focus on fairer, quicker and better quality asylum decisions (the Asylum Procedures Directive); ensuring that there are humane physical reception conditions (such as housing) for asylum seekers across the EU (the Reception Conditions Directive); and clarifying the grounds for granting international protection,"" the Commission said in a statement.
A total of 40 violations are being investigated across the 19 countries.
""In Europe everyone must uphold the commonly agreed standards, in the way we receive asylum seekers,"" said Migration and Home Affairs Commissioner Dimitris Avramopoulos in a statement.
""These standards need to be fully implemented and respected, while always respecting the dignity and human rights of the applicants.""
The investigation comes as EU leaders are meeting on Wednesday for an emergency summit about the ongoing refugee crisis across the continent, where they will be discussing border security, aid resources and a plan to redistribute 120,000 refugees among member states.
Denmark, Ireland and the United Kingdom will not face scrutiny because they do not take part in EU asylum legislation.
The countries under investigation will first receive a letter of formal notice from the Commission and then will have two months to respond.
If they do not properly implement existing EU laws, they will be threatened with an indictment in the European Court.
On Tuesday, EU interior ministers voted on a plan to share responsibility for refugees across Europe through a quota system.
Talks have been divisive on how to handle the crisis - the worst of its kind since the Second World War."
https://www.thelocal.fr/20150617/france-to-add-10500-housing-places-for-migrants,asylum seeker,452,"
				17 June 2015
				12:46 CEST+02:00			 
					12:46 CEST+02:00				",AFP,"France to add housing for 10,000 migrants","UPDATED: With an ever-increasing influx of migrants crossing the French borders, France announced on Wednesday plans to offer them 10,500 housing places.
France unveiled plans on Wednesday to add 10,500 additional housing spots for migrants as European nations grapple with how to handle a wave of immigrants crossing the Mediterranean.
The government plans 5,000 housing units for people granted asylum in France, 4,000 for asylum seekers and 1,500 emergency slots for illegal immigrants.
France's Interior Minister Bernard Cazeneuve said the government aimed to create ""additional housing spots for those thrown into exile by persecution, abuse, imprisonment and execution.""
""France is doing its part,"" he insisted, amid a spat with neighbouring Italy, which has urged its fellow EU countries to do more to ease the burden. In seven years, the number of asylum seekers has nearly doubled in France to reach more than 66,000 cases in 2013.
As a result, there is a severe lack of housing facilities and half of all asylum seekers have to fend for themselves, resorting to living in slums, squats or sleeping rough.
Processing these asylum requests takes an average of two years, and legislation proposed in July aimed to shorten the wait to nine months by 2017, giving authorities dealing with the cases more funding and staff.
The managing director of France Terre d'Asile, a group representing asylum seekers, greeted the news cautiously.
""It is a sweeping plan of a type that has never been put into place until now,"" said Pierre Henry.
He added the increase in housing would require close vigilance as the plan will involve a variety of players from around the country.
The announcement comes as Italy has been increasingly applying pressure to other European Union nations to take in their share of the waves of migrants arriving on its shores.
But at a meeting Tuesday in Luxembourg, European interior ministers failed to reach an agreement on carrying out proposals by the European Commission for quotas to redistribute migrants throughout the bloc.
European leaders swore action after an estimated 800 migrants died in a shipwreck in April, the worst disaster yet in the Mediterranean in a year in which a total of 1,800 people have died trying to reach Europe.
More than 100,000 migrants have arrived in Europe this year, 60,000 through Italy alone, according to the EU's border agency Frontex.
Migrants in France have been a contentious issue lately. Shortly after the EU suggested France take in 9,000 migrants over the next two years, French authorities demanded the EU revise its figures, claiming there is an imbalance that needs to be addressed.
Two separate migrant camps have been closed down by police in recent weeks, both prompting protests from the French public."
