href,keyword,word_count,info,author,headline,article_text
https://www.thelocal.fr/20150903/what-happened-to-france-sheltering-refugees,asylum seeker,948,"
				3 September 2015
				12:30 CEST+02:00			 
					12:30 CEST+02:00				",The Local/AFP,Time for France to show fraternité to refugees?,"As images of a drowned Syrian boy shock Europe to the core, France like other EU nations comes under more pressure to welcome more refugees. But will France open its doors as it has done in the past?
A vow was written into France’s constitution back in 1793 that promised to provide ""asylum to foreigners banished from their countries in the cause of liberty"".
Up until recent years consecutive French governments stuck to that promise and the country topped the list of destinations for asylum-seekers in Europe.
For a decade up to 1985, France welcomed 110,000 ""boat people"" escaping communist regimes in Cambodia and Vietnam. It took some 15,000 Chileans after the 1973 coup by General Augusto Pinochet.
Before that the country also welcomed hundreds of thousands of Algerians fleeing war in the 1960s.
But in recent years things have changed and France has proved one of the most reluctant of Europe's biggest nations to accept those seeking asylum, with Germany and Sweden taking in far more.
(This photo of the drowned Syrian boy has left Europe in shock. Photo: AFP)
Since 2011 only 7,000 Syrians have been granted refugee status in France, out of four million people who have fled the country, although in the UK that number is an even lower 5,000, and many of those were already in the country.
Matthieu Tardis from the NGO France Terre D’Asile told The Local previously that France was failing to meet its legal obligations to Syrian refugees, and that there was a “moral crisis” in France regarding refugees and immigration.
""Quite simply, France is not doing enough to help and accommodate Syrian refugees fleeing the conflict in their country,"" said Tardis.
Pierre Henry, Director of Terre d’Asile added: ""Welcoming refugees is in our DNA.”
""But today, we are in the middle ranks of Europeans on the issue of asylum, we are no longer a powerful voice on the subject,” Henry told AFP.
The apparent shift has come as immigration has developed into a hot political issue in France, helped by the rise of the far right National Front party, whose leader Marine Le Pen has long called for France to close its borders.
(A tent in the Calais camp of The Jungle 2. Photo: AFP)
Le Pen says France is suffering under a “migratory submersion” and even opposition leader and former president Nicolas Sarkozy recently compared the influx of migrants to ""a burst water-pipe"".
Their views appear in line with those of many of a French public who are deeply worried by the state of the country’s economy.
A new opinion poll released on Wednesday revealed 56 percent of the French public are against authorities accepting more refugees.
But some Parisians who live near makeshift migrant camps say France must do more.
“Our country's motto is 'equality, solidarity, and fraternity'. It makes sense that France should help the people that it needs,” Imen, a 25-year-old Parisien living near La Chapelle told The Local on Thursday.
“People shouldn’t forget that it was migrants from countries like Morocco and Tunisia who helped construct many of the local roads and buildings.""
(Town Hall officials clean a park that is home to around 80 migrants. Photo: The Local)
Jean-Philippe, a 34-year-old 3D animator, added: ""I believe that anyone should be able to live anywhere they want. These guys are here because of problems back in their home country.""
Nevertheless the negative opinion of the majority of the French public contrasts starkly with Germany where a recent poll revealed 69 percent were in favour of the country taking in refugees - a contrast explained by differing economic fortunes of the two states.
“The French see France as a country in economic difficulty, with a high level of unemployment, with public resources hard to come by and an immigrant population that is already high,” explained Jérôme Fourquet from Ifop polling agency.
France certainly lacks the resources to cope with newcomers, with only 30,000 hostel beds for asylum-seekers.
But as well as a lack of will and resources in France others argue that Sweden and Germany attract more migrants for different reasons other than the warmth of their welcome.
The majority of refugees are currently Syrians, Iraqis, Eritreans and Somalis -- groups that have stronger ties to Britain, Germany and Sweden. France's relative lack of English speakers is also believed to be a turn-off.
But although public opinion may be against taking in more refugees and asylum seekers, France’s Socialist government now appears ready to act.
On Thursday President François Hollande called for a crisis meeting of his top ministers on the issue of migrants. Also, Interior Minister Bernard Cazeneuve insisted this week that they serious about the issue.
(The Calais camp of The Jungle 2. Photo: AFP)
On Saturday French Prime Minister Manuel Valls said migrants and refugees who ""are fleeing war, persecution, torture, oppression, must be welcomed,"" adding that the rule should be to treat them with ""dignity"".
""Our task is to find lasting responses founded on the values of humanity, responsibility and firmness,"" he said.
Those words will please the likes of Sudanese Abd Al Kareem, who has spent eight months living in a park in Paris, and the thousands of others that will no doubt follow him.
But even if more migrants and refugees like Al Kareem are granted asylum in France, the problems do not end there.
“No one here goes hungry. But that's not the problem,"" he told The Local.
""I've got papers, I am going to stay in France.... but what am I going to do? We need work, we need a place to live, we need to learn the language. How are we going to do that?"""
https://www.thelocal.fr/20150217/france-blasted-in-european-aslyum-report,asylum seeker,733,"
				17 February 2015
				10:53 CET+01:00			 
					10:53 CET+01:00				",Oliver Gee,New report blasts France over asylum failings,"A new asylum report has scolded France over its mistreatment of asylum seekers, accusing French authorities of failing to deal with the crisis in Calais and not taking their share of Syrian refugees.
The deficiencies of France's asylum policy were laid bare on Tuesday by the Council of Europe, an independent body which aims to improve cooperation between European countries. The Council's Commissioner for Human Rights Nils Muiznieks presented the report at a press conference in Paris, with France Info able to get a preview of his findings that were severely critical of France. Muiznieks took particular aim at France's slow treatment of asylum applications and its failure to resolve the crisis in the northern port of Calais, where thousands are living in makeshift camps or in forests. The report scolded France for the migrants' poor living conditions and urged measures to be taken to protect them from violence, which has regularly flared up between migrants. In early January, around 200 migrants brawled as tension mounted after the holiday season saw too few trucks crossing the channel. Muiznieks' findings were based on interviews with charities working in Calais and in the area of asylum, one of which is La Cimade. Jean-Claude Mas, secretary general of La Cimade, told The Local on Tuesday that France desperately needed to act because asylum seekers are living in ""absolute poverty"". ""The report highlights weaknesses that we have been stressing for a long time. Politicians need to have the courage to give protection to those refugees who are arriving at our gates from war-torn countries,"" he said. Mas says France is too slow at dealing with applications from asylum seekers and doesn't do enough to stop them living in squalid conditions while they wait to find out if they will be granted protection. Tuesday's report from the Council of Europe also pointed out that there were far too many unaccompanied minors living in France, estimating as many as 12,000. These children mostly do not benefit from health care or schooling, and some of them have even ended up in detention with adults. The Council also rapped France for not taking its share of Syrian refugees, urging the country to maintain its commitment of taking in at least 500 of the 2 million who have fled. Authorities in France have often been accused of not wanting to improve the conditions for asylum seekers fearing that it would simply attract more refugees.
But La Cimade's Mas says those seeking asylum would come anyway. ""They are fleeing countries like Syria and Iraq. Who would want to live there at the moment? They come to France because their countries are at war,"" he said. ""And it's not true to suggest France is overrun by migrants. If you look at Italy they accept a lot more refugees,"" he said. 'The UK needs to take on its responsibility' A reform to improve the country's system of asylum is currently going through the French parliament, which if passed should help bring down the time it takes to process applications. France's interior minister announced last year that a day centre for migrants would be opened in Calais, just weeks after he appeared to dismiss the idea. Campaigners blasted the move as a half measure. But when it comes to resolving the crisis in Calais, Mas says the UK must take on its responsibility. ""These people want to go to the UK, so it's logical that Britain deals with their demands for asylum on British soil,"" Mas said. Since 2003 the official UK border has been in France, in an attempt to stop illegal migrants reaching Britain to claim asylum. ""The UK needs to change its policy. The UK government is hiding behind public opinion but what about our European values, that's what their policy should be based on. ""These people are dying, they are fleeing war. They need protection."" It's an argument regularly put forward by French officials, including the mayor of Calais, who threatened to close Calais to British ferries last year unless London did more to help. ""I think the border should be on British territory because it's up to you to decide the migrants you want to let in or not,"" the mayor from the opposition centre-right UMP party told British lawmakers. SEE ALSO: In pictures: The Calais migrant crisis (A migrant brushes his teeth at a Calais squat. Photo: Joshua Melvin/The Local)"
https://www.thelocal.fr/20160608/france-sees-one-fifth-rise-in-asylum-requests,asylum seeker,272,"
				8 June 2016
				16:46 CEST+02:00			 
					16:46 CEST+02:00				",AFP,France sees asylum requests rise by a fifth,"France saw an 18-percent rise in asylum requests in the first five months of the year, but numbers were down from a peak at the end of 2015, migration officials said Wednesday.
Pascal Brice, the head of the French Office for the Protection of Refugees (OFPRA), said France had counted 33,000 asylum requests between January and May, compared to 28,000 for the same period in 2015.
He described it as a ""controlled increase"" after a 2015 which saw a 23.6 percent jump in requests due to a burst of asylum requests at the end of the year as Europe's migration crisis hit peak levels.
France received 80,075 asylum requests in 2015 -- mostly from Sudanese and Syrian nationals. It is far from the one million arrivals in Germany which has borne the brunt of the crisis.
""There is no asylum crisis in France,"" said Brice.
Many refugees are reticent to come to France, with its notoriously complicated administrative process and lack of beds for asylum-seekers which leaves many on the street.
Paris has promised to take another 30,000 refugees as part of a European Union deal to share the burden among member states, and has scrambled to create new welcome centres and ease the administrative process.
Interior Minister Bernard Cazeneuve said France would accept 400 refugees per month who are currently in Greece to reach its goal.
In Paris alone, police have undertaken 23 evacuations of makeshift camps around the city and moved people into more permanent reception centres.
Paris Mayor Anne Hidalgo said last week she wanted to create a refugee camp in Paris to provide proper accommodation for asylum seekers."
https://www.thelocal.fr/20161021/national-front-posts-addresses-of-migrants-in-french-town,asylum seeker,538,"
				21 October 2016
				11:49 CEST+02:00			 
					11:49 CEST+02:00				",The Local,National Front posts locations of migrants in French town,"A local branch of France’s far right National Front party has prompted anger by posting the addresses of where migrants are staying in a town in south west France.
Marine Le Pen, the leader of the far right National Front, is doing her best to steer clear of controversy and negative headlines, but one of her minions obviously did not get the message.
The Hautes-Pyrénées branch of the National Front has undermined Le Pen’s attempts to make her and her party seem less extreme by posting on Facebook the addresses of where some 250 migrants are being lodged in the Catholic pilgrimage town of Lourdes.
The post was uploaded on October 17 to denounce the “outrageous camouflage by authorities” around the arrival ""of 250 illegal immigrants in Lourdes who will be housed, fed and cared for, for free or even at the taxpayer’s expense"".
It has since been taken down. Perhaps that had something to do with the racist and hateful comments below the post.
“The Pyrenees does not want Islamist invaders, we will do everything to turn them away. All these wild animals, they disgust me. They are garbage on French soil,"" read one.
The author of the post, Olivier Monteil, secretary of the department’s branch of the National Front, included a list of homes or lodgings where refugees were to stay as well as the telephone number of the local reception centre for asylum seekers in Lourdes.
While the house numbers were apparently blurred out, the street names were not.
(The Catholic pilgrimage town of Lourdes. AFP)
He also suggested the local police had been told not to intervene if there were any serious incidents involving the asylum seekers and refugees and to just a keep a record of incidents.
Local authority chiefs in the Hautes Pyrenees department rubbished that claim and said the figures quoted in the Facebook post were wrong, insisting that there would be only 108 places for refugees and asylum seekers in Lourdes.
Monteil defended his action saying: “I wanted to give the local people of Lourdes information about the migrants that are being hidden in the local population.”
“They are paying their taxes, so why should it all be hidden,” he told BFM TV. “They occupy social lodging that should be reserved for French people.
“There may be terrorists hiding among them.”
He said his beef was with the local authorities and not the migrants themselves. His post ended with the words “Marine, come quickly, really quickly” in reference to the party leader, who is hoping to defy the odds and be elected French president next year.
The charity France Terre d’Asile, which provides help to migrants and refugees in France, has lodged a formal complaint with police accusing the National Front of “an attack on someone’s private life and divulging information that endangers residents.”
The incident in Lourdes comes at a time when there is tension in the many towns and villages around France that are to host groups of migrants moved from the Jungle camp in Calais, which faces demolition.
Some lodgings have been targeted by arsonists, while one was sprayed with bullets. There have been demonstrations in many towns against the government’s decision to move migrants around France."
https://www.thelocal.fr/20170828/macron-hosts-african-and-eu-leaders-for-summit-on-migration,asylum seeker,619,"
				28 August 2017
				14:57 CEST+02:00			 
					14:57 CEST+02:00				",AFP,Macron hosts African and EU leaders for migration talks,"Seven African and European leaders are meeting in Paris on Monday to discuss ways to stem the flow of migrants into Europe from northern Africa.
French President Emmanuel Macron has invited his counterparts from Niger and Chad as well as the head of the Libyan unity government Fayez al-Sarraj, whose countries lie on the main transit route for migrants heading to Europe.
German Chancellor Angela Merkel, Spanish and Italian prime ministers Mariano Rajoy and Paulo Gentiloni, and Europe's top diplomat Federica Mogherini will join the talks.
European nations are keen to offer development aid and funding to their African partners in return for help in stemming the flow of economic migrants and asylum seekers.
READ ALSO: Macron faces big foreign policy week ahead as approval ratings slide
Some 125,000 migrants have crossed the Mediterranean by boat this year, according to UN figures, with the vast majority arriving in Italy before travelling on to other EU members. An estimated 2,400 have died en route.
France is seeking improved border controls and patrolling of the waters around Libya - a mission complicated by the country's competing governments and state of lawlessness - as well as development aid to create jobs in Africa.
In July, Macron also proposed - without consulting his allies - the creation of so-called ""hotspots"" in Africa where asylum seekers fleeing persecution or war could lodge a request to travel to the EU.
Under such a system they may be less tempted to make the perilous trip across the Mediterranean with the help of people traffickers, who frequently overload flimsy boats and often mistreat the migrants.
READ ALSO: France must build more migrant centres, watchdog says
""Above all, we have to save lives, we have to avoid situations where migrants and refugees put their lives in danger to reach protection,"" said Ralf Gruenert, France's representative of the UN refugee agency UNHCR.
""This working meeting will try to explore... how to ensure that refugees and asylum seekers can access protection mechanisms,"" he told AFP.
Sharp fall in crossings
The meeting might also provide insight into why arrivals have plummeted in recent weeks from Libya, the main route into Europe since a separate pathway from Turkey into Greece was shut down in 2016.
The numbers arriving in Italy have fallen by around 50 percent in July and August compared with last year.
Possible reasons include improved action by the Libyan coastguard, tougher border controls in transit countries inland, as well as Libyan militias joining efforts to stop boats leaving.
The president of Niger, Mahamadou Issoufou, will tell his European counterparts that the number of migrants passing through the transit town of Agadez in his country has fallen by 80 percent thanks to government efforts, a source in his team told AFP.
Libya has also sought to restrict the work of NGOs operating rescue boats in the Mediterranean that pick up migrants stranded on inflatable dinghies or other unseaworthy crafts.
Italy has also sought to impose a code of conduct on the NGOs, which face accusations from some critics that their operations have encouraged migrants to attempt the crossing with the knowledge that they will be picked up in an emergency.
The code has been signed by five of seven NGOs with rescue ships - only the French organisation Doctors Without Borders and Germany's Sea-Watch have refused as a matter of principle, saying they wait to maintain their independence.
The code is set to be approved by all the countries attending Monday's meeting, according to the Italian news agency ANSA.
After the talks about immigration during the day, the European leaders are set to discuss reforming the EU and joint efforts to prevent terror attacks.
By Cécile Feuillatre and Claire Gallen"
https://www.thelocal.fr/20140723/france-aims-to-overhaul-immigration-system,asylum seeker,900,"
				23 July 2014
				13:50 CEST+02:00			 
					13:50 CEST+02:00				",Joshua Melvin,French test plan for long-term visa applicants,"New legislation unveiled on Wednesday aims to shrink the bureaucratic hurdles foreigners who want to stay in France face and provide a glimmer of hope for asylum seekers languishing in limbo. But anyone wanting to get a ten-year visa would need to be able to read French.
French authorities are aiming to make a dent in the mountain of paperwork and delays generated by some of the antiquated sections of its immigration system with a new ground-breaking bill. The proposals are also seeking to address a growing humanitarian crisis among its most vulnerable recent arrivals. The French government hopes the legislation, proposed at Wednesday's cabinet meeting, will mean a kinder welcome for foreigners and real effort to help them integrate into society. At the same time France wants to catch up on its delay in attracting the best and the brightest minds from abroad. 'France must remain a land of immigration' Current Interior Minister Bernard Cazeneuve told French paper Liberation that France ""must remain a land of immigration and a land of asylum,"" adding that ""countries closed to the outside world are condemned to decline."" The law, which was penned by Prime Minister Manuel Valls in his previous job as interior minister, is an effort to approach the controversial topic in a calm and pragmatic way, the government claims. Here’s four key points about the new legislation: Multi-year visas: Many foreigners in France are here on a “carte de sejour” (residency permit) that is good for a year. For scores of thousands of people this means making an annual appointment at the local Prefecture, waiting in line and then usually going back a second time because the clerk wanted additional documents in order to stay legal. But this new laws proposes making the permits valid for up to four years, meaning a huge reduction in paperwork for foreigners and the government alike. As it stands 99 percent of the renewal applications are granted. However, as the proposed law is written, one would have to be taking language and civics classes to get the extended visa. And getting the coveted ten-year residence permit after that would be conditioned on being able to read and understand simple texts in French. One visa for skilled workers: The government is calling it a “Talent passport” and it would be a new visa category that allows people with particular talents (artists, scientists, athletes and business leaders) the possibility to more easily live and work in France. It would replace the tangled mess of various visas issued depending on one’s circumstances and reasons for being here. The idea of these four-year visas is to attract talent to France and make it easier for those people to work. “We’re far behind the rest of Europe, our neighbours attract far more of these types of candidates than we do,” an unnamed government source told French daily Le Croix. SEE ALSO: Calais migrants: 'France needs a new policy'
Cut asylum delays: Amid wars in Iraq, Syria and Afghanistan, France has seen the annual number asylum seekers nearly double in six years. In 2013 the number stood at 65,894 and though only 11,415 cases were granted asylum, many had to wait up to two years for a decision from French authorities. The new law proposes cutting the wait to nine months by 2017 via a programme of bolstering resources and manpower. Cases suffering from excessive delays could also be fast-tracked, as could appeals lodged when asylum seekers are rejected. Protecting asylum seekers: During the two years many asylum seekers spend awaiting a decision from French authorities some are lucky enough to get into government housing. But half of them end up homeless, living in squats or improvised housing they’ve found themselves. Under the new proposed legislation, the government would provide housing for all asylum seekers, but it would be spread out across the country. Failure to live in the assigned housing would mean the government could cut off the welfare payments to asylum seekers. Each case would also be assigned a lawyer who would be paid for by the government. 'Policy of repression' The “integration” aspect of the legislation has already raised the hackles of immigration rights activists. “[The legislation] is characteristic of the obsession with the struggle against irregular immigration and the order to “integrate” but it doesn’t demonstrate any substantial progress in the area of fundamental rights,” pro-immigrant group GISTI told AFP. Pro-immigrant group GISTI (Information and Support Group for Immigrants) called the residency permit reforms a half-measure that fails to tackle the real issue, which is providing some guarantees to immigrants about their future in France. The group called on the leaders to grant ten-year permits to long-term residents. “The granting of a ""multi-year visa"" which could, additionally, be taken away at any time by the Prefecture, doesn’t resolve any of these problems,” the group wrote in a statement. “We reject that in 2014 the people who have built their lives in France are left unstable by doubtful residency rights.” Another immigrant group La CIMADE said the government has clearly chosen to stay in “continuity with the policy of repression”. There was no immediate word from France’s far-right, anti-immigrant National Front, but it is undoubtedly legislation they will weigh in on soon. It's unclear when the bills could be voted on, but the government was hoping to get both before parliament by the first quarter of 2015."
