href,keyword,word_count,info,author,headline,article_text
https://www.thelocal.fr/20180814/man-injures-four-one-seriously-in-knife-rampage-in-dordogne-france,asylum seeker,216,"
				14 August 2018
				14:21 CEST+02:00			 
					14:21 CEST+02:00				",AFP,Four people injured in knife rampage in Dordogne,"An Afghan asylum-seeker was arrested after launching a drunken and frenzied knife attack in the sleepy southwestern French town of Perigueux, injuring four people including one seriously, police said Tuesday.
The incident began Monday evening with the 19-year-old man, who was known to have psychological problems according to local authorities, lashing out at cars outside his home.
The head of the ambulance service for the area, Jean-Jacques Girard, told the regional Sud-Ouest daily that he was seen “kicking and banging a first vehicle with his feet and fists, then a second” and also “rounding on female motorists.”
Two paramedics who witnessed the incident tried to calm the man down but after disappearing inside his home he returned with a knife and attacked them, leaving them with injuries to the head and neck.
He then turned on two brothers aged 64 and 68 living next door, leaving one with a perforated lung and the other with stab wounds to the back.
The man was eventually overpowered by one of the brothers and a man of Cameroonian origin, who stepped in to help wrestle his knife away.
Police arrested the man and placed him in custody on charges of aggravated violence.
They ruled out any terrorist motive.
READ ALSO: Which parts of France are safest to live in?"
https://www.thelocal.fr/20141004/chadian-asylum-seeker-tries-to-self-immolate-in-france,asylum seeker,386,"
				4 October 2014
				06:56 CEST+02:00			 
					06:56 CEST+02:00				",AFP,Asylum-seeker sets fire to himself in France,"A Chadian suffered serious burns after setting himself alight on Friday inside a French courthouse when his final chance at obtaining asylum was thrown out, the court said.
The 38-year-old man, who was carrying a bottle, doused himself with petrol before setting himself on fire and suffered serious burns to his scalp and torso. Pascale Girault, the secretary general of the National Court of Asylum, said the man's first demand for asylum was rejected by the Office for the Protection of Refugees and Stateless People (OFPRA) a few months ago. ""He filed an appeal which was rejected"" by the court, Girault said. On Friday the man returned to the asylum court in the eastern Parisian suburb of Montreuil ""for information on how his situation could be re-examined."" When staff at the front desk explained the decision he ""doused himself in fuel and set fire to his clothes,"" said Girault. Security guards used a fire extinguisher to put out the flames, said a police source. In theory a request for asylum cannot be examined a second time unless the person furnishes new information, said a spokesman for OFPRA. A police source said the man had arrived in France via Syria. ""He was two metres from the front desk, looked at the notice board and doused himself with a large bottle filled with a transparent liquid,"" said Maya Lino, who witnessed the scene. ""His eyes were glazed. He pulled out a lighter, tried a first time, it didn't work and everyone screamed,"" she added. ""He tried again a second time and burst into flames all the way to his head. He began running."" Every year some 40,000 asylum seekers appeal to the court after their cases are denied by OFPRA. If the court rejects an appeal, the asylum seeker is usually expelled from France. ""Often the decisions of the court are perceived as dramatic and I understand that because they can end someone's life plans,"" said Pierre Henry, director of an organisation which supports asylum seekers. ""But this was a desperate act, which fortunately is an exception. We should put our feelings aside and not exploit this tragedy to challenge an entire process,"" he said.
Of the 38,540 decisions taken by the court last year, 108 concerned Chadians. It found in favour of only 17 of these applicants."
https://www.thelocal.fr/20180416/whats-wrong-frances-new-immigration-law-according-to-rights-groups,asylum seeker,528,"
				16 April 2018
				17:42 CEST+02:00			 
					17:42 CEST+02:00				",The Local,Here's what's wrong with France’s new immigration law - according to rights groups,"As parliament begins debating France’s controversial immigration bill, hundreds protested outside the Assemblée Nationale in Paris, while a major human rights group warned the proposed laws could ""punish"" asylum seekers by reducing their rights.
Critics say the bill is repressive, but the centrist government insists it is creating a more efficient system to sift out genuine refugees from those simply seeking a better life in France.
“Under the guise of providing a more effective asylum system, the bill includes a series of measures that would diminish access to protection,” said Bénédicte Jeannerod, France director at Human Rights Watch (HRW).
“If France intends to improve the efficiency of its asylum system, it should start by allocating sufficient resources to the existing system, and not punish asylum seekers for these deficiencies by truncating their rights,” she concluded in a statement from the group.
The concerns raised by rights groups such as HRW include the following:
Reduced period to apply for asylum means many migrants could miss the deadline
The bill would reduce the period for filing an asylum application from 120 days after entering French territory to 90 days. But asylum seekers already face major obstacles to filing their applications, and making the period shorter means more will likely miss the deadline.
Applications would still be able to be made after the 90 days, but these would likely be not examined thoroughly as the officials handling them would be inundated with cases, according to HRW.
Shortened deadline for asylum seekers to appeal rejection means many will lose out
The bill would reduce from one month to 15 days the time for asylum seekers to appeal if their request has been turned down. But many may lose out because that short time-frame is not sufficient to prepare for what can be a technical and complex procedure, often requiring legal support.
Deportation of rejected asylum seekers would no longer be suspended pending appeal
Asylum seekers can currently remain in France while their appeal of their rejected request is being examined. The new law would let the government deport them - if they are from what are deemed to be safe countries - while the appeal is being heard.
HRW says that removing the automatic suspension of deportation during an appeal means asylum seekers could be sent back to their country even if their claims of persecution have not been fully adjudicated.
Increased maximum detention period
The bill would increase the maximum administrative detention period for those awaiting deportation from 45 to 90 days. But HRW points out that data it has viewed shows that foreigners in mainland France in 2016 were expelled on average after 12 days of detention.
“The justification for this provision, much less the necessity, is therefore very much in doubt,” the rights group said.
Migrant children in detention
HRW laments that the draft law does not address the issue of the detention of migrant children, “when it could have been an opportunity for France to abolish this practice.” It noted that in six cases between 2012 and 2016 the European Court for Human Rights ruled hat France’s detention of children violated the prohibition on inhuman treatment or punishment."
https://www.thelocal.fr/20151020/france-deports-just-four-percent-of-asylum-seekers,asylum seeker,375,"
				20 October 2015
				17:02 CEST+02:00			 
					17:02 CEST+02:00				",The Local,France: 96 percent of asylum rejects stay,"France's asylum procedures have been slammed as too long and inefficient, with as many as 96 percent of refugees who are refused asylum not being deported, an official report found.
The damning report was made public on Tuesday by the top national auditing body, the Accounting Court (Cour des Comptes), and showed France's asylum system to be a sorry sight.
The court noted that France performed poorly compared to its European neighbours when it came to processing times for asylum seekers, who are forced to wait two years on average. The process in Germany, on the other hand, only takes one year.
French authorities have previously said they aim to reduce this waiting time to nine months, a move noted and welcomed by the court, which said that such long waiting times make it difficult to accurately assess the situations of those seeking asylum.
The documents also pointed out that a whopping 96 percent of refugees whose request for asylum is rejected aren't deported. It noted that of the 40,206 people whose request was rejected, only 1,432 people were actually deported.
The report didn't specify what became of those who stayed, though it's likely that many would have stayed to appeal the decision, or headed abroad of their own accord, or perhaps just ended up living on the streets, with authorities losing track of them.
The report also drew attention to France's considerably high rate of application rejections for asylum seekers at 74 percent.
Other points of contention included the high expenditure in social assistance and accommodation for asylum seekers, which was said to be €690 million in 2013, and which is estimated to have increased from 2009 to 2014 by 52 percent.
Prime Minister Manuel Valls was less than impressed with the report, writing in a response published on Tuesday that the authors' reasoning had been ""simplistic"".
He noted, for example, that the deportation figures didn't take into account voluntary departures by the asylum seekers or the fact that some succeeded in legally acquiring residency permits after appeal.
But, he added that the efficient treatment of asylum seekers was a priority for the government.
There were around 65,000 asylum seekers in France in 2014, a figure that is expected to remain stable in 2015."
https://www.thelocal.fr/20150512/france-welcomes-27-percent-more-asylum-seekers,asylum seeker,197,"
				12 May 2015
				13:30 CEST+02:00			 
					13:30 CEST+02:00				",The Local,Lots more asylum seekers call France home,"France was Europe’s third-biggest recipient of asylum seekers last year as the country took in thousands more applicants than previously.
With wars and conflicts raging worldwide, France granted asylum to 20,640 people last year, a rise of 27 percent year on year, new figures from Eurostat show.
Russians made up the largest group awarded protection status with 2,080 positive decisions, or 10.1 percent of the total. France also welcomed 2,015 Syrians and 1,685 people from Sri Lanka.
France rejected 78 percent of applicants in the first instance, with just 14,815 people out of a total 68,500 given protection status. A further 5,825 people were granted asylum on appeal.
More than 750,000 people have received asylum in the European Union since 2008, with Germany and Sweden consistently taking in more asylum seekers than any other countries.
Germany took in 47,555 asylum seekers last year, 82 percent more than the year before. Sweden accepted 33,000 applicants, up 25 percent on 2013.
Italy approved just ten fewer applicants than France.
Syrians accounted for 37 percent of the beneficiaries of asylum protection, followed by Eritreans (eight percent) and Afghans (eight percent).
READ MORE: France rejects four out of five asylum seekers"
https://www.thelocal.fr/20170622/france-to-convert-hotels-into-lodging-for-asylum-seekers,asylum seeker,361,"
				22 June 2017
				17:48 CEST+02:00			 
					17:48 CEST+02:00				",The Local,France converts hotels into lodging for asylum seekers as Calais migrants crisis rumbles on,"France is being forced to convert former low-cost hotels around the country into accommodation for migrants seeking asylum due to the growing pressure on existing structures.
The scheme has been developed to deal with the huge shortage of housing for asylum seekers in France that has been exposed after authorities closed several refugee camps, in particular the notorious Calais ‘Jungle’ camp in October 2016.
The plan has been called “Prahda” (Program for reception and accommodation of asylum seekers), and is an initiative set up by the housing ministry which issued a call to authorities for an extra 5,351 emergency places back in September.
The centres will be temporary accommodation but with the aim of getting asylum seekers into more permanent accommodation.
Some of the accommodation converted for asylum seekers will be the budget Formule1 hotels. According to L'Express newspaper it will cost authorities €5,000 to covert each hotel room to suitable accommodation.
The state bought 62 Formule1 hotels earlier this year, but some will also be used to lodge vulnerable people.
Some 86,000 applications for asylum were recorded in France last year, but dedicated reception centres offer only 40,000 places.
But some are against the scheme of rehousing asylum seekers in small towns.
Stéphane Dupont-Ferrier, mayor of Fontanile (Isère) told L’Express newspaper: “96 people is an enormous number for our town of 2,800 inhabitants. It risks bringing trafficking and prostitution”.
Thierry Cozic, the socialist mayor of Arnage (Sarthe) said he is not against the welcome centers but said that “contrary to common sense” a center will be built near a tourist complex.
The desperate need for accommodation for migrants and asylum seekers in France comes after the Human Rights Chief, Jacques Toubon, expressed concern over the treatment of migrants still living in and around Calais.
Toubon was quoted in Le Monde saying that he was worried about the ""infringements of fundamental rights"" of about 600 migrants in the region of Calais who are waiting for their asylum application to be processed.
He denounced the ""inhuman living conditions” because migrants have a lack of access to food, water and shelter.
He visited migrants on 12th June and called the situation “incredibly serious”."
https://www.thelocal.fr/20180108/france-sees-number-of-asylum-requests-hit-record-high,asylum seeker,408,"
				8 January 2018
				10:57 CET+01:00			 
					10:57 CET+01:00				",The Local,France sees number of asylum requests hit record high,"A record number of requests for asylum were made in France in 2017, new stats reveal, with the country receiving more than 100,000 applications for the first time.
The historic rise in applications was revealed by figures released by the French Office for the Protection of Refugees (OFPRA).
France registered 100,412 applications in 2017 which came mostly from Albanians, Afghans and Africans.
This number represents a jump of 17 percent compared to 2016, which was already up 6.5 percent on the number of applications in the previous year.
On top of that, in 2015 applications increased by 22 percent during a year which saw an unprecedented number of people coming to Europe to claim asylum, according to a report in Le Parisien.
However Pascal Brice, director general of OFPRA told Le Parisien that this ""sustained"" increase is ""not representative of an inundation"".
Although Brice said the figures confirm that ""France is one of the top countries for asylum applications in Europe"" while noting that France has a way to go before it hits the number of requests seen by Germany which expects just short of 200,000 cases this year.
READ ALSO:
French government under fire for new crackdown on migrants
Photo: AFP
Of these applications received by France in 2017, 36 percent resulted in the applicant receiving refugee status compared to 38 percent in 2016.
The rise in asylum requests filed by Albanian and West African nationals has seen a particularly sharp rise.
Although Albania is on the list of ""safe countries of origin"", in 2016 Albanians accounted for the largest proportion of applications, making 7,630 requests (excluding accompanying minors).
This represented an increase of 66 percent.
The second largest number of requests came from Afghans, with 5,987 requests (up 6 percent) followed by Haitian nationals whose requests remained stable at 4,934.
Sudanese applications decreased by 24 percent to 4,486 in 2017, while Guinean applications numbered 3,780 (up 62 percent).
Meanwhile the average waiting time for the requests to be processed ""fell to almost three months,"" according to Brice.
OFPRA, he assured, ""continues its efforts to achieve in 2018 the goal of two months"" set by French President Emmanuel Macron in July, ""in strict compliance with the rights of each applicant.""
In December, Macron's government prompted fury among rights groups for saying it wanted to expel more failed asylum seekers and do it at a faster pace as a tough new bill on immigration is being thrashed out."
https://www.thelocal.fr/20140321/asylum-mum-stranded-in-paris-with-8-kids,asylum seeker,378,"
				21 March 2014
				12:01 CET+01:00			 
					12:01 CET+01:00				",The Local,Asylum family stranded in Paris airport for a week,"An Eritrean woman and her eight children have been trapped at Paris's Charles de Gaulle airport for more than a week after being deported by the Norwegian government.
Norway's immigration services deported Simreth Wolbgeber and her family on March 12 to France, the European country responsible for processing their asylum claim under European Union rules. The family arrived in France early last year, after fleeing the repressive government in Eritrea, and it was there that they were first fingerprinted and registered as asylum seekers. The French authorities claim to be unable to find temporary accommodation for such a large family, and as a result have left Wolbgeber and her children stranded, sleeping on uncomfortable plastic seats in the airport lounge and depending on charity from the Red Cross as they wait for a place. ""To sit for so many days at an airport with eight children is inhuman. It is outrageous,"" Ranveig Kaldhol, a church social worker in Ulsteinvik, where Wolbgeber had been living, told The Local. ""It's terrible,"" Kaldhol added. ""They are innocent children and they haven't had one decent meal. They have been living on drinks, cup cakes and yoghurt given to them by the Red Cross, and they haven't had beds, or even a shower. The youngest is only five months old."" She argued that when children are involved the Norwegian authorities had a duty to liaise with a receiving country's immigration agencies. ""The Norwegian government, before they send children, they should know that there is someone to take care of them to give them at least the minimal protection,"" she said. ""They haven't done anything criminal, they have just asked for protection from Eritrea. That's their sin."" Geir Bang Danielsen, the deputy director of Norway's immigration police, told NRK that the responsibility for the family now lay with France's authorities. ""France is responsible for the family according to their duties under the Dublin cooperation,"" he said. ""The aim is to ensure that an asylum seeker get his application processed, but at the same time to ensure that no one travels from country to country and applies for asylum in several Schengen countries."" Here is a picture a friend of Simreth Wolbgeber's took of her in the airport: Here are her children trying to sleep:"
