href,keyword,word_count,info,author,headline,article_text
http://www.bbc.co.uk/news/uk-26956544,asylum seeker,437,9 April 2014,None,Theresa May defeated over asylum seeker benefits,"The home secretary has lost a High Court battle over the financial support given to the poorest asylum seekers while their claims are being processed.
A coalition led by Refugee Action said it was unacceptable that the amount of money - about £36 a week for a single adult - had been frozen since 2011.
The court agreed, ruling that Theresa May had not acted ""rationally"".
The Home Office said it was ""disappointed"" at the decision and was considering launching an appeal.
The court ordered Mrs May to reach a new decision on the level of support by 9 August.
Campaigners compared the freeze on payments to destitute asylum seekers with income support, which has been increased in line with living costs each year since 2011.
Income support is currently £57.35 a week for a single person aged 16-24 without dependants, and £72.40 a week for those aged 25 or over.
Refugee Action said the ""cripplingly low level of financial support"" for asylum seekers had affected more than 23,000 people and left half of those it had spoken to without enough money to feed themselves or their families.
Mr Justice Popplewell said the decision to freeze rates for a third year in a row in 2013-14 amounted to ""a reduction in real terms from what was regarded in 2007 as the bare minimum level necessary to avoid destitution"".
He ruled the decision legally flawed, adding: ""In my judgment, the information used by the Secretary of State to set the rate of asylum support was simply insufficient to reach a rational decision to freeze rates.""
Refugee Action chief executive Dave Garratt said: ""Every day at Refugee Action we see the human impact of this unlawful Home Office policy which robs individuals and families of their dignity.
""While we are hugely heartened by today's judgment, we urgently need to see the Home Office acting on this ground-breaking ruling by setting up a transparent and robust enquiry into the way asylum support rates are calculated.""
Freedom from Torture chief executive Keith Best said ""decent financial support"" was ""vital to torture survivors being able to rebuild their lives in the UK"".
A Home Office spokesman said: ""We are disappointed with the court's judgement. We are looking at all options, including appealing.""
The Home Office pointed out that the judgement did not say payments were too low, but rather that there were errors in the way current levels had been set.
Increasing them could encourage spurious asylum claims which could clog up the system and make it harder for those with a genuine fear of persecution from receiving vital support, it added."
http://www.bbc.co.uk/news/world-europe-30447125,asylum seeker,217,12 December 2014,None,'Far right link' in southern Germany anti-asylum-seeker fires,"Far-right arsonists are believed to have caused fires which damaged three buildings earmarked for asylum seekers near Nuremberg in southern Germany.
The renovated buildings were empty when the fires took hold on Thursday night. Firefighters quickly put out the blazes and no-one was seriously hurt.
Swastikas were daubed on one building with the slogan ""no asylum seeker in Vorra"" - the town where it happened.
Germany hosts more asylum seekers than any other country.
Local authorities have been struggling to accommodate rising numbers of them, many of whom have fled the wars in Syria and Iraq.
Police in Vorra estimate the fire damage at 700,000 euros (£555,000; $872,000). The three buildings were a former restaurant, a barn and a vacant block of flats.
Bavaria's Interior Minister Joachim Herrmann, of the conservative CSU party, said it was ""obviously arson"".
""And these swastika graffiti raise suspicions that far-right activists could have been responsible,"" he added.
Vorra's Mayor Volker Herzog - from the Social Democrats (SPD) - said the activists were suspected of having met at a local house at weekends, though there was no pattern of far-right offences.
Bavaria's Prime Minister Horst Seehofer (CSU) said Bavaria ""is distinguished by its citizens' willingness to help and support those who seek peaceful refuge in Bavaria and protection from war and persecution""."
http://www.bbc.co.uk/news/world-australia-34654957,asylum seeker,358,28 October 2015,None,Pregnant asylum-seeker Abyan to fly from Nauru to Australia again,"A pregnant Somali woman who says she was raped in Australia's refugee detention camp in Nauru is to be flown back to Australia.
She was previously flown from the island to Australia to have an abortion, but was flown back without having had it, a few days later.
Authorities said she changed her mind about the procedure, but the woman, known as Abyan, denied this.
Australia refuses to accept refugees attempting to reach it by boat.
They are kept in camps in Nauru and Papua New Guinea while their claims are processed. Even those found to be genuine refugees are resettled outside Australia.
Abortion is legal but heavily restricted on both Nauru and Papua New Guinea, hence the need for the woman to fly to Australia.
Earlier on Wednesday, the United Nations urged Australia to provide ""a decent option"" for the woman, who it said was ""in a very fragile mental and physical condition"". The Australian government says it will provide counselling when she is in the country, though it declined to be specific on when that might be.
Abyan's lawyers said she was returned to Nauru the first time just for wanting counselling and more time to make up her mind, not because she had decided against an abortion. The head of the Australian Human Rights Commission described the case as ""extraordinary"".
It comes as the Philippines says it will not accept refugees sent by Australia unless they are only there temporarily.
President Benigno Aquino, responding to an Australian proposal to resettle refugees in the country, pointed out that his country was far more populous than Australia and had difficulties providing for its own population.
Australia is one of the world's richest countries, whereas roughly a quarter of the Philippines' approximately 100 million people live in deep poverty.
Mr Aquino also noted that after the Philippines agreed to host Vietnam War refugees temporarily in the 1970s, hundreds of thousands ended up staying for many years.
Australia currently has an multi-million dollar agreement with another developing nation, Cambodia, to resettle refugees there. But so far only four have made the move, despite offers of cash and free accommodation."
http://www.bbc.co.uk/news/uk-scotland-glasgow-west-29935468,asylum seeker,476,6 November 2014,None,"Government fails to overturn £36,000 compensation for asylum seeker","The UK government has failed in a bid to overturn a £36,000 damages award to a Glasgow-based asylum seeker for wrongful detention.
Nemah Shehadeh, 60, was held after an attempt to deport her to Jordan failed in January 2008 when she claimed to be a stateless Palestinian.
A judge previously ruled she had been unlawfully detained from 2008 to 2009.
Three appeal judges upheld that ruling saying the authorities had breached the legal principles that govern detention.
The court heard how Ms Shehadeh previously lived in Saudi Arabia with her husband, from whom she is now separated.
She was issued with a six-month visitor visa to come to Britain on the basis that she was a Jordanian citizen and arrived in August 2002 but overstayed.
Ms Shehadeh was arrested in 2005 at London's Heathrow airport with her as they were attempting to use false French passports to travel to Canada.
She was subsequently convicted of using a false passport at Hillingdon Magistrates Court and sentenced to four months imprisonment with a recommendation for her deportation.
Following her release, Ms Shehadeh was neither detained nor deported and went on to make an asylum claim which was rejected in 2007.
In January 2008, she was flown to Jordan but on arrival told immigration officials that she was Palestinian and as a result was refused entry to the country.
In July of that year, the Jordanian embassy told Home Office officials that Ms Shehadeh was not one of their citizens and had only been issued with a temporary travel document by the country's authorities.
It was then proposed that Ms Shehadeh be detained while her case was considered. This involved detention for 12 months from August 2008.
After her release in 2009, Ms Shehadeh brought a case against immigration officials at the Court of Session in Edinburgh for wrongful detention.
Lord Tyre awarded her damages and said: ""There has never been any suggestion that she posed any risk to the public if at liberty.
""As regards risk of absconding, I accept the submission that this was significantly, and sometimes grossly, overstated in the monthly detention reviews.""
Following that decision, an appeal was lodged on behalf of Home Secretary Theresa May.
But Lord Drummond Young, sitting with Lady Dorrian and Lord Philip, said that Lord Tyre was ""fully justified"" in concluding that from August 2008 onwards the immigration authorities were ""in breach of legal principles that govern the lawfulness of detention in such circumstances"".
""The petitioner's detention for the following year accordingly amounted to the delict of wrongful imprisonment, for which she is entitled to payment of damages,"" said Lord Drummond Young.
Ms Shehadeh, considers herself to be a stateless Palestinian, although the Home Secretary regards her as a Jordanian national, judges heard.
She was born in 1954 in the West Bank which was part of Jordan at the time."
http://www.bbc.co.uk/news/uk-england-devon-29809619,asylum seeker,183,28 October 2014,None,Afghanistan asylum seeker Ghairut Safi wins court review,"An asylum seeker living in Plymouth has won an injunction to stop the Home Office deporting him back to Afghanistan.
Ghairut Safi, 20, had been due to fly out on Tuesday night but a judicial review into his case will be heard at the High Court in London on Monday.
He said his life would be in danger from the Taliban if he was sent back to Afghanistan.
The Home Office said Mr Safi ""was found not to need the protection of the UK"".
Mr Safi entered the UK illegally in March 2009 and claimed asylum.
This claim was refused and his subsequent appeal was dismissed.
Mr Safi, who is at a Home Office immigration removal centre, said: ""As soon as the Taliban find me they will kill me and I mean that. There is no doubt about it.""
He could not give any more details as to why the Taliban would kill him.
A Home Office spokesman said: ""The UK has a proud history of granting asylum to those who need it, and we carefully consider each claim on its individual merits."""
http://www.bbc.co.uk/news/uk-wales-politics-43730258,asylum seeker,615,15 April 2018,By Andy Roberts,"Asylum seekers need dedicated GP healthcare, Welsh doctor says","Refugees and asylum seekers need dedicated GP services to get the health care they need, a doctor has said.
Dr Sophie Quinney, who has treated new arrivals in Cardiff, said language, transport and other barriers mean they struggle to use mainstream services.
She also claimed general practices were not geared to help disorientated and traumatised people.
The Welsh Government said it was investing in specialist mental health services which GPs could access.
Updated guidance published for consultation says refugees and asylum seekers ""suffer disproportionately when compared with the general population"" in relation to access to healthcare and outcomes.
Ministers want them to use mainstream NHS services, but admit ""a model of care to facilitate and support integration, or to ensure public health issues are addressed, may initially be appropriate"".
Dr Quinney, a locum GP who has worked at the Cardiff Health Access Practice (CHAP), said it was designed to respond to the needs of newly-arrived asylum seekers, with Iran, Afghanistan and Syria among the main countries of origin.
She said problems arose because they are encouraged to register with a general practice as soon as they are sent to Cardiff by the Home Office.
""They struggle to be understood, they don't understand how the appointments systems work, they find it very difficult to get to the appointment in time, they can't cope with the 10-minute appointment system because there's a language barrier,"" she said.
Dr Quinney, who also works in mainstream GP practices, said CHAP can offer refugees and asylum seekers longer and more flexible appointments, and more support for conditions such as post-traumatic stress disorder.
""Usually there's a delay in the onset of these symptoms - nightmares, flashbacks and extreme anxiety - of around three months after the initial trauma in their home country.
""It's compounded by social isolation - living in Cardiff and not being able to work makes these symptoms worse.""
The role of CHAP has been expanded to include non-medical activities such as reflexology, birth partners and gym projects offered by volunteers.
Dr Quinney said these were not standard GP services, but claimed they were ""critical"" to helping asylum seekers cope on arrival.
Estelle Tije, 33, from Cameroon, had completed a master's degree in nursing in London when she heard her father had been killed during political turmoil in her home country.
She applied for asylum in November when her student visa expired and was sent by the Home Office to Cardiff.
Ms Tije paid tribute to Dr Quinney and the CHAP team for helping her cope with life in an unfamiliar city without resorting to pills and prescriptions.
""I went through a lot of stress - she really helped me by sending me to the gym,"" she said.
""I didn't want medication - I'm a nurse so I understand each medicine has a side effect.
""But through the gym I managed a coping mechanism to overcome that stress.""
The Welsh Government said GPs were able to refer to specialist mental health services, with £40,000 provided in 2017 specifically to train staff in trauma-focused care for refugees and asylum seekers.
A spokesman said: ""Since we published our original guidance in 2009 we have seen significant changes as a result of increasing conflict in the middle and near east.
""Our latest draft guidance provides an update and will support healthcare professionals working with refugees and asylum seekers.""
Dr Jane Fenton-May, vice-chairwoman of the Royal College of General Practitioners Wales, said: ""All staff working in a practice should be aware of the cultural needs of any patient and accessible training and support could help improve that.
""How to best achieve this when GPs are facing severe workload pressures will need to be considered."""
http://www.bbc.co.uk/news/world-australia-29625556,asylum seeker,603,15 October 2014,None,Asylum seeker baby born in Australia denied refugee visa,"A federal court has ruled that a baby born in Australia to an asylum seeker is not entitled to a refugee visa.
Ferouz Myuddin, who is 11 months old, was born in Brisbane when his mother was transferred to hospital from a refugee detention centre on Nauru.
A judge backed the government's earlier ruling that the baby was an ""unauthorised maritime arrival"" so could not claim refugee status.
Lawyers said he and 100 similar babies could now be sent to Nauru.
The hearing comes as the federal government considers amending the Migration Act to retrospectively declare all babies born to asylum seekers who arrive by boat as unauthorised maritime arrivals, irrespective of whether they were born on Australian soil.
If the amendments are passed, babies born to asylum seeker parents in Australia will have no right to apply for a permanent protection visa and should be transferred offshore.
Ferouz's family are Muslim Rohingyas who said they fled to Myanmar (also known as Burma) to escape persecution.
They landed on Australian territory in September last year and were taken to the off-shore processing centre in Nauru. Ferouz was born prematurely after his mother was taken to hospital in Brisbane because of concerns over her pregnancy.
Immigration Minister Scott Morrison had previously denied Ferouz a protection visa - which allows refugees to live permanently in Australia - on the basis that he had arrived on Australian territory by sea illegally.
Australia asylum: Why is it controversial?
His parents then appealed to the Federal Court but after examining how the family had entered Australia, Judge Michael Jarrett backed the government view.
He said the rule was intended to discourage people smugglers.
Lawyer Murray Watt said he was advising the Myuddin family, currently staying in a detention centre in Darwin, to appeal.
""This is a ludicrous decision given he was born here in Brisbane's Mater Hospital and he even has a Queensland birth certificate,"" ABC News quoted him as saying.
He said his firm - which is representing the families of 100 babies born in Australia to asylum seekers who arrived by boat - would be seeking assurance from the government that the families will not be moved to Nauru until the appeal is heard.
Mr Morrison welcomed the ruling, saying it has ""always been the intention of successive governments that children born to illegal maritime arrivals, are taken to have the same status as their parents,"" ABC News reports.
Ferouz's family are also applying for citizenship for him as a ""stateless"" migrant, saying that as a Rohingya he is denied citizenship in Myanmar.
Children born in Australia to non-citizens or non-permanent residents can automatically get citizenship but only once they turn 10 and have spent most of their life in Australia.
Australia has been clamping down on asylum seekers, particularly those who arrive by boat.
Last month Australia signed a controversial deal with Cambodia to resettle refugees in the South East Asian nation. It also reintroduced temporary visas for refugees, which allow for the refugees to be sent home after a period of time if conditions in their home country are judged to have improved.
Australia's High Court is also hearing a separate challenge over 157 asylum seekers from Sri Lanka who set out from southern India and were intercepted by Australia security in July.
They were held on a customs ship at sea for a month, initially in secret, Their lawyers argued they were illegally detained, but government lawyers said the decision was made under existing laws.
The court on Wednesday said it was reserving its decision, with a ruling not expected for some time."
http://www.bbc.co.uk/news/uk-scotland-29559996,asylum seeker,245,9 October 2014,None,Glasgow Girl helps secure asylum seeker student funding,"One of the Glasgow Girls has helped secure funding from Strathclyde University to allow asylum seekers to study.
Roza Salih, has helped to obtain scholarship funding for three places.
She was one of seven Glasgow schoolgirls who campaigned against dawn raids by immigration officials in Drumchapel in 2005.
Their story has subsequently been made into a musical and film.
Ms Salih, whose family came to Glasgow from Iraqi Kurdistan, is now Vice President Diversity & Advocacy of the University of Strathclyde Students' Association (USSA),
She said: ""I'm absolutely thrilled that the University of Strathclyde has agreed to help three asylum seekers to access higher education.
""This will create life-changing opportunities for those whose talents might otherwise have been wasted.
""It is, however, unfortunate that we have to take such measures, when the real cause of the problem is an immigration policy which effectively obstructs asylum seekers from higher education and this is an issue I will continue to campaign on.""
USSA said it was very difficult for asylum seekers to study in Scotland due to prohibitive fees and the fact many are not allowed to work.
The scholarship funding was secured with the help of the Scottish Refugee Council.
Elodie Mignard, Integration Development Officer at the council, added: ""When people come to Scotland seeking safety and protection from persecution they bring a wealth of skills, talent and experience with them.
""We welcome the University's proactive stance in supporting asylum seekers to develop these skills further."""
http://www.bbc.co.uk/news/uk-england-kent-29365412,asylum seeker,206,25 September 2014,None,Folkestone hotel asylum seeker decision 'made by contractor',"A move to bring more than 100 asylum seekers to a hotel in Folkestone was made by contractors and not the government, an MP has said.
Damian Collins MP, who represents Folkestone and Hythe, said he was told this by the minister in charge of asylum, James Brokenshire.
He said he was reassured the asylum seekers would move within two weeks.
They arrived at the Grand Burstin hotel after complaints that 600 migrants were crammed into a South London hotel.
In his blog, Mr Collins wrote: ""The minister has made clear that the asylum seekers will not have access to local services whilst they are staying in Folkestone.
""Any that need urgent health care will be moved to an asylum seeker centre to receive it, rather than being treated here.
""Their subsistence will be covered by the Home Office, and our local councils will not be asked to provide any support to them.""
He added: ""The decision to bring the asylum seekers to Folkestone was not made by government ministers, but by contractors who work for the Home Office who made the booking directly with the owners of the Burstin hotel.""
Of the 130 migrants who came to the hotel, 30 have already left, he said."
http://www.bbc.co.uk/news/uk-england-leeds-25136829,asylum seeker,482,28 November 2013,None,Bradford transsexual asylum seeker fears abuse,"A transsexual who fled to the UK from India after being exposed is facing deportation - a move he says will leave him open him to discrimination.
Sameer Neelam, who was born female but lived in secret as a male, said he suffered violence and harassment after being ""outed"" by the Indian media.
He sought asylum in Bradford, but now faces being returned to India where he fears he will have to live as a woman.
The Home Office said it could not comment on active legal proceedings.
Speaking to BBC Look North Mr Neelam said: ""Here I'm considered as what I am. In India I can't dress like this. Nobody counts me as a man.
""If I open myself as a man in India I will be looked down on, tortured, discriminated, eliminated.""
Mr Neelam was a prominent local official in Hyderabad, in India, but in private he lived as a man with another woman. He has not undergone surgical procedures.
He said after his double life was uncovered he wanted to kill himself, but since moving to the UK he had been able to live openly as a man.
""I can't even get a job if I started living as a man there,"" he said.
""I'm enjoying my life as a man and if somebody calls me 'Mr' or says 'he' I feel energetic.""
Stephen Whittle, professor of equalities law at Manchester Metropolitan University who went through transition from female to male in 1975, said Mr Neelam's story was uncommon.
He said: ""It's quite an unusual situation in the sense that we do not often get people making it all the way to the UK to apply for asylum
""For many transgender people in their home countries life is just very hard.
""In fact inevitably they do not ever manage to transition and have their gender reassigned. It's as it was here 40 to 50 years ago.
""I can see in Sameer's story very much a reflection of the story of what it was like in England [when I transitioned in 1975] but of course we've moved on so much more and the rest of the world is still lagging behind and has to be dragged along.""
According to government guidelines on asylum applications from transsexuals an applicant ""may claim asylum when he or she fears persecution on account of his or her actual or perceived gender identity which does not, or is deemed not to, conform to prevailing political, social or cultural norms in his or her country of origin.""
A spokesperson for the Home Office said: ""The UK has a proud history of granting asylum to those who need it and applications are carefully considered before a decision is made.
""It would be inappropriate to comment further while legal proceedings are ongoing.""
Mr Neelam is expected to find out whether he will be deported in the coming days."
