href,keyword,word_count,info,author,headline,article_text
http://www.bbc.co.uk/news/world-australia-42104815,asylum seeker,691,24 November 2017,None,Manus Island: Australia confirms removal of asylum seekers,"Asylum seekers who refused to leave a former Australian-run detention centre in Papua New Guinea (PNG) have been moved to new housing after a three-week stand-off, Canberra has confirmed.
The group had resisted leaving the Manus Island camp after it shut on 31 October, fearing attacks by locals.
Buses carrying about 300 asylum seekers left the centre on Friday after police entered the facility for a second day.
Some detainees claimed they were struck with poles by PNG police.
Australia's Immigration Minister Peter Dutton said that claims of violence were ""inaccurate and exaggerated"". Australian police said they were not involved in the operation.
Under a controversial policy, Australia has detained asylum seekers arriving by boat in centres on Manus Island and Nauru, a small Pacific nation.
The government has said the detainees will never settle in Australia, arguing such a move would encourage human trafficking and prompt deaths at sea.
The Manus Island centre, which held only men, was shut down by Australia after a PNG court ruled it was unconstitutional. A majority of the men still there are refugees, the UN says.
About 600 asylum seekers and refugees initially refused to leave the camp, arguing they were unsafe in the local community - where their presence is a cause of tension.
Human Rights Watch has said the men could face ""unchecked violence"" after being attacked in the past with rocks and knives.
About 300 men left the centre before Friday, after enduring squalid conditions and pressure from authorities. Electricity, food and water was cut at the centre when it closed.
Video on social media showed PNG authorities swinging poles towards asylum seekers on Friday, in what some of the men described as beatings.
""They [the asylum seekers] don't like to move but then they beat us,"" one refugee told the BBC on Friday.
Mr Dutton rejected such claims, saying that reports violence and injuries were ""inaccurate and exaggerated"".
Earlier, PNG police commissioner Gari Baki said that the police operation was being conducted ""peacefully and without the use of force""
They were moved by buses to three transit centres elsewhere on Manus Island. The sites are secure and provide food and medical services, according to Australia.
However, that claim has been repeatedly contradicted by the UN's refugee agency. On Tuesday, a representative said the housing remained ""under construction"", was inadequately secured, and lacked sufficient medical and welfare care.
Mr Dutton said on Friday that some equipment, including generators, had been ""sabotaged"" at the transit centres.
Hywel Griffith, BBC News Sydney correspondent
The stand-off is over, but there's still no real resolution to the situation on Manus Island.
Some of the refugees moved today are still hoping an agreement with the US will eventually see them resettled abroad.
But it's now a year since that deal was struck and progress has been slow, with only a few dozen people accepted so far.
Even if Australia is right about the transit centre facilities, refugees and asylum seekers do not know how long they will stay there - or what their final destination will become.
Refugees had been given the option of permanent resettlement in PNG, applying to live in Cambodia, or requesting a transfer to Nauru. Advocates say few have taken up these options.
The US has agreed to take up to 1,250 refugees from Manus Island and Nauru. However, it may ultimately accept fewer than that.
The agreement, which is being administered under the UNHCR, is prioritising women, children and families and other refugees found to be the most vulnerable.
New Zealand has offered to take 150 refugees from the PNG centre, but Canberra has rebuffed this proposal - arguing it would effectively be a ""back door"" to Australia.
Last month, Australia and PNG each said the other was responsible for the asylum seekers in the meantime.
Yes. Six asylum seekers have died on Manus Island since the facility was re-opened in 2012, including Iranian man Reza Barati who was murdered during a riot.
Earlier this year, the government offered compensation totalling A$70m (£41m; $53m) to asylum seekers and refugees detained on Manus Island who alleged they had suffered harm while there."
http://www.bbc.co.uk/news/world-europe-43240391,asylum seeker,242,1 March 2018,None,Hamburg supermarket attack: Ahmad Alhaw sentenced to life,"A failed asylum seeker has been sentenced to life imprisonment for a knife attack at a Hamburg supermarket last July.
The Palestinian attacker, Ahmad Alhaw, killed a 50-year-old man and seriously wounded six other people.
Alhaw shouted Islamist slogans as he lashed out. He was pursued and held down in the street by men from the German-Turkish community.
Alhaw pledged allegiance to the Islamic State group.
But as there was no evidence that IS had helped him plot the attack, he was not charged with terrorism.
The judge highlighted the particular severity of the attack, making it unlikely that Alhaw will qualify for early release after the standard 15 years.
Since 2015, more than a million migrants and refugees, many of whom had fled war and abuses in Afghanistan, Iraq and Syria, have entered Germany as a result of Germany's liberal migration policy.
The Hamburg attack was the second significant Islamist attack in less than a year.
In December 2016, a Tunisian failed asylum seeker killed 12 people by driving a truck into a Christmas market in Berlin.
The migration situation has caused significant debate in Germany, with both main political groupings perceived as being hurt by their migration policies in the September 2017 general election.
Some have suggested migrants should be paid to leave the country.
Hamburg's Interior Minister Andy Grote said after the attack that the attacker could not be deported as he lacked identification documents and was psychologically unstable."
https://www.bbc.co.uk/news/world-europe-45540860,asylum seeker,220,16 September 2018,None,Germany migrants: Police investigate attacks on migrants,"German police are investigating two separate attacks on migrants which have left several injured in the state of Saxony-Anhalt this weekend.
Two Afghan teenagers were assaulted by two men on Saturday afternoon in Hasselfelde, reports said.
On Friday night, five drunk Germans attacked three Somalis on their way home in Halberstadt, police confirmed.
The racially motivated attacks come as national tensions are high over the issue of migrants and crime.
More than one million migrants have arrived in Germany as part of Chancellor Angela Merkel's open-door policy in the wake of Europe's migrant crisis in 2015.
In Saturday's incident, four Afghans teenagers were at the edge of a sports field when they were verbally abused by two unidentified men, believed to be between 25 and 30 years old.
The altercation turned violent and left two 17-year-olds slightly injured. A woman who tried to intervene was pushed against a car by the attackers, but was otherwise unharmed, police said.
In Friday's incident, which took place 30km (19 miles) away, all three migrants were physically injured after being verbally assaulted.
A 22-year-old man from the group of five suspected attackers, aged between 22 and 40, also sustained minor injuries, police confirmed.
Police say they are investigating for charges of incitement and assault in both cases, but no arrests have been made yet."
http://www.bbc.co.uk/news/world-europe-15533921,asylum seeker,745,1 November 2011,By Anna Holligan,Netherlands divided over Angolan teen asylum seeker,"The case of an 18-year-old Angolan asylum seeker has proved tricky for the Dutch parliament, as politicians debate whether Mauro Manuel should be given the right to remain in the Netherlands.
The teenager has become something of a celebrity here, appearing on chat shows and on the front pages of almost all the daily newspapers.
His case has captured the public imagination and is being used to highlight what some believe is a huge flaw in the Dutch asylum system.
At the moment there are around 75 children fighting similar battles to be allowed to stay in the country.
Now that Mauro has turned 18, under Dutch immigration law he must be deported. But his supporters argue it is not that simple.
On Tuesday Dutch MPs rejected two motions that would have given him a Dutch residence permit.
Next week they are expected to vote on a compromise motion which would allow him to stay until he hears if a temporary, four-year student visa has been granted.
Mauro Manuel was stashed on a plane by his mother, who feared her young son would struggle to survive in their war-torn homeland of Angola.
When Mauro arrived in the Netherlands he was picked up by police and eventually fostered by a family in the southern Dutch province of Limburg.
Eight years on Mauro is taking a vocational course at college, he is a decent footballer and his foster parents have recently had a son who Mauro counts as his little brother.
He even speaks fluent Dutch with the unmistakable Limburg drawl.
The president of the Green Party, Henk Nijhof, was so angered by the thought of his country expelling someone who he believes is so integrated in the community he started a campaign to support the family.
""Enough is enough and we have to stop this,"" he said.
""Rules are rules, but you cannot switch off your heart and your brain. You must remember what's good and what's right and this is just not right.""
Last week, Dutch Immigration and Asylum Minister Gerd Leers ruled that Mauro had no right to stay in the Netherlands.
Despite significant political opposition Mr Leers acknowledged that there were many others in Mauro's situation and therefore he could not make an exception.
The case is further complicated by the existence of the increasingly influential anti-immigration Freedom Party (PVV) leader Geert Wilders.
Mr Wilders has led calls for Mauro to be deported and has threatened to stop lending support to the leading Liberal Party if they allow him to stay.
In the Netherlands the coalition government relies on support from the populist PVV to get many of their policies through parliament.
So the withdrawal of that support could have damaging repercussions and some have suggested it could even force elections.
It depends now on the Christian Democratic party - so far two of their members have agreed to back Mauro's right to remain.
If two more do the same it could potentially be enough to force a change in the current law.
However, if another fundamental Christian group supports the government it will mean a small majority in favour of forcing Mauro to be repatriated.
The United Nations children's agency, Unicef, has also intervened, stating that if the teenager were to be uprooted now, at a time when he is fully established and integrated in Dutch society, it would be a contravention of the UN Convention on Children's Rights and ""seriously impair"" his development.
A representative for the Dutch children's ombudsman Marc Dullaert said it was a ""shocking"" case and that if Mauro Manuel were deported he would fight the decision at the European Court in Strasbourg.
On Tuesday Mauro was joined by about 700 supporters and celebrities at the Dutch parliament to submit a petition signed by more than 55,000 people who believe he should be given the right to remain.
A guitarist who performed at the protest said: ""We're here for the same reason as everyone else - we don't want Mauro to go.
""It's a really horrible situation. He's been to school, he speaks Dutch, he is Dutch.""
Mauro himself has made a final plea to the politicians who hold his fate in their hands.
""I promise I will always try to be an asset to the Netherlands,"" he said.
""Please let me stay here forever. My future is in the Netherlands. I would like to be an example to others and work for Dutch society all my life."""
http://www.bbc.co.uk/news/uk-14989700,asylum seeker,409,20 September 2011,None,MP condemned for Gurkha 'asylum seeker' remarks,"Gurkha campaigners have condemned a Conservative MP who said the Nepalese veterans should be dispersed around the UK like asylum seekers.
Gerald Howarth said towns in his Aldershot constituency were suffering ""very considerable burdens"" after an influx of about 10,000 Gurkhas.
But Peter Carroll, of the Gurkha Justice Campaign, described the idea as ""shocking and unacceptable"".
Gurkhas won the right to live in the UK in 2009 after a high profile campaign.
Mr Carroll said he had written to the prime minister and deputy prime minister to ask them to intervene and ""rein in"" Mr Howarth.
The Aldershot MP, a junior defence minister, told BBC Radio 5 live on Saturday that this Hampshire constituency was facing a ""very serious situation"".
""It's imposing very considerable burdens on local services, particularly on the health services,"" said Mr Howarth.
""Essentially it's very unfair on both the local population and on the Nepalese, many of whom are wholly unfamiliar with our culture, don't speak English, don't appreciate the climate and I think have been lured here under false pretences.""
Recommending that Gurkhas were rehoused across the country, he added: ""It's a perfectly sensible policy. Dispersal is what we do with asylum seekers.""
He also criticised Joanna Lumley - who fronted the campaign to secure the Gurkhas' rights - and said the actress had not realised the consequences of her actions.
""She has taken no interest in the problems that we face here, Mr Howarth told BBC Radio 5 live.
""The fact is that Joanna Lumley ran a very high-profile, wholly emotional campaign to overturn a long-standing 50-year-old agreement which had stood the test of time.""
Peter Carroll said the comments had caused ""huge anxiety and hurt"" among the Gurkha community.
""The Gurkhas have suffered discrimination for decades,"" he said.
""I feel that the hundreds of thousands of people that supported the campaign will feel a sense of great disappointment and outrage that this situation has arisen, and will be looking to the prime minister and deputy prime minister to rein in Mr Howarth.""
More than 200,000 Gurkhas fought for the British army in the two world wars, and in the past 50 years they have served in places such as the Falklands, Kosovo, Iraq and Afghanistan.
The successful campaign to secure their residency rights means that all retired Gurkhas with at least four years' service can now live in the UK.
Based at Shorncliffe near Folkestone, their current force numbers about 3,500 men."
http://www.bbc.co.uk/news/uk-england-hampshire-14579616,asylum seeker,426,19 August 2011,None,'Gay' Ugandan asylum seeker's deportation deferred,"A Ugandan man living in Portsmouth who says he will be tortured because of his sexuality if he is sent home has avoided deportation.
The UK Border Agency (UKBA) deferred Robert Segwanyi's deportation minutes before he was due to board a flight to the east African country.
Lib Dem MP Mike Hancock said the 32-year-old was burnt with molten plastic in Uganda, where gay acts are illegal.
The Home Office found Mr Segwanyi not to have a genuine claim.
The UKBA is still considering representations put in by Mr Segwanyi's lawyers and so has deferred the removal.
A spokesperson said: ""Mr Segwanyi's removal has been temporarily suspended to enable us to consider representations received on his behalf. If, upon consideration of these representations, the decision to deport Mr Segwanyi is maintained we will continue to pursue his removal as a matter of priority.""
Ugandan bishop Christopher Senyonjo and Portsmouth South MP Mr Hancock have campaigned to prevent Mr Segwanyi's deportation.
Mr Hancock said: ""I welcome the decision tonight not to deport Mr Segwanyi and all I ask is that Mr Segwanyi's case is properly considered, which I believe it hasn't been up until now.""
Mr Hancock said he had ""grave concerns"" about the way the case had been handled and said he had received letters from UKBA containing ""errors on the law"".
He continued: ""I hope that the UKBA will now consider his case properly.
""However it is bad that Mr Segwanyi was put through the agony of thinking he would be deported right up until the 11th hour.""
A spokesman for Mr Hancock said Mr Segwanyi had come to the UK in May 2010, applying for asylum in July 2010 on the grounds he was gay.
However immigration and appeal judges did not accept his claimed sexuality, the spokesman said.
Anglican bishop Mr Senyonjo, who is currently in the UK, said people who were gay or perceived to be gay ""undoubtedly face questioning at the [Ugandan] airport and will likely face harassment and possibly violence from the police, as we have witnessed before"".
A spokesman for the Ugandan High Commission has yet to comment.
In Uganda many people condemn homosexuality both as un-African and un-Christian.
In May, Uganda's parliament adjourned without debating an anti-homosexuality bill, which includes the death penalty for some gay acts.
However the bill could still be brought up when the new parliament meets later this year.
In January, David Kato, a campaigner who led condemnation of the bill, was murdered in Uganda. Police denied the killing was because of his sexuality."
http://www.bbc.co.uk/news/uk-northern-ireland-26189348,asylum seeker,898,14 February 2014,By Chris Page,Nowhere to go: Life as a destitute asylum seeker in Belfast,"Stanley Phiri cannot take the most basic of needs for granted.
The 21-year-old Zimbabwean has no permission to work and is dependent on charities to feed and clothe him.
I met him at Common Grounds coffee shop in south Belfast, where he volunteers.
""I'm trying to keep myself busy. I try to get involved in different organisations. It helps me to reduce the stress in my life,"" he said.
I spent an afternoon with Stanley, to get an idea of what his hand-to-mouth life in Belfast is like.
He gets most of his clothes from two charity shops.
He looks for the items he would like, about four every month, then he goes back to the hostel where he lives.
The charity that runs that hostel, the Simon Community, writes a letter for him so he can pick up the clothes.
He explained how he buys food with the £20 a week he gets from another charity, the Society of St Vincent de Paul.
Asylum seekers are often at the extreme end of the poverty spectrum.
They come from several dozen countries, often the ones that feature in news headlines about conflict.
The Home Office does not collect figures specifically for Northern Ireland but the statistics from charities and some statutory organisations give a general picture.
Most estimates put the number of asylum seekers in Northern Ireland at the moment at between 400 and 500.
Somalis have been the biggest group in recent years, but people have come from several dozen other countries, including Sudan, the Democratic Republic of Congo, and, most recently, Syria.
The Home Office assesses whether an application for asylum is valid, based on the 1951 UN Convention on Refugees.
It obligates countries to take in people who are have a ""well-founded fear of being persecuted for reasons of race, religion, nationality, membership of a particular social group or political opinion""
Those whose asylum applications are successful are initially granted permission to stay for five years.
Then their status is reviewed to see if they will be allowed to stay permanently.
Successful applicants cease to be asylum-seekers and are officially termed ""refugees"".
The latest UK-wide figures, for the 12 months to March 2013, show that around 37% of asylum seekers were granted permission to stay.
But some whose applications are rejected do not go home immediately.
This can be for a number of reasons.
They might appeal against the decision, as Stanley Phiri is doing.
Their home countries may not have them back, or it may not be safe to return.
People in this position are officially classed as ""destitute"" and entitled to what is called Section 4 support.
Voluntary organisations are aware of at least 20 families and 14 individuals in Northern Ireland who are in this situation at the moment.
They get £35 per week to live on, which comes on a special payment card that can only be used in about nine retailers.
Invariably, asylum seekers in this position rely on charity hand-outs.
Neil McKittrick, from the Red Cross, says organisations like his fill a critical gap.
""The fear for us is that if people weren't being seen by charities like the Red Cross, where else would they turn?"" he says.
""For us the fear would be that the ultimate would happen and someone would die of starvation or could end up sleeping rough in Botanic Park in the cold weather.
Bryson Intercultural is the charity that looks after asylum seekers when they initially arrive in Northern Ireland.
Its director Jo Marley said the situation by which people do not have permission to stay and yet cannot go home is a ""conundrum"".
""I think what we struggle to get our heads around is that they live here on the kindness of others with total insecurity about how they're going to manage - yet it's still better than going back"" she said.
She is keen to emphasise that asylum seekers do not come to Northern Ireland to take advantage of state benefits.
Indeed, many of them not aware of even the concept of a welfare state before they come to the UK, she said.
I have not met a group of people who have been so thankful for the opportunity to tell their stories.
One point they all wanted to make was that their support network in Northern Ireland. friends, churches, volunteers, has kept them going.
Recent headlines about hate crimes might give the impression that Northern Ireland is an unwelcoming place.
But, going deeper, we have discovered a society that is warm, generous and kind to strangers.
Norma Nyamambi is from Zimbabwe and a member of the Friendship Club, in which people from many different nations meet in south Belfast on a Thursday evening.
She is destitute and said the club, and the friends that she has made there, have been a lifeline to her.
""When I first came to Northern Ireland, I had nowhere to go,"" she says, ""but Friendship Club became my home.""
""It's really hard to be destitute in this country but if you come as an asylum seeker and introduce yourself to the community, they will help you.""
""These people make me see I have a new life.""
Nowhere To Go will be broadcast on BBC Radio Ulster and BBC Radio Foyle on Sunday 16 February 2013 at 13:30 GMT. It will then be available on BBC IPlayer."
