href,keyword,word_count,info,author,headline,article_text
https://www.thelocal.ch/20130807/migration-boss-defends-public-pool-ban-on-asylum-seekers,asylum seeker,258,"
				7 August 2013
				16:14 CEST+02:00			 
					16:14 CEST+02:00				",Morven McLean,Migration boss defends Aargau public pool ban,"Switzerland's top migration official has defended rules preventing residents of the new federal asylum centre in Bremgarten from moving freely around the town.
The head of the Federal Office for Migration, Mario Gattiker, told the Tages-Anzeiger newspaper it was “totally normal” for the town authorities to limit asylum seekers’ freedom of movement. Bremgarten in the canton of Aargau is hosting the first temporary federal asylum centre to open since June when voters approved changes to the law designed to speed up the asylum process. The town authorities have stipulated that the new residents must stay away from public sport venues and schools. Gattiker said the rights of asylum seekers would continue to be fully guaranteed and no sanctions were envisaged for anyone breaking the rules. “Asylum seekers won’t face a general ban on entering school grounds or sport venues,” Gattiker explained. “But they have to discuss the visit with the asylum centre management so that they can inform the local authorities.” “We want to prevent a situation where 50 asylum seekers all want to use a football pitch or go to the open-air pool at once,” Gattiker told the paper. “This could lead to friction and resentment.”
He said the restrictions would be in place Monday to Friday between 7am and 6pm. The new centre is designed to house up to 150 asylum seekers over a three-year period. The first 23 people moved in on Monday. The first group was made up of men, women and two children from Eritrea, Tibet, Sri Lanka and Sudan, the newspaper reported."
https://www.thelocal.ch/20120604/3441,asylum seeker,217,"
				4 June 2012
				10:46 CEST+02:00			 
					10:46 CEST+02:00				",Lyssandra Sears,'Lock up criminal asylum seekers': SVP,"Swiss People’s Party politician Toni Brunner has caused uproar with his proposal for the establishment of a special centre for asylum seekers who have broken the law.
Brunner is at the forefront of a heated campaign to place unruly asylum seekers in a secure centre, in a move that would mirror the Greek and Dutch systems, online news site 20 Minuten reported.
“It is important that those who have forfeited the chance to seek asylum in Switzerland, can no longer walk about at their own leisure,” Brunner told newspaper Zentralschweiz am Sonntag.
The Asylum Act is due to be debated in parliament in mid-June. Many politicians are for amendments including those that limit the freedom of criminal asylum seekers, but not necessarily for internment, newspaper Tribune de Genève reported.
“This is ridiculous and excessive,” Free Democratic Party Councillor Kurt Fluri told 20 Minuten.
Martine Brunschwig Graf, president of the Commission Against Racism, does not believe that the camps would be compliant with human rights law, and queried what would happen to those who could not be returned to their countries of origin.
“The idea has not been entirely thought through,” she said. “People that can not be returned would have to remain indefinitely in the camp.""
Amnesty International also voiced concern, calling the idea inhumane and dramatic."
https://www.thelocal.ch/20120228/2700,asylum seeker,240,"
				28 February 2012
				12:41 CET+01:00			 
					12:41 CET+01:00				",Malcolm Curtis,Swiss army opens doors to asylum seekers,"The Swiss military is making more than 5,000 beds available on a temporary basis to handle an overflow of asylum seekers in Switzerland.
Defence Minister Ueli Maurer said on Monday that the accommodation would be made available as quickly as possible.
Discussions have been under way since April 2011 between the federal immigration department and the department of defence, civil protection and sport over ways to expand facilities for asylum seekers.
Switzerland has faced an increase in the number of people seeking asylum in the mountain country, particularly since the Arab spring revolutions.
The military beds are housed in more than 20 surplus barracks around the country, including those in mountain regions.
However, these rudimentary facilities must be modernized to conform with the latest fire protection and other building standards, the defence department said in a news release.
The department acknowledged that the renovations would in some cases be limited.
Many Swiss military barracks in mountain areas do not conform with civil standards.
For example, one alpine facility in the Jaun Pass in the canton of Bern, offers beds for 150 people but has only a single exit door.
The building will be limited to use by 50 people, the government said.
Cantonal laws also restrict the use of such facilities to six months.
The Swiss defence department has at its disposal more than 100 sites with quarters above and below ground, offering a total capacity of around 35,000 beds."
https://www.thelocal.ch/20140327/topless-protest-group-founder-denied-swiss-asylum,asylum seeker,236,"
				27 March 2014
				11:50 CET+01:00			 
					11:50 CET+01:00				",Malcolm Curtis,Topless protest group founder denied asylum,"Swiss authorities have rejected a request for asylum by Anna Hutsol, the founder of Ukrainian women's protest group Femen, whose members are famous for baring their breasts to make political statements.
Hutsol, 31, sought refuge in Switzerland last autumn after being beaten several times in Ukraine. But her application for asylum was turned down by the Swiss Federal Office for Migration on technical grounds, 20 Minuten newspaper reported on Thursday. Because Hutsol had previously stayed in France before coming to Switzerland, the office ruled that it is up to French authorities to consider her application as an asylum seeker. She appealed the decision but without success, the Südostschweiz newspaper reported. Hutsol had hoped she would be able to stay because she has a sister living in Winterthur in the canton of Zurich. The dissident is currently staying at the Landegg asylum centre for refugees at Rorschacherberg, Saint Gallen.
In an interview with 20 Minuten earlier this month, Hutsol said she wanted to return to Ukraine as soon as possible but this is considered too dangerous at the moment. Swiss authorities say she will be transported to France at the earliest opportunity. Hutsol continues to be involved in planning Femen protest actions. The group has expanded from Kiev to establish a base in Paris along with branches in at least seven other countries. “It is quite clear that you will see us again,” Hutsol told 20 Minuten."
https://www.thelocal.ch/20160301/swiss-swimming-pool,asylum seeker,348,"
				1 March 2016
				17:03 CET+01:00			 
					17:03 CET+01:00				", The Local,Swimming pool turns away Syrian asylum seekers,"A swimming pool in Lucerne is facing complaints of discrimination after placing a limit on the number of asylum seekers allowed in the pool at any one time.
Yannick Hagmann, a 35-year-old who volunteers with asylum seekers, told Sonntags Blick that he took some Syrians to the pool in Meggen at the weekend, but the group were refused entry by staff.
Despite the pool being open, Hagmann says a lifeguard prevented them from entering. ""He held a note from the parish under our noses which said that no more than three asylum seekers may use the pool at the same time,"" Hagmann told the newspaper.
The regulation - which also only allows asylum seekers access on two days each week - had in fact been in effect for three weeks before Hagmann's visit. The municipality stated the reason as ""the size of the pool and the very limited space available"".
Hagmann admits that at eight by 20 metres, the pool is relatively small. However, he likened the regulation to ""the apartheid regime"", saying: ""It cannot be that a particular group of the population is excluded.""
A law professor at Basel University, Markus Schefer, told 20 Minuten that the limit ""contravenes the ban on discrimination in the Swiss Constitution and so could be illegal"". He added that although limits can be placed on occupancy for safety reasons, ""these should apply to everyone and not just asylum seekers"".
Although the Swiss Constitution does not allow discrimination, the pool has been labelled a ""sensitive zone"" because it is within school grounds, meaning that special conditions may be applied.
It's not the first time that swimming pools in Europe have caused a stir for preventing access to migrants. In January, a German town banned male asylum seekers from public swimming pools after complaints from women that they were being harassed by migrants.
And one month before that, France's leading legal rights body was called in to investigate after it emerged that a swimming pool in Calais, where 4,500 refugees are camped out, had effectively banned them from entering by introducing ID checks."
https://www.thelocal.ch/20130606/voters-to-decide-on-asylum-laws-and-elected-government,asylum seeker,692,"
				6 June 2013
				09:16 CEST+02:00			 
					09:16 CEST+02:00				",Marie-Noëlle Blessig/AFP,Voters expected to back tighter asylum laws ,"Swiss citizens will vote Sunday on whether to approve an emergency tightening of the national asylum law in a bid to stem the influx of refugees to the country.
A controversial revision, which was ordered as an emergency measure by the government and went into effect last October, marked the seventh change of the asylum law in Switzerland — Europe's fourth most popular destination for refugees. The vote on June 9th — one of four Sundays this year set aside for popular votes on national, cantonal and communal issues — comes after a range of opponents of the revision collected the 100,000 signatures required to call a referendum. Also on Sunday, the Swiss will be called to vote on whether the people should elect the country's seven government members directly instead of having parliament pick them, as it has been doing for the past 165 years. According to recent polls though, that initiative appears set to fail. Opponents of the new asylum law revisions, including human rights advocates, religious groups and unions who have banned together a collective called ""Coordination against Exclusion and Xenophobia"", also appear destined to fall short in their bid to overturn the changes. Surveys show the Swiss are increasingly leaning towards giving their stamp of approval to the changes, as some balk at soaring numbers of refugees flocking to the country, which offers generous hand-outs throughout the asylum process. A poll by public broadcaster RTS in late May showed that 57 percent of those questioned were in favour of the revisions, up nine percentage points from a month earlier. There are currently some 48,000 people in the process of seeking asylum to Switzerland, including a full 28,631 who arrived in 2012 — the highest number in a decade. Only 11.7 percent of asylum applications were meanwhile granted last year, when most asylum seekers to the country came from Eritrea, Nigeria, Tunisia, Serbia and Afghanistan. Counting one asylum seeker for every 332 inhabitants, Switzerland ranks as the fourth most popular host country in Europe, trailing only Malta, Sweden and Luxembourg, and ranking far above the European average of one asylum seeker for every 625 inhabitants. Among the most controversial changes to the Swiss asylum law last year, was the decision to remove persecution due to military desertion as legal grounds for seeking asylum in Switzerland — a motive mainly used by Eritreans. The revision also removed the possibility, which had been unique in Europe, to apply for asylum in Switzerland from Swiss embassies around the world. That revision was harshly criticized by the Swiss Bishops Conference, which stressed recently it would force people ""to pay intermediaries and to embark upon high-risk trips"" to make their way to Switzerland. The bishops also said the revisions would mean people in real need of assistance would be rejected. ""Behind every statistic there hides the destiny of men and women,"" it said in a recent statement, insisting that ""no one leaves their country of their own free will without knowing what the future in another country or continent has in store"". Justice Minister Simonetta Sommaruga, who is in charge of the brief, however insists the changes were for the best of the asylum seekers themselves. She especially highlighted the speeding-up of the application process aimed to bring handling times down from several years to several months by removing the possibility of multiple appeals. ""Leaving people and their families for so long wallowing in uncertainty is unacceptable,"" she said recently, insisting that ""processes that drag on and the asylum-seeker tag blocks rapid integration"". The rejigged asylum law also clears the way for the creation of special centres for asylum seekers considered to be trouble-makers and limits the right to family reunification to spouses and children. As for the second issue to be voted on Sunday, it was proposed by Switzerland's largest party, the populist Swiss People's Party (SVP), which insists that allowing the electorate to choose its leaders directly would strengthen the government's legitimacy. All the other political parties have however come out against the initiative, maintaining it would weaken parliament, and a recent poll showed only 25-percent support for the shift among voters."
https://www.thelocal.ch/20120423/3170,asylum seeker,277,"
				23 April 2012
				18:18 CEST+02:00			 
					18:18 CEST+02:00				",Lyssandra Sears,Monasteries should take in asylum seekers: priest,"Monasteries should offer accommodation to asylum seekers, Catholic priest Andreas Rellstab believes, but his proposal has met with resistence from other clerics.
“For us as a Christian community, it's a shame that no one wants to take in the asylum seekers,” Rellstab told the Catholic television programme “Das Wort zum Sonntag” ('Sunday Word').
The 46-year-old Swiss priest argued that there were plenty of places and facilities available, with the numbers of people living in monasteries dropping all the time, newspaper Blick reported.
But the proposal has received very little support.
“Of course we have the space. But they would not fit into our community,” Franciscan monk Rene Fox told the newspaper.
Sister Rut-Maria Buschor of the Benedictine Abbey of St. Andreas in Sarnen, near Luzern, is also against the idea.
“We do have a really big convent. But we do not want to take anyone because it does not fit into our quiet life. Nobody says that people should take asylum seekers into their homes,” she said.
One Benedictine convent in canton Obwalden has agreed to the idea in principal. The problem, according to Prioress Daniela Bieri, is that the location is very remote and she does not know what the asylum seekers would do all day.
She also doubts, based on previous experience, that the local villagers would welcome the immigrant population.
Walter Müller of the Bishops’ Conference said the fact that these communities live in silence would make it very difficult for them to accommodate asylum seekers, despite the fact that many have available space.
He also pointed out that finding shelter for people was not the job of the church but of the state."
https://www.thelocal.ch/20120614/3530,asylum seeker,308,"
				14 June 2012
				10:57 CEST+02:00			 
					10:57 CEST+02:00				",Lyssandra Sears,Tough asylum laws 'contrary to tradition',"Switzerland's left-wing parties and refugee support groups have reacted angrily to a raft of measures approved by the lower house on Wednesday that will place much tougher restrictions on asylum seekers.
The lower house of parliament, the National Council, voted to block asylum seekers' right to welfare benefits, and to provide only the minimal emergency assistance.
Justice Minister Simonetta Sommaruga spoke out against the reduction in financial support, saying that that the changes are “contrary to the humanitarian tradition of which our country likes to boast,"" newspaper Tages Anzieger reported.
She also criticized the fact that the measures would be like torture for people with no home or right to work, who were already traumatized by their ordeals, online news site Le Matin reported.
The more liberal proposals of the Greens and Social Democrats were rejected in favour of proposals to tighten asylum laws.
Beat Meiner, head of the Swiss Refugee Council said the left-wing parties who opposed the move would likely force a referendum if the upper house votes to approve the legislative changes in the autumn.
""I can't imagine the Social Democrats and the Greens will allow this to go through.""
But Social Democratic Councillor, Alexander Tschäppät, conceded that the ""heated atmosphere"" created by the Swiss People's Party and its allies meant the provisions would almost certainly be ushered through by the electorate.
Several Councillors argued that the majority of asylum seekers were not here to exploit Switzerland.
""Refugees are looking to us for protection, not for money"", Christian People’s Party Councillor, Ruth Humbel, told the website.
In a surprise move, the National Council voted by 90 votes to 88 to keep some form of family asylum in place. The compromise position taken was to allow the wife and children of an asylum seeker in, but not the extended family.
See also: Switzerland tightens asylum laws"
https://www.thelocal.ch/20120518/3351,asylum seeker,344,"
				18 May 2012
				10:50 CEST+02:00			 
					10:50 CEST+02:00				",Lyssandra Sears,Grounds for asylum under attack,"The Council of States wants to change the law so that people cannot claim political asylum because they have deserted their country’s army. The aim is to make it harder for Eritreans to seek asylum in Switzerland.
The Council of States, also known as Switzerland’s upper house, wants to stop asylum seekers being able to use desertion as a ground upon which to claim asylum, newspaper Tribune de Genève reported.
Some two thirds of asylum seekers from Eritrea now use their desertion as the basis for the asylum applications. The introduction of desertion as a valid ground for claiming asylum in 2005 led to a dramatic increase in applications.
Number rose from 200 in 2005, to more than 1,000 in 2006. In 2011 more than 3,000 applications were registered and the first quarter of 2012 has already exceeded the figures for the first quarter of last year by some 41 percent.
It is hoped that removing desertion as a ground for asylum will dramatically reduce the number of entrants to Switzerland, but critics say it will make little difference as Eritreans will still be able to claim at least temporary asylum for other reasons due to the continuing war with Ethiopia.
Swiss People’s Party representative, Heinz Brand, is optimistic that the move will yield results.
“The decline in Eritrean applicants will not happen overnight. But it will come because of the change in conditions,” he told the newspaper.
“Social welfare will decrease and family reunification will not be allowed.”
But Michael Glauser from the Office for Migration sees the problem differently.
“Already today we do not give asylum solely on the grounds of desertion,” he said.
Glauser thinks that this group will continue being granted asylum because the applicants risk their lives if they are sent home again.
Part of the drive to reduce numbers of Eritreans entering Switzerland is because of their poor integration into Swiss society. But some point to the experience of many Tamils saying they show that people who were at first poorly integrated can flourish and contribute to society."
https://www.thelocal.ch/20120507/3276,asylum seeker,211,"
				7 May 2012
				11:37 CEST+02:00			 
					11:37 CEST+02:00				",Lyssandra Sears,Second arson attack at Swiss asylum centre,"For the second time in a week, arsonists set fire to a house occupied by asylum seekers on Saturday night.
“The perpetrators set fire to the front doors using firelighters,"" an Iraqi tenant known only as Samiri F told online news site 20 Minuten.
The attacks took place at an asylum centre in the town of Affoltern am Albis, near Zurich.
“I've lived here for seven years, but such a thing has never happened before,” said Daniel L from Ethiopia.
A security guard has been posted at the premises but it is uncertain how long he will stay for.
""We are all very scared. Women and children also live here, "" said Samiri F.
The arson attacks of the past week were the first to target asylum seekers in ten years. According to extremist expert, Samuel Althof, the attacks reflect the “heated, xenophobic sentiment” currently alive in the country.
""Federal Councillor Sommaruga is partly responsible,” Liberal councillor Peter Malama told the website.
“She must take this signal seriously and ensure that asylum applications are processed as quickly as possible.”
National Councillor Andreas Gross also thinks the attacks reflect the fact that people do not feel understood.
Althof believes that such discontentment leads violent and unhappy men to turn to criminal activity."
https://www.thelocal.ch/20160414/switzerland-sees-first-quarter-drop-in-asylum-requests,asylum seeker,399,"
				14 April 2016
				12:16 CEST+02:00			 
					12:16 CEST+02:00				", The Local,Switzerland sees first quarter drop in asylum requests,"The number of asylum seekers arriving in Switzerland fell by 45 percent in the first three months of this year.
According to figures from the Swiss federal migration office (SEM), 8,315 asylum requests were filed in the first quarter of 2016, 45 percent fewer than in the last quarter of 2015.
March saw 1,992 asylum applications, down almost 25 percent on February, said the SEM.
Nevertheless, the number of asylum seekers coming to Switzerland so far in 2016 was still far more than the same period last year, said the SEM.
“The migration context is still very volatile and therefore unpredictable,” it said in a statement.
While making reliable predictions for 2016 was “impossible”, the SEM said it could envisage the number of asylum seekers to Switzerland rising again during the course of the year.
In March the SEM dealt with the applications of 2,702 asylum seekers, of whom 875 were rejected in accordance with the Dublin regulation, 609 were granted asylum and 559 were given provisional admission to Switzerland. A further 363 applications remain on hold.
The same month, 847 migrants left Switzerland or were repatriated, said SEM.
Switzerland asked other states to take charge of 1,532 asylum seekers under Dublin rules, and 489 were sent to the countries in question.
In return Switzerland received 257 requests from other countries and accepted 48 migrants in this way.
Under EU migration rules – to which Switzerland also adheres – the Dublin regulation establishes the member state responsible for the examination of an asylum application based on, among other things, the route by which they arrived in the EU.
According to daily Le Matin, cantonal police authorities are set to agree a set of measures on Thursday to deal with a sudden rise in asylum seekers.
The measures, which aim to coordinate the tasks and emergency response of cantonal and communal authorities, will come in force should Switzerland receive 6,000 requests in a three-week period.
Although Switzerland has seen a sharp rise in asylum seekers over the past couple of years, the figures aren't nearly as high as in other European countries affected by the migrant crisis.
Last year Switzerland received 39,523 asylum requests in 2015, up from 23,765 the previous year, according to figures released in January.
Close to 1.4 million asylum requests were made across Europe as a whole in 2015, almost double the number as in 2014."
