href,keyword,word_count,info,author,headline,article_text
https://www.thelocal.fr/20170818/paris-police-evacuate-porte-chapelle-migrant-camp-again,migrant,267,"
				18 August 2017
				10:30 CEST+02:00			 
					10:30 CEST+02:00				",The Local,Paris police evacuate migrant camp (again),"Paris police on Friday announced the evacuation of a migrant camp in the city's 18th arrondissement.
The announcement comes around a month after the last evacuation of the same camp at the Porte de la Chapelle, and is the 35th such operation in the past two years.
Police began moving migrants out of the makeshift camp at around 6am on Friday morning, closing the surrounding area to traffic.
Migrants who had been staying at the camp were taken by buses to 18 sites around the Île-de-France region.
Anti-riot police were involved in the operation, however pictures from the scene appeared to show that it went smoothly, and the evacuation was completed by 9:30am.
READ ALSO:
France provides toilets and taps for Calais migrants
Paris police evacuate 2,500 migrants from squalid camp
Anti-riot police gather migrants early on Friday morning. Photo: AFP
The last evacuation of the Porte de la Chapelle camp took place in early July, when around 2,500 people were transported to alternative locations. These included school sports halls which were empty over the summer holidays.
Before that, a police operation in May had moved around 1,000 people out of the makeshift tent camp where they had been living in squalid conditions. Earlier in the year, city authorities had installed large boulders under the flyover in an attempt to dissuade groups from settling there.
Paris became a gathering point for migrants after the closure last October of the notorious ""Jungle"" near Calais - a makeshift camp near the Channel coast where thousands lived in the hope of climbing aboard trucks or trains to get into Britain."
https://www.thelocal.fr/20181023/italy-accuses-france-of-trying-to-dump-underage-migrants-over-the-border,migrant,366,"
				23 October 2018
				14:06 CEST+02:00			 
					14:06 CEST+02:00				",The Local,Italy accuses France of trying to dump underage migrants over the border,"French police may have tried to drop foreign minors over the border into Italy without permission, according to the Italian interior ministry.
Amid an ongoing row over unauthorized crossings of the two countries' remote Alpine border, unnamed sources in Rome told the Italian press on Tuesday that an investigation was underway into whether gendarmes sought to drive underage migrants into Italy.
The incident allegedly took place on the night of October 18th, around a week after Italian police said they spotted French officers driving two men across the border near the ski resort of Claviere. Authorities in France admitted to the earlier incident, which they put down to a ""mistake"".
That explanation will be less convincing if Italy can prove that the same thing happened more than once. Interior Minister Matteo Salvini, who styles himself as French President Emmanuel Macron's biggest critic, insists that similar incidents have recurred for several months and has shared what he claimed to be video evidence on his Facebook page.
READ ALSO:
French police admit taking two migrants over the Italian border 'by mistake'
Tensions between Italy and France as ministers meet on immigration
'Political crisis between Italy and the rest of Europe': Macron slams Italian migrant policy
According to sources in his ministry, Italian officers said that in the case of the minors they were able to prevent their French counterparts from leaving the migrants in Italy's territory.
Salvini, head of the anti-immigration League party, has insisted on sending police reinforcements to Claviere since reports of unauthorized deportations first broke. He said that he would order a permanent guard post to be established on the Italian side to watch for any attempted pushbacks in future.
""What's coming out from Claviere just confirms that, when it comes to human rights, no one can preach to Italy,"" Salvini railed.
He has repeatedly cited the alleged deportations as proof that France has no right to criticize the hardline measures against immigration that he has made his priority since taking office in June, and which Paris has denounced as cynical, irresponsible and ""posturing"".
READ ALSO: 'Does Paris think it's normal?': Italy's Salvini rages after French police dump migrants in Italian woods
Photo: Marco Bertorello/AFP"
https://www.thelocal.fr/20180114/britain-should-bear-more-migrant-costs-at-calais-minister,migrant,273,"
				14 January 2018
				17:13 CET+01:00			 
					17:13 CET+01:00				",AFP,Britain should bear more migrant costs at Calais: minister,"French interior minister Gerard Collomb said Sunday that he wanted London to shoulder more of the costs of dealing with migrants hoping to cross to Britain from the port city of Calais.
In an interview with Le Parisien daily published Sunday, Collomb said he would push to modify the Touquet accords signed in 2003, which effectively moved Britain's border with France to the French side of the Channel.
""I hope to add a new element to these agreements, and concrete measures regarding the coverage of certain costs by the British and the management of more people, for receiving refugees and unaccompanied minors,"" he said.
His comments come as President Emmanuel Macron is to visit Calais on Tuesday, ahead of a meeting with British Prime Minister Theresa May in London on Thursday.
Hundreds of migrants are stilled massed near Calais more than a year after the huge so-called Jungle camp was cleared by the authorities in October 2016.
Collomb said about 400 people are now in the area, compared with more than 7,000 a year ago, and defended the government's efforts to find shelter and process asylum requests.
""The ones sleeping outside don't want to present themselves, because they don't want to seek asylum in France,"" he said.
The government said last week that asylum claims hit a record 100,000 in France last year, and Collomb said an additional 85,000 people were refused entry at France's borders.
""It's impossible to adequately take in 185,000 people each year: that's a city the size of Rennes,"" he said, referring to the Breton capital in northwestern France.
READ ALSO: Migrant stowaway crushed by truck's cargo near Calais"
https://www.thelocal.fr/20161110/paris-opens-first-humanitarian-migrant-centre,migrant,481,"
				10 November 2016
				09:14 CET+01:00			 
					09:14 CET+01:00				",The Local,Paris opens its first humanitarian migrant camp,"An official migrant centre in Paris will welcome its first occupants on Thursday, just a week after French police cleared thousands of refugees off the streets of the capital.
After two and half months of building, the official ""humanitarian"" Paris migrant camp and reception centre will open its doors on Thursday.
The new camp is located in a disused hangar, near Porte de la Chapelle, to the north of the city near Gare du Nord.
It will act as an official reception centre for migrants - mainly single men - who have just arrived in Paris. Women and children will be taken straight to specific accommodation.
""The idea is to create a place where every newly arrived migrant can be welcomed and offered dignified, humane shelter,"" said Bruno Morel, head of the Emmaus Solidarite charity running the centre.
However it will not provide long term lodgings, with occupants only able to stay for a maximum of 10 days, after which the migrants will be moved on to specific accommodation designated for asylum seekers.
During their 10 days, they will be given access to help in processing their asylum applications, as well as food and medical care – “the things that are impossible to do when migrants are living on the street,” said Morel.
A giant 900-square-metre inflatable structure (see photo), has been erected as an area of orientation,where migrants can get information and advice, access to translators as well as help on returning home voluntarily.
In the converted hangar, authorities have built eight ""villages"" for 50 people, with each ""room"" having four beds. In all some 120 people will be employed at the site, along with 500 volunteers. It has been built at a cost of €16.4 million.
Authorities hope the camp will put an end to the squalid makeshift settlements that regularly spring up in the city.
The camp however has a capacity of 400, 80 new arrivals a day - well below the kind of numbers who have been sleeping rough in make shift camps in Paris in the last two years.
Only last week police cleared 3,800 migrants from their tents in the north east of the city.
“We are not naive. This centre will not solve everything,” said Paris mayor Anne Hidalgo. “But we finally have a worthy and humane alternative to the street settlements.
Plans to create a ""humanitarian"" refugee camp in Paris were first announced back in May by Hidalgo.
Another Paris camp designated for women and children will also open in Ivry-sur-Seine to the south of the city at the beginning of 2017.
Last month, authorities also demolished the notorious ""Jungle"" shantytown in the northern port of Calais -- the main launchpad for attempts to smuggle across the Channel to Britain.
France's Socialist government is anxious to show it has a handle on migration in the run-up to presidential and parliamentary elections next year."
https://www.thelocal.fr/20161024/after-the-jungle-what-happens-next-for-migrants-in-france,migrant,1115,"
				24 October 2016
				10:27 CEST+02:00			 
					10:27 CEST+02:00				",Ben McPartland,Migrant crisis won't end with Calais 'Jungle' closure,"France began the massive clearance of the Jungle migrant camp in Calais on Monday morning, but with thousands of refugees still desperate to reach the UK, what will happen now?
France hopes the clearance of the squalid Jungle migrant camp in Calais will close a sorry chapter in the country’s migrant crisis, but it is unlikely to be the end of the story.
And what chance of a happy ending?
On the day of the clearance there was an estimated 6,000 to 8,000 migrants in the Jungle camp. At around 8.45am the first bus pulled away carrying around 50 Sudanese refugees to a reception centre in Burgundy.
Over the next three to four days scores of buses will take the thousands of other refugees to some 450 reception centres across France.
Some migrants say they are refusing to budge hence the presence of scores of baton-wielding police. But many also predict a significant number of those who have been bused to Burgundy and beyond will simply make their way back to Calais once the riot police and the journalists have moved on.
""After a week everyone will be back to create a new Jungle. We just don't know where yet,"" one young migrant told BFM TV on Monday.
How many will head back to Calais?
A wall, stretching one kilometre long and four metres high is currently being built along a stretch of the motorway leading to the port that passes by the Jungle camp. Britain would not have agreed to pay for its construction if authorities really believed the clearing of the Jungle would end the crisis in Calais.
Charities and aid associations say many of those who have been moved out of Calais in previous months, have only returned to the northern port town, so there is no reason to believe anything will be different after this week's official clearance.
They simply refuse to give up on their dream of reaching the UK and Calais, where thousands of lorries that cross to the UK via boat or the Channel Tunnel will remain the best place to risk their lives in the hope of crossing.
Much too will depend on what services are on offer to migrants in the small towns around France.
READ ALSO: No point bulldozing jungle unless solutions found
No translators, no friends
“They find themselves in a department of France where there are no real translators,” Anne-Lise Coury, head of operations for Medecins sans Frontieres in Calais, told The Local recently.
“They can end up far from a town and the administrative offices they need,” said Coury.
“They may be also far from places where they can learn French, or from members of their community,” she added. “And they end up just deciding to go back to Calais.”
The reception they receive will also play a role. The build up to Monday's clearance has seen several reception centres attacked by arsonists and one was sprayed with bullets. And locals in some towns have held anti-migrant protests.
But there have also been pro-migrant protests and much support offered to new arrivals.
2 families resettled near here,had nothing,clothes on their backs,3children under 10,huge support from local community.But difficult 4 them https://t.co/OVLjr6LH19
— Erica Laine (@LaineEleslaine) October 24, 2016
While the government insists Calais' migrants crisis is France's problem, the reality is many concerned people in towns across the country, not least the far-right mayor of Beziers, would rather it was just a conundrum for Calais.
(The humanitarian Grande Synthe camp near Dunkirk. AFP)
More camps around the area?
There is also evidence that migrants will just set up other smaller camps around the Calais region or head to another more established shanty town like The Grande Synthe, near Dunkirk.
A Syrian migrant named Sam told AFP that ""dozens"" had left the Jungle early to avoid being sent elsewhere in France.
""I have been in the Jungle for 13 months and during this time I have learnt not to trust the authorities. So last night I left the Jungle and pitched my tent in another place nearby,"" about a dozen kilometres away, he said.
There has been growing evidence that people traffickers have been targeting UK-bound lorries in motorway rest areas well before they reach Calais. The A1 motorway north may soon be dotted with mini-Jungles at strategic points where traffickers believe they can get migrants on board the lorries.
There are also fears that the closure of the Calais camp will just shift the crisis to other ports along the northern French and Belgian coast.
Other Channel ports to come under pressure?
After the closure of the southern part of the Jungle earlier this year, there were reports that the number of attempted illegal ferry crossings at ports such as Ouistreham and Dieppe rose dramatically.
But with the Jungle being completely dismantled the shift could be even greater this time and French authorities and the UK might have to start strengthening security and building four-metre high fences at other Channel ports.
For many migrants however the clearance of the camp could be positive. London says it is willing to take in scores of unaccompanied refugee children. Some have already arrived while others be shipped or put on a train to the UK in the coming days.
And for the many who do want to stay?
Hundreds of migrants headed to Calais in recent months just to be there for the official evacuation.
They are the ones who have decided that being moved to a reception centre in rural France is better than risking their lives each night to get to the UK.
“Anywhere in France would be better than the Jungle”, said one Sudanese migrant on Monday as he boarded a bus to Burgundy.
Aid associations say a growing number of migrants have decided to seek asylum in France.
Pascal Brice, head of the Ofpra asylum agency, said his staff were trying to convince migrants that their asylum requests in France would be processed ""very quickly"".
Around 70 percent of migrants evicted from other camps in Calais in the past had been given French residency, he said.
And what will become of those migrants who are given asylum? For them the task of learning French and trying to find work and permanent lodging won’t be easy in a country with record unemployment and not a great record of successfully integrating immigrants.
But charities are doing their best to help them, as seen by the open-air French lessons in Paris.
The challenge of settling in France is one that many will gratefully accept given what they have already gone through to get here.
(Around 100 migrants learn French in Paris. Photo: The Local)"
https://www.thelocal.fr/20170722/france-must-build-more-migrant-centres-rights-watchdog-says,migrant,352,"
				22 July 2017
				14:14 CEST+02:00			 
					14:14 CEST+02:00				",AFP,"France must build more migrant centres, rights watchdog says","France should create more reception centres for migrants to ensure decent conditions as arrivals pick up pace in the summer months, the head of an independent rights watchdog said on Friday.
Former government minister Jacques Toubon, the head of the Defenseur des Droits (Protector of Rights) body, made the claim as he visited a humanitarian centre for migrants in the La Chapelle area of northern Paris.
More than 2,800 people were evacuated earlier this month from a makeshift camp that sprung up around the centre, but a new camp is already forming.
French authorities have cleared makeshift migrant tent camps in Paris more than 30 times since 2015.
President Emmanuel Macron's government last week announced plans to create more than 12,000 places in reception centres for asylum seekers and refugees by 2019.
The numbers of refugees and migrants converging on Paris has increased since the closure last October of the sprawling migrant camp in the northern French port of Calais known as the ""Jungle"".
Thousands of migrants had made their home in the Calais camp in the hope of stowing away on trucks crossing the Channel to Britain.
READ ALSO: France jails Britons for smuggling migrants into England
French Interior Minister Gerard Collomb ruled out re-opening a migrant centre in Calais, saying it could act as an encouragement for migrants to head for France.
Toubon took issue with the minister's ""false"" claim.
""Everything shows that migration is the necessity to flee one's country and the political situation there, or war, flooding, drought, famine, or the denial of rights to women and homosexuals... there is no magnet effect in operation here.""
Toubon said that as soon as migrants enter France ""their fundamental rights must be guaranteed"".
Europe's migrant influx began in 2015, focused on Greece where hundreds of thousands of people crossed from Turkey as they fled war and poverty in the Middle East and Afghanistan.
The crisis receded in 2016 under an agreement with Turkey to clamp down on illegal border crossings.
However, it revived this year, focusing instead on sea crossings from Libya to Italy, mostly by people from sub-Saharan Africa."
https://www.thelocal.fr/20180117/uk-to-stump-up-cash-as-part-of-new-border-treaty-with-france,migrant,759,"
				17 January 2018
				11:53 CET+01:00			 
					11:53 CET+01:00				",AFP/The Local,"UK to stump up cash as part of new migrant treaty with France, Elysée says","Britain will hand over a ""major"" sum of money to help France deal with the migrant crisis at Calais, the French presidency said Wednesday, with the two countries set to announce a new treaty on how to handle migrants hoping to head to Britain.
The treaty, set to be announced at a summit in London on Thursday, will ""complete the Le Touquet accord"", Macron's office said in reference to a 2003 deal that effectively put Britain's border in northern France.
The details are ""still being finalised"", the French presidency said, but the treaty will include measures on how to manage unaccompanied minors, and Britain will make a ""major"" financial contribution.
At stake during Thursday's talks is a 2003 agreement between Britain and France which effectively moved the UK border onto French territory, meaning the area around Calais has become a bottleneck where migrants heading for Britain wait.
Interior Minister Gerard Collomb reiterated Tuesday that France would ask Britain to take in more refugees from northern France and increase their funding -- not only for security measures, but also for the development of Calais.
""It's in their interests that things go well,"" Collomb told the France 2 television channel on Tuesday ahead of a meeting between Macron and British Prime Minister Theresa May on Thursday in London.
Referring to the importance of Calais for the British economy, which faces uncertainty ahead of the country's exit from the European Union, Collomb added that ""a quarter of their trade transits through Calais.""
The original text of the Touquet accord, which came into force in February 2004, implemented joint controls at coastal ports in both countries as Britain, which is not part of Europe's Schengen visa-free zone, looked to bolster efforts to keep migrants out.
Later accords led to Britain financing some of the controls and security operations in Calais, just across the English Channel from its own port in
Dover.
Calais has long been a sore point in French-British relations, and Macron on Wednesday called for better cooperation in managing the border with Britain ahead of his first trip to London as president.
Record asylum claims
Migrants hoping to stow away on trucks bound for Britain have long been drawn to France's northern coast, with the squalid ""Jungle"" camp near Calais
once housing some 10,000 people before it was bulldozed by the government in late 2016.
Hundreds of migrants remain in the area, with police routinely breaking up makeshift camps of people hoping to head to Britain, a favoured destination
for Afghans and east Africans.
French officials argue the Le Touquet deal has worsened Europe's migrant crisis by creating a huge backflow of migrants in the area, lured by a belief
that it is easier to secure asylum and work permits in Britain.
A French human rights commission in 2015 said the accord had made France the ""police branch"" of Britain's immigration policies.
Macron made a renegotiation of the Le Touquet deal one of his campaign pledges, and Interior Minister Gerard Collomb signalled Tuesday that Paris would ask Britain to take in more refugees from northern France and increase its funding.
Brexit fears over economy in northern France
Macron sought to reassure the fishing industry and business owners in northern France on Tuesday over fears that Brexit will harm the local economy next year.
""I realise how much uncertainty there is in several economic sectors; fishing, industry, logistics,"" Macron said in a speech in the northern port of
Calais, ahead of a meeting with Britain's Prime Minister Theresa May on Thursday.
A so-called 'hard border' with Britain could crimp the billions of euros' worth of goods that flow through the port each year, a grim prospect for local
businesses and industry executives.
""No matter the changes to come and the relations between the European Union and the United Kingdom, the territory will remain attractive in these areas,"" he said.
He said France would press its concerns with the EU's chief Brexit negotiator Michel Barnier, who is scheduled to begin talks on an eventual
trade deal with Britain in March.
""The region's interests will be fully taken into account in the negotiations that France will lead, and I will make our case known in March
with our negotiator, Mr Barnier,"" he said.
Calais has long relied on its cross-Channel ties with Britain, which has also made the city a magnet for migrants hoping to reach Britain -- a
challenge that was the main focus of Macron's speech.
Migrants regularly try to stow away on the hundreds of trucks crossing to Britain each day."
