href,keyword,word_count,info,author,headline,article_text
https://www.thelocal.fr/20180612/france-defends-not-taking-in-aquarius-migrant-boat,migrant,789,"
				12 June 2018
				14:24 CEST+02:00			 
					14:24 CEST+02:00				",AFP,'Irresponsible': France blasts Italy but defends not taking in stranded migrant ship,"French president Emmanuel Macron blasted Italy as ""cynical and irresponsible"" for refusing to offer safe harbour to the stranded migrant ship Aquarius, while the French government defended its own decision not to allow the ship to dock.
French President Emmanuel Macron on Tuesday accused Italy of ""cynicism and irresponsibility"" over its refusal to take in hundreds of migrants stranded on a rescue ship in the Mediterranean, a government spokesman said.
Macron told a cabinet meeting that under maritime law, ""in cases of distress, those with the closest coastline have a responsibility to respond,"" spokesman Benjamin Griveaux said.
Earlier on Tuesday the French government defended its decision not to offer safe harbour to the stranded migrant ship Aquarius after local leaders on Corsica proposed opening one of their ports to the vessel.
Corsican leaders Gilles Simeoni and Jean-Guy Talamoni, the top politicians on the French Mediterranean island, tweeted their offer on Tuesday morning as uncertainty grew over the fate of the 629 people on board the ship.
But the central government in Paris criticised the gesture by the Corsican nationalists.
""[Simeoni] is taking a position without having any responsibility which is easy,"" junior Europe and foreign affairs minister Jean-Baptiste Lemoyne told Sud Radio.
""What does international law say? They need to go to the port that is safest and closest. And we can see that Corsica is not the closest or the safest. Given the boat's location, it is between Italy and Malta,"" he added.
Both Italy and fellow EU member Malta have refused to accept the migrants who are now heading for the Spanish port of Valencia after the new Socialist government in Madrid agreed to take them in.
Italy's hardline immigration policy under its new populist government could have knock-on effects in neighbouring France, where President Emmanuel Macron has also tightened immigration laws to crack down on illegal arrivals.
Italian Interior Minister Matteo Salvini -- who is also deputy prime minister -- has promised to deport hundreds of thousands of economic migrants, warning that Italy would not be ""Europe's refugee camp"".
The country has been the main point of entry in Europe for migrants and refugees arriving from Africa in recent years, with 700,000 crossing the Mediterranean since 2013, often from war-wracked Libya.
Migrants shelter on the Aquarius boat. Photo: AFP
Italy policy 'sickening'
Any increase in arrivals in France would ring alarm bells for Macron who has worked hard to close down migration routes from Africa amid strong anti-immigration sentiment in France.
But a spokesman for Macron's Republic on the Move party said the Italian government's policy was ""sickening.""
""The position, the line of the Italian government is sickening. It's unacceptable to play politics with human lives which is what is happening at the moment,"" Gabriel Attal told the Public Senat channel.
""I'm a spokesman for the party, not the government, but I can't imagine that France will not play a role in finding a humanitarian solution for this boat,"" he said.
Far-right leader Marine Le Pen called for the boats to ""return where they came from"" and said charities rescuing migrants in the Mediterranean were ""the accomplices of the people-trafficking mafia.""
Eric Ciotti, a prominent hard-right MP from the opposition Republicans party, also called on the government to take a tough line on the Aquarius.
""No French port, not Corsica, not Nice, not Marseille,"" he told CNews.
""Of course we should save lives, naturally it's a priority and Europe must act. But the obvious solution is returning to the Tunisian coast or to the Libyan coast,"" he said.
French charity defiant
The head of the French charity which charters the Aquarius migrant rescue ship said Tuesday that it would continue its operations despite the international standoff over the 629 people currently onboard.
The defiant comments from Sophie Beau, head of the charity SOS Mediterranee, suggest the row over the stranded ship could repeat itself -- not least as migrant attempts to cross the Mediterranean increase in the warm summer months.
Beau told AFP a ""one-off solution"" had been found for the Aquarius after Spain offered to take in its passengers following refusals from the nearest countries, Italy and Malta.
But the charity's missions will continue ""as long as there are people drowning in the Mediterranean, as long as we have the resources, and as long as we are able to act and we are not kicked out of the area,"" she said.
""The rescues will continue and it is crucial that European countries talk amongst themselves to find acceptable solutions"" to bring to shore migrants stranded in the Mediterranean, she said.
Beau said her charity, based in the southern French port city of Marseille, was acting under international law in giving ""assistance to people in distress""."
https://www.thelocal.fr/20181007/thousands-gather-across-europe-to-back-migrant-rescue-ship-stuck-in-marseille-port,migrant,475,"
				7 October 2018
				02:46 CEST+02:00			 
					02:46 CEST+02:00				",AFP,Thousands gather across Europe to back migrant rescue ship stuck in Marseille port,"Thousands of people attended rallies Saturday across Europe to show support for migrant rescue ship Aquarius, stuck in port in the French city of Marseille after Panama revoked its flag.
Dozens of demonstrations were held in France including in Paris, as well as in Brussels, Berlin, Madrid and Palermo.
Many dressed in the boat's orange colours and chanted for ""a flag for Aquarius"" while slamming the ""criminal inaction"" of EU governments to resolve the impasse.
Marseille, home to the SOS Mediterranee NGO which operates the vessel with Doctors Without Borders (MSF), saw the largest show of support. Organisers said 10,000 people took part in the demonstration though police put the figure at nearer 3,500.
A similar rally in Paris also drew a crowd of around 10,000, according to the organisers, while police put the figure at a tenth as many.
""The goal is to make an appeal to citizens and show that SOS Mediterranee draws its legitimacy from civil society,"" said the NGO's spokeswoman Sophie Rahal in Paris.
Panama last month pulled the ship's flag following a request from Italy's far-right, anti-establishment government, meaning the Aquarius cannot legally set sail.
The boat's operators say it has rescued some 29,500 migrants to date and SOS Mediterranee president Francis Vallat said ""the situation is more critical than ever"".
Vallat said although migrant volumes had dropped ""we are passing from one death per 42 migrants (at sea) last year to one in 18 migrants"" this summer.
Attending the Marseille rally, French leftist champion, local lawmaker and leader of La France Insoumise Jean-Luc Melenchon insisted ""Aquarius must have a flag -- and a French flag"".
Meanwhile, around 100 flouted an official protest ban and gathered in the northern port of Calais -- where authorities in late 2016 dismantled the notorious Jungle refugee camp, which at its height at been home to some 10,000 migrants.
Immigration remains a hot-button issue in the European Union following the 2015 migration crisis. There are deep divisions among member states over how to handle the continent's biggest influx since World War 2.
Frontline state Italy has clamped down on asylum-seekers under far-right Interior Minister Matteo Salvini.
Saturday saw protesters gather in Riace -- a small hamlet in Italy's deep south which has earned praise for its integration of migrants -- demanding the release of their leftist mayor.
Domenico Lucano was placed under house arrest on Tuesday under suspicion of arranging ""marriages of convenience"" for immigrants and for allegedly skipping a tender process while awarding a garbage management contract to co-operatives with ties to migrants.
In office since 2004, Lucano has made headlines around the world for welcoming migrants to the sparsely-populated village in Calabria in a bid to boost jobs and development.
""Keep strong, continue fighting,"" his supporters chanted Saturday as they gathered outside his window from where he raised a fist in support."
https://www.thelocal.fr/20180124/frozen-mountain-migrant-trail-italy-to-france,migrant,738,"
				24 January 2018
				09:00 CET+01:00			 
					09:00 CET+01:00				",AFP,On the frozen mountain migrant trail from Italy to France,"Cisse and Ibrahim have never seen snow before. After fleeing crisis-hit Libya by boat and making their way up Italy, the exhausted pair trudge in flimsy trainers along a pitch-black mountain trail in a night-time bid to reach France.
They are among hundreds of migrants trying their luck in Bardonecchia. The town is a skiers' delight, but beyond the black run thrills and hot toddies lie the tracks of those braving dangerous snowy peaks to cross the border.
After a crackdown at the Ventimiglia coastal crossing, young men have begun arriving at the railway station here to attempt the Col de l'Echelle pass, which runs 16 kilometres (ten miles) between Bardonecchia and the first French town.
While controls along this route are strict in the summer months, it is closed to traffic in winter and rather than zealous police the biggest challenge facing the mainly African men is a freezing wind that buffets the1,700 metre (5,600 feet) high pass.
Migrants are risking death to cross the Italian Alps into France
Migrant electrocuted on top of train from Italy to France
How Italy's African entrepreneurs are helping to easy migrant pressure
Migrants from the Ivory Coast cross a snow-covered pass.
""Word has been spreading among migrants for several months. But it's extremely dangerous. The arrivals have become a daily tragedy!"" said local teacher Silvia Massara, who helps distribute hot meals to those passing through.
Inside the station, tired youths wolf down plates of stew and rice handed out by volunteers from the Rainbow for Africa and Briser les Frontieres associations, as well as the Red Cross.
Frostbite fears
Those lucky enough to make it to the French side without getting caught are welcomed by locals offering warm hearths and hearts. The Italians, meanwhile, do everything possible to convince the migrants to turn back before it is too late.
After surviving baking deserts, detention in Libyan prisons and perilous boat crossings in the Mediterranean, the migrants are shown pictures by volunteers of avalanches or fellow travellers who have lost limbs to frostbite.
Many shrug off the danger. ""We have nothing to lose. No job, no money, we are ready to take any necessary risk to cross the border,"" said one young Guinean, who wanted to remain anonymous.
Cyrille Coulibaly, a 20-year-old from Ivory Coast who recently arrived in Italy, had set off before dawn the day before, but quickly turned back, shivering violently in his lightweight clothing. However he refuses to be discouraged.
""I was advised to take this route. It's all planned. I just need to find some shoes,"" he told AFP.
Others, like 29-year-old Mohamed Bambore from Burkina Faso, throw in the towel before even setting out.
""I'm not going to do it. It's dangerous, you could lose a foot (to frostbite),"" he said.
French tourists offer food and water to migrants walking in the snow.
Instead he will wait in Italy for his residence permit to be renewed before looking for another way into France. Cisse and Ibrahim, struggling through snow up to their knees, their jeans soaked through, also turn back.
Dash in the dark
Catching a train would certainly be the easiest way: Bardonecchia is the last Italian stop on the Milan to Paris service, which runs four times a day. As night falls, the migrants put off by the mountain stare at the timetable, planning to sneak on at the next chance.
But reality catches up with them quickly, with seven or eight French border police officers on each train.
""The train is full, get the next bus,"" a conductor tells two young migrants, signalling for them to leave the station.
Italian police officers stand guard at the border.
The whistle blows, the doors close and the train leaves -- almost empty. Most of those who do make it across, by train or on foot, eventually find themselves in a white French police van which serves as a shuttle bus from six in the morning until midnight, returning them to Bardonecchia.
There are warm clothes and hot tea waiting for them at the station, where a little room has been transformed into a dormitory, in which exhausted travellers can bed down for the night under the supervision of a volunteer medic. Dawn brings fresh snowfall and new migrants, who determinedly zip up jackets, wrap scarves around their heads and brace for the climb up the menacing slopes.
By Francesco Carvelli, photos by Piero Cruciatti"
https://www.thelocal.fr/20181016/french-police-admit-taking-two-migrants-over-the-italian-border-by-mistake,migrant,377,"
				16 October 2018
				10:22 CEST+02:00			 
					10:22 CEST+02:00				",The Local,French police admit taking two migrants over the Italian border 'by mistake',"French gendarmes have admitted driving two undocumented immigrants over the Italian border without Italy's permission, in what the French authorities said was a mistake.
The incident took place last Friday, when Italian police spotted a van belonging to their French counterparts near Claviere, a ski resort on the border between south-east France and north-west Italy that runs through the Alps.
The French officers reportedly ushered two men out of the vehicle into some nearby woodland, then drove back towards France.
Public prosecutors in Italy have opened an investigation into the incident, which was partly captured on camera by the Italian officers.
French authorities confirmed on Monday evening that a gendarme van had crossed the border during an operation to deport undocumented migrants. Officers alerted a police station on the Italian side, according to the Hautes-Alpes prefecture, but the vehicle was not supposed to enter Italy.
The gendarmes involved were new to the post and unfamiliar with the area, the French department's prefect Cécile Bigot-Dekeyzer told Le Dauphine, putting the incident down to ""an error on the part of the officers"".
READ ALSO:
Tensions between Italy and France as ministers meet on immigration
Italian and France anti-EU leaders slam Brussels 'bunker'
'Political crisis between Italy and the rest of Europe': Macron slams Italian migrant policy
The explanation failed to satisfy Italy's government, with anti-immigration Interior Minister Matteo Salvini demanding ""clear, swift and unequivocal answers"" from Paris.
""I don't want to believe that [Emmanuel] Macron's France would use its own police to secretly unload immigrants in Italy,"" said Salvini, one of the French president's most vocal critics. ""But if anyone seriously thinks they can use us as Europe's refugee camp, violating laws, borders and agreements, they are sorely mistaken.""
It's not the first time the Alpine border has caused tension between France and Italy: in April, Rome summoned the French ambassador to complain after French customs officers crossed the border and confronted an Italian resident they suspected of carrying drugs at the train station of Bardonecchia.
The same month saw heated protests on both sides of the border by pro- and anti-migrant groups, prompting both countries to send police reinforcements to the mountain area.
READ ALSO: On the frozen mountain migrant trail from Italy to France
Photo: Piero Cruciatti/AFP"
https://www.thelocal.fr/20180528/paris-what-we-know-about-the-hero-migrant-who-saved-a-toddlers-life,migrant,1115,"
				28 May 2018
				14:19 CEST+02:00			 
					14:19 CEST+02:00				",The Local,Paris: Who is 'le spiderman' - the Malian migrant who saved a toddler's life?,"Who is Mamoudou Gassama, the young Malian immigrant who scaled the facade of a building in Paris to save a toddler's life, earning him praise, a meeting with the president and French citizenship.
Who is he?
Mamoudou Gassama is a 22-year-old undocumented immigrant who carried out a spectacular rescue of a four-year-old who was dangling from a balcony in Paris.
His act of bravery which took place at around 8 pm on Saturday in northern Paris, was captured on film and viewed millions of times on social networks.
Film of the rescue shows Gassama pulling himself up from balcony to balcony with his bare hands as a man on the fourth floor tries to hold on to the child by leaning across from a neighbouring balcony.
On reaching the fourth floor Gassama puts one leg over the balcony before reaching out with his right arm and grabbing the child.
Watch 22 year old Mamoudou Gassama heroically scaling four stories of a building when he sees a toddler about to fall to a certain death. When he began climbing the neighbors did not have ahold of the child’s arm yet. pic.twitter.com/67EsUmzwFN
— Ray [REDACTED] (@RayRedacted) May 28, 2018
Where's he from?
The actions were undoubtedly a staggering feat of courage but it was perhaps nothing compared to what he previously endured on his journey from his home country of Mali to France which saw him pass through war-torn Libya.
""I left Mali a long time ago, passing through Burkina-Faso and Nigeria,"" he told French news channel BFM TV. ""It was very difficult.""
Eventually Gassama arrived in Italy after taking a boat from Libya.
""It was terrible on the boat,"" he said. ""There were many of us, a lot of people.""
Gassama arrived in France in September 2017. He lives in a hostel in Montreuil, a suburb to the south west of Paris. He had travelled to the 18th arrondissement of Paris on Saturday and just happened to be by the building by chance after hearing all the commotion and people shouting.
What did he say about the rescue?
Tracked down by reporters 24 hours after the heroic rescue, Gassama said he had acted without thinking.
""I saw all these people shouting, and cars sounding their horns. I climbed up like that and, thank God, I saved the child,"" he said.
""I felt afraid when I saved the child... (when) we went into the living room, I started to shake, I could hardly stand up, I had to sit down,"" he added.
Meet Paris Hero: Mamoudou Gassama, a Malian immigrant, who climbed up to the fourth-floor balcony of an apartment block to save a 4-year-old child. https://t.co/upkKwyaNFI The incident took place at about 8pm on Saturday in northern Paris. pic.twitter.com/KHD4LhmaHK
— BlakeNordstrom1 (@BlakeNordstrom1) May 28, 2018
What has the reaction been in France?
Apart from the reaction on Twitter, where people have hailed his bravery, Paris mayor Anne Hidalgo praised the young migrant on Twitter for his ""act of bravery"" as well as phoning him personally to ""thank him warmly"".
""He explained to me that he had arrived from Mali a few months ago dreaming of building his life here.
""I told him that his heroic act is an example to all citizens and that the city of Paris will obviously be very keen to support him in his efforts to settle in France,"" she added.
The young Malian will next be honoured for his brave rescue by French President Emmanuel Macron who invited him to the Elysee Palace on Monday morning (see below).
Diaby, Mamoudou's brother who was also interviewed on BFM TV said that they would bring up the subject of their status in France during their meeting with Macron.
""We would like to have a proper status here, to work in good conditions in France. Then as soon as you have a job you need housing, to have a good life,"" he said.
""Today he lives in a foyer (hostel), it is a very serious situation because there is no space, but we make do. Anyway, we make the most of the situation and ask.""
The act of bravery by an immigrant has also provoked a political row about immigration in France.
The act of heroism, which was the top news item for most French websites and television channels, comes as French lawmakers debate a controversial bill that would speed up the deportation of economic migrants and failed asylum-seekers.
Macron, a centrist, has taken a tough line on economic migrants fleeing poverty rather than refugees escaping war or persecution.
Plenty of people have been quick to point out to the likes of Marine Le Pen and those in her far right National Front party, exactly what immigrants can bring to France.
Those on the far right however have rubbished the idea that his Gassama's act of bravery should be used to distract from the migrant crisis in France.
A senior member of the anti-immigration National Front, Nicolas Bay, said however that while the party supported Gassama receiving French papers all other illegal migrants should be summarily deported.
But in a warning to other African migrants he said he ""can not give (papers) to all those who come from Mali or Burkina Faso"" -- two of the countries from where thousands of migrants set out each year for Europe on a perilous journey across the desert and Mediterranean Sea.
What did Macron do?
In his meeting with Macron on Monday, Gassama told the French president of his experience.
""I was trembling, I couldn't believe it,"" he said.
Macron asked what condition the child had been in once he'd been rescued.
""He was crying, his feet were hurt"" said Gassama, adding that he had seen the toddler since the incident.
""Bravo,"" replied the president.
Mamoudou Gassama est arrivé à l'Elysée.
Notre direct https://t.co/AVe891zXDM pic.twitter.com/bIrqfxZ3sr
— franceinfo (@franceinfo) May 28, 2018
And then the president announced that Gassama would be given French citizenship and would enroll in the French fire service.
""You have become an example because millions of people have seen you. It is only right that the nation be grateful,"" Macron told the 22-year-old, adding that his immigration status would be ""put in order.""
Confirming to Gassama that he would be made a French citizen, Macron said: ""Even if you did not think about what you were doing it was an act of courage and strength that won the admiration of all.""
During the meeting, Macron also proposed that Gassama, who received a medal and certificate for bravery, join the French fire service.
READ ALSO:
Hero Malian immigrant who saved child to be given French citizenship
VIDEO: Paris 'spiderman' scales building to rescue dangling toddler"
