href,keyword,word_count,info,author,headline,article_text
https://www.thelocal.fr/20180117/gritty-paris-a-look-at-the-dark-side-of-the-city-of-light,migrant,2613,"
				2 November 2018
				15:48 CET+01:00			 
					15:48 CET+01:00				",Evie Burrows-Taylor,The other Paris: A look at the darker sides of the City of Light,"When people think of Paris they think of wonderful cuisine, beautiful boulevards, street side cafes and its glamorous residents...in short, la vie en rose. But there are some darker sides to life in the city of light.
Everyone knows the term Paris syndrome, used for tourists who are said to be suffering the shattered dreams that inevitably result from overexposure to clichés prior to their arrival in the City of Light.
But we are not talking about the myths and legends of moody waiters, rude locals and piles of pavement dog poo that might leave the odd tourist disappointed.
There is a grittier reality to life in the French capital, that is worth noting, although it shouldn't put you off visiting.
Sexual harassment on transport
Groping on the Metro, soliciting in the street, catcalling and worse...the City of Love isn't always quite as romantic as its reputation would have us believe.
According to a study conducted in 2016, one in two women in France said they will choose trousers over a skirt to avoid becoming the victim of sexual harassment on public transport.
And a 2015 survey of women commuters around Paris revealed that 100 percent of respondents said they had been a victim of sexual harassment.
As the wave of allegations against disgraced Hollywood mogul Harvey Weinstein and ensuing #MeToo campaign took hold in 2017, the subject of women's issues felt even more pertinent in France where a new law is set to be introduced to impose on-the-spot fines for sexual harassment of women on the streets.
In October 2017 when The Local went on to the street to talk to women about their experiences of sexual harassment, Madeleine La Salle, a 30-year-old Parisian woman said: ""During one packed Metro journey a man pressed up against me and placed his erect penis between my buttocks.
""I was so scared, I was shaking. I didn't know what to do,"" she said.
And La Salle wasn't alone. Every woman we spoke to had a story to tell.
On the positive side, the government has launched numerous campaigns against harassment on transport and there is hope that the awareness brought about in recent months by #Metoo will make a difference.
Photo: AFP
Paris's own migrant crisis
In recent years Paris has seen sprawling squalid migrant camps spring up all over the city. The latest to be cleared was the one that housed thousands along the Canal St Martin in the 10th arrondissement.
""Teachers in school taught us about France and what a wonderful place it was,"" Khater, who said he was 15 years old, as he stood by the dozens of tents strung along the banks of the Canal Saint-Martin that now serve as home for hundreds of migrants, told The Local.
""I didn't think it would be like this,"" he said, surveying the squalid scene along the canal, whose banks in summer host hundreds of trendy youngsters drinking beer or wine late into the night.
And while in parts of Paris it's the historic Haussmann architecture or the beautiful parks that dominate the view, in other parts, mostly the north and north east of the capital - it's the tented communities that regularly emerge that draws people's eyes.
Tents by Canal Saint Martin, Paris. Photo: Rory Mulholland
France's handling of the migrant crisis, or mishandling, as many would see it, has been the subject of much hand wringing on the part of the French government, rights groups and the general public.
Critics ask why France appears to be failing refugees that end up here when Germany has been able to handle more than a million migrants since 2015, with few if any of them having to live in the squalor seen on Paris streets or at the notorious Calais “Jungle” that was finally shut down just over a year ago.
While authorities appear keen not to allow these camps to emerge it feels only a matter of time until the next one. The migrant crisis is here to stay, it seems.
(A migrant camp under Line 2 of the Paris Metro in 2015. It has since been destroyed.)
There are also the camps set up by the Roma community around the city (see photo below), which are regularly pulled down by the police. Another problem that doesn't seem to have a solution.
(AFP)
Homelessness
The scale of the problem of rough sleeping on the streets of Paris is hard to ignore, with the sheer number of people begging in the French capital raising the eyebrows of locals and visitors alike.
Whether it's someone appealing to commuters on the Metro, or the more discreet appeal of the person holding up a cardboard sign asking for money for food (Pour manger s'il vous plait) on a street corner, it's impossible not to notice just how many people here are searching for a petite pièce.
From the limbless beggars crawling through the carriages on the Metro and the people who approach you as you sit outside of brasseries, to the families in bus shelters and those who play a song or write a poem in exchange for some small change, the variety and amount of begging in Paris can be shocking for those unfamiliar with the city. And sometimes even for those who live here.
Photo: AFP
""There have been more and more French people ending up on the streets in recent years with rising unemployment. And there is a problem with the lack of local solidarity,"" Louis-Xavier Leca, Director of La Cloche, an organisation that promotes relationships between neighbourhood businesses, residents and the homeless living there, told The Local.
""After my own experience spending time in Chile and West Africa, I think it can be worse to fall on hard times in Paris than in poorer countries. People tend to be more isolated here,"" he added.
Drugs
The problem of drugs blights most cities but it often appears more visible in certain parts of Paris.
Obviously if you head over to the wealthy 8th or 16th arrondissements you are unlikely to get the impression that the City of Light is overrun by dealers and crack addicts.
However try parts of the 19th, 18th or 10th arrondissements where authorities and police have struggled to deal with the extent of the problem.
After police moved in to close a so-called ""crack hill"" on the edge of the city earlier in 2018 dealers and their addicts moved into more central parts of the city.
Paris : le retour du crack électrise la place de Stalingrad https://t.co/uBKxvzTJOT
— Le Parisien (@le_Parisien) August 31, 2018
Place de Stalingrad which borders the 10th, 18th and 19th arrondissements and is home to trendy bars became the new hub for dealers selling crack for as little as €6.
The sight of addicts injecting themselves with drugs or smoking them has become in a square once frequented by families. Police and the Paris mayor have vowed to tackle the problem.
Gare du Nord
Gare du Nord is often cited by visitors as being a somewhat underwhelming even dirty and smelly introduction to Paris.
From the smell of urine outside, the dilapidated ceilings, lack of signage and leaky ceilings to the narrow platforms, closed shops, lack of space or the general all round filth, the station has a few well-documented issues.
In fact, it was once dubbed ""the squalor pit of Europe"" by a British exec and even these days you don't have to spend long there to think it might still be deserving of the name.
Part of the problem is the station is located in one of the city's most problematic areas for drugs and alcoholics, with other stations in the north east of Paris showing signs of the strain.
Indeed, the prevalence of dealers and addicts at some Metro stops has led some drivers to skip certain stations because of the drugs related violence, particularly on lines 12 and 4.
Happily -- at least for Gard du Nord and its users -- there are plans to finally give the station a much needed makeover which it is hoped will be finished just in time for the Paris Olympics in 2024.
Photo: AFP
Homophobic violence
Paris is not a city people associate with homophobia given its thriving gay scene.
If you judged the city by a night out in the Marais quarter you wouldn't get the impression the city's gay community were cowering in fear.
They are not, but that doesn't mean there isn't a longstanding problem with homophobia.
Indeed in Autumn 2018 a string of violent homophobic attacks shocked the city and its leaders and brought the issue to the public attention.
""I'm gay and this is 2018,"" said Guillaume Mélanie, President of Urgence Homophobie, pictured below on the right, who was one of the victims.
Mayor Anne Hidalgo has vowed to take action and former deputy mayor of Paris, Bruno Julliard also regretted ""the proliferation of homophobic attacks, public insults, savage 'outings' and incessant insults on social networks.
""Homophobia is doing very well in 2018. It is no longer bearable, it requires collective action: the police, justice system, schools, associations. Quickly,"" he said.
Antisemitic attacks
There have been 11 anti-Semitic murders in France since 2000 but the killing of an 85-year-old Holocaust survivor in her Paris home in March 2018 which echoed that of another elderly Jewish woman in Paris, left the community in France particularly shocked and scared.
Two people were charged with the brutal murder of Mireille Knoll, an 85-year-old French Jewish woman, who was repeatedly stabbed and whose body was then set alight in a crime being treated as anti-Semitic by French police.
This violent murder which has echoes of a similar case from April 2017 in which Sarah Halimi was also killed in her own home in the same 11th arrondissement of Paris.
It's not just the brutal murders.
There have been incidents in the suburbs of the capital where Jewish stores have been burned down and young Jewish boys beaten up for wearing the Kippa.
And the incident when anti-Semitic graffiti reading ""Jewish scum live here"" was scrawled on the door of a Paris apartment building caused shock and anger in the French capital.
Paris, September 2018. Anti-semitism alive and kicking. The graffiti on this door reads: ""Jewish trash live here..."" https://t.co/XJPblVrSkw
— Kim Willsher (@kimwillsher1) September 20, 2018
Inequality: Paris vs. the banlieues
When people think of the Paris banlieues (if they do at all), it's likely they either think of them at best as grey, lifeless neighbourhoods full of tower blocks and at worst as places of poverty, violence and crime. There is an element of truth to both.
And it's also true that life in the banlieues is startingly different to life in the French capital, essentially because they've been neglected over the years at the expense of the inner city centre where threre is more wealth, as well as resources and prospects. This is actually referred to as the ""donut effect"".
Successive French governments have been accused of failing to do enough to mend the massive inequality and have been accused of following an ""out of sight, out of mind"" approach to the banlieues.
In truth, most visitors to Paris will have little reason to venture beyond the peripherique ring road which acts as the barrier between Paris and ""not-Paris"".
In 2017, The Local reported that the banlieues were ripe for a repeat of the riots seen there in 2005 when France was forced to declare a state of emergency.
Despite the soul-searching prompted by the outbreak of those riots and may since, there has been very little positive outcome.
And that's in spite of various government initiatives and billions of euros spent over the years.
""There's been a decline that has set in in recent years that is approaching on the irreparable, because ten years on these suburbs are no longer producing rioters, they are producing terrorists,"" said Malek Boutih, an MP for the département of Essonne to the south of Paris and former head of SOS Racism in 2015
On the plus side, the Grand Paris project should at least boost transport links to the outer suburbs and is a sign that psychologically at least Paris is starting to acknowledge it must think of itself as a city whose limits don't suddenly stop at the periphérique.
Photo: AFP
Gangs
Paris might not be a city known for its gang culture and knife crime like London is, but rivalries between groups of teenagers recently left a 15-year-old dead near Bastille as the problem, fueled by social media, continues to concern police and authorities.
The violence has once again focused attention on an issue -- not one that is not particularly new but one which is increasingly worrying the French authorities -- in part due to the young age of those being drawn into violent groups.
""It's very worrying. There is real trivialization of violence among young people. These are boys as young as 13, more often that not from tough neighbourhoods, who are marginalized and often not in schools. They also lack any kind of parental framework,"" Yvan Assioma, from the Alliance police union, told The Local.
Photo: AFP
Since 2009 a special police unit has been tasked with monitoring and mapping the violence among rival groups of youths. There are believed to be around 40 different groups in Paris, mostly based in the outer arrondissements in the north and east of the city.
Police are however reluctant to call them ""gangs"", because they insist there is very little organisation and structure.
""These are just young people, who might be from the same arrondissement, block of flats or school. There might be a core of five or six, perhaps up to 10, but then they can grow very quickly if needed,"" said Assioma. ""And they can also dissolve pretty quickly too.
""There is no leader or structure like in organised gangs and they often just form for a spontaneous event for any kind of motive.""
Threat of terrorism
The threat of terrorism has plagued France and in particular its capital since 2015, after jihadist attacks left scores dead.
Despite the violence, bars, restaurants and music venues have recovered well since the attacks in November 2015 and Parisians go about their daily lives as normal.
But while the country's state of emergency may have been lifted in November 2017 -- after two years of being in place -- and replaced with a new anti-terror laws the threat remains, with the government saying it thwarts attacks on a regular basis.
It is still the norm to see soldiers and armed police wandering around the tourist hotspots as well as quiet, residential areas of the city.
Attacks on police and soldiers at tourist sites including Notre-Dame, the Champs-Elysees and the Louvre means a high police and military presence is inevitable and given most experts believe the threat will remain for a generation, it is likely to remain that way.
There has also been a marked increase in general security, such as guards at the entrances to bars, shops and concert venues with customers and revellers forced to undergo body searches and bag checks.
While this doesn't really fit in with the fairy tale image of Paris that is so popular worldwide, locals have just got used to it and although tourists numbers have fallen, millions still come through the arrival gates.
This article has been updated since it was first published earlier in 2018.
While authorities appear keen not to allow these camps to emerge it feels only a matter of time until the next one. The migrant crisis is here to stay, it seems."
https://www.thelocal.fr/20181017/french-police-dumping-migrants-in-woods,migrant,465,"
				17 October 2018
				08:50 CEST+02:00			 
					08:50 CEST+02:00				",The Local,'Does Paris think it's normal?': Italy's Salvini rages after French police dump migrants in Italian woods,"Italy's far-right Interior Minister Matteo Salvini on Tuesday hit out at President Emmanuel Macron after French police were caught dumping migrants in Italian woods. He asked: ""Does Paris, which claims to be civil, find it normal to throw people into the woods?.""
Italy's far-right Interior Minister Matteo Salvini on Tuesday hit out at President Emmanuel Macron after French police were caught committing the ""unprecedented offence"" of dumping migrants in Italian woods.
Salvini (pictured below), also deputy prime minister and head of the anti-immigrant League party, on Monday demanded a ""clear response"" after French authorities admitted to returning migrants to Italy in ""error"".
A French police van was seen on Friday driving into Italy to return recently-arrived migrants to the town of Claviere.
""It was an error to enter Italian territory without the authorisation of the Italian police,"" said Cecile Bigot-Dekeyzer, the top official in the Hautes-Alpes region.
""The police had no right to enter Italian territory,"" the prefect said.
An outraged Salvini batted away that explanation, while France said the incident should be ""kept in perspective"".
""Abandoning migrants in an Italian wood can't be just a mistake or an incident,"" Salvini said on social media. ""What happened in Claviere is an unprecedented offence towards our country.""
""Does Paris, which claims to be civil, find it normal to throw people into the woods?... We're dealing with an international shame, and Mr Macron can't pretend he doesn't know. We won't accept any excuses,"" Salvini wrote.
'It was a mistake'
""Let's keep this in perspective,"" an official in the French president's office told journalists on Tuesday.
""It was a mistake, the authorities have admitted that. There was an incursion, not planned or according to procedure, into Italian territory, where two people were dropped off.""
Thousands of migrants are caught each year trying to enter France and returned to the Italian border. Last year AFP journalists saw French police dropping off migrants in front of Bardonecchia train station, in Italy.
A source close to Macron slammed Salvini's ""essentially individual political exploitation"" of the incident.
Italian Prime Minister ""Giuseppe Conte hasn't turned this incident into proof of a crisis,"" the French presidency said.
""We manage our shared border together and there are occasional small regrettable incidents on both sides.""
Relations between Rome and Paris have been increasingly tense in recent months, with Italy's populist government accusing France and others of failing to share the burden of the 700,000 migrants and asylum seekers that have crossed the Mediterranean to come to Italy since 2013.
French police in March sparked outrage by carrying out identity checks at Bardonecchia station, with the Italian foreign ministry summoning the French ambassador to protest.
In June, Macron criticised Salvini for closing Italian ports to the Aquarius migrant rescue boat, prompting a fresh summoning of the ambassador."
https://www.thelocal.fr/20160906/migrant-centre-near-paris-burned-to-the-ground,migrant,361,"
				6 September 2016
				12:26 CEST+02:00			 
					12:26 CEST+02:00				",The Local/AFP,Arson suspected as new migrant centre near Paris torched,"Arson suspected after a building set to house 90 migrants caught fire this morning, the same day that Paris revealed plans for its first official migrant camps.
The fire ignited at the migrant accommodation in Forges-les-Bains, south west of Paris, in the early hours of Tuesday morning, reported to BFM TV.
Interior Minister Bernard Cazeneuve said on Tuesday afternoon that all possible light will be shed on the matter to determine whether the fire was started voluntarily.
""If this hypothesis is confirmed, everything will be done to quickly arrest those behind this abject act and bring them to justice,"" he said.
The building, which was set to house 90 migrants when it opens in October, had proved to be highly contentious in the local community.
The night before it was burned, authorities had held a meeting about the centre while around 100 locals protested outside.
These protests continued until around 11pm, BFM TV reported, and just hours later the building caught fire.
The exact cause of the fire remains unconfirmed, but police have launched an investigation.
No injuries were reported.
The incident comes as the mayor of Paris announced that the first refugee camp in the capital will open in mid-October with an initial capacity of 400.
The centre, which will be housed in an old railway site in the north of Paris, aims to replace the makeshift camps that keep springing up around the city.
Another view of the camp site in northern Paris. Photo: Google StreetView
Hidalgo, who had announced in May that the camp would be created, said asylum-seekers would be allowed stay there for ""five to 10 days"" and would receive medical and psychological care.
Hidalgo, a Socialist, said the €6.5-million ($7.2 million) Paris centre aimed to take asylum-seekers off the streets while they wait for a place in an official hostel set aside for refugees.
A second centre, for women and children only, will be opened in Ivry-sur-Seine to the southeast of Paris by the end of the year, she told a press conference.
The announcement comes as yet another makeshift camp housing several hundred people in northern Paris was dismismantled by police on Tuesday morning."
