href,keyword,word_count,info,author,headline,article_text
https://www.thelocal.fr/20180518/aid-groups-warn-of-growing-risks-as-paris-migrant-camps-swell,migrant,1112,"
				18 May 2018
				14:52 CEST+02:00			 
					14:52 CEST+02:00				",The Local/AFP,'At least there are no bombs': Concerns grow as Paris canal migrant camps swell,"Migrants camped along the Canal Saint Martin in Paris told The Local of the squalid conditions they are living in as aid groups called on authorities to address ever-worsening situation, which they say will lead to security and health risks.
Around 1,600 migrants, mostly from Sudan and Eritrea, have constructed makeshift shelters under an overpass in the northern Villette area -- one of the largest camps in the French capital since the surge in arrivals to Europe beginning in 2015.
An additional 600 people, mainly Afghans, are sleeping in a tent city along the trendy Canal Saint-Martin.
In summer the banks of the Canal St Martin are usually packed with young revellers enjoying a drink and picnic by the water but now the tents stretch down the towpaths from Jaures Metro, until the metal fences which have been erected to prevent the camp spreading.
The tents along one side of the canal are mostly occupied by Afghans, while on the other side there are mostly Africans from Senegal, Ghana, Mali, Nigeria, Mauritania and Cote d’ivoire.
Empty water bottles and debris scattered around.
Abdul Jabar, 24, from Afghanistan has only been in France for the past five days, but his journey from Afghanistan took him 6 months.
He travelled from Afghanistan to Pakistan to Iran to Turkey to Bulgaria to Serbia, and then hopped on a truck to France.
“It’s very bad here. I have no bed no food and no shower and it’s very cold at night,"" said Jabar who says his parents encouraged him to make the journey and ask for asylum.
When asked if he regrets the journey though, he says no. “Here there are no bombs.” Jabar says he seeks schooling, work, and a better life in France
Samsour, aged 19 and also from Afghanistan has been in France for the past three months after travelling through Pakistan, Iran, Turkey, Greece, Serbia, Hungary, and finally Germany where his demand for asylum was rejected.
His asylum demand was also rejected in France and he now plans on going to Calais to try his chances in England.
'I regret coming here everyday'
Samsour says all he can do is continue trying. He wants to write a book about his story.
Sierra, a 19-year-old from Senegal has been in France for the past 3 months after travelling through Mali, Algeria, Libya and Italy.
“You call the asylum offices, but agents don’t take your call. I keep trying but the lines are always occupied.”
He says that even when they accept someone’s request for asylum, such as the case for his friend, you’re not given housing, and are left to live by the canal.
“I left after my parents died. I tried living with my aunt but there were too many family problems,” he said.
Sierra thought he would come to France and continue his studies in law.
“I regret coming here now. Not just sometimes, everyday I regret it. I sleep on the floor. At least back home I had a little roof over my head,"" he said.
“I saw on television that France was this country of fraternity and liberty, but I come here and I’m left to this camp where there is always fighting and problems.
A fight broke out between an Afghan and some of the Africans after a member of the public began handing out food. Each group accused the other of taking too much food or keeping it to sell on later.
'Unlike any we've ever seen in Paris'
Louis Barda of Medecins du Monde (Doctors of the World) said this week that ""the situation is increasingly alarming,"", calling the Villette camp ""unlike any we've ever seen in Paris"".
While two doctors nearby were treating patients as others washed their clothes in the nearby canal, a young man suddenly began convulsing, AFP witnessed on a visit to the camp.
The seizures stopped a few minutes later, but the man was muttering gibberish with a panicked look on his face. He refused to go along with first
responders for treatment.
""He probably took some drugs,"" Barda said, adding that he and his colleagues had noted ""more and more addictions"" at the site.
Tensions ""have clearly gotten worse over the past two weeks,"" he said, citing people who have needed treatment ""after being hit with iron bars, people with gaping wounds, knife cuts"".
On Sunday a Sudanese man was seriously injured during a fight, while a young Afghan drowned in the Canal Saint-Martin last week.
Another migrant's body was also fished out of the canal near the ""Millenaire"" camp at La Villette (see pic below).
Meanwhile volunteers are grappling with an outbreak of respiratory and skin conditions such as scabies in the squalid, tightly packed camps.
""The security and health of the people living in these camps, but also of members of aid associations and local residents, are no longer assured,"" according to a petition signed by more than 30 aid groups, released Thursday.
'Knife in the stomach'
""I've been here about two weeks,"" said Ahmad at the Millenaire camp. ""It's so difficult, at night it's so cold, no good food, no washing -- it's a terrible time.""
""Three or two days ago I saw one person, someone hit him with a knife in the stomach,"" he said.
Aid groups say the camps have attracted smugglers from the port city of Calais, offering them a chance to reach Britain -- where many migrants believe it would be easier to find work and potentially asylum.
But ""if you want go to England you have to pay 1,000 euros ($1,180). It's too expensive!"" said Beniam, a 26-year-old Eritrean, who says he prefers France because of its ""schools and jobs"".
""Their days are reduced to finding food, toothpaste or soap, to washing their clothes. They're stuck in these camps and unable to imagine anything else,"" said Alix of the NGO Utopia 56, declining to give her full name.
""What's happening here is also because the state isn't accepting its responsibilities, so citizens and associations have to pick up the slack,"" she said.
Paris Mayor Anne Hidalgo has called on the government of President Emmanuel Macron to find shelter for the migrants, only to be told that unless she wants government forces to evacuate the site, the problem is hers.
The impasse has led to a series of calls for urgent action, with senior Paris priest Benoist de Sinety denouncing ""a total absence of humanity"".
""If you let the camp get bigger, you're leaving them exposed to smugglers,"" said Barda of Medecins du Monde.
""They'll do their deals and maintain the trafficking, fuelling all the tensions we're seeing today.""
by Lina Agabani Puch/AFP"
https://www.thelocal.fr/20171228/african-migrants-body-found-on-riviera-motorway,migrant,452,"
				28 December 2017
				12:46 CET+01:00			 
					12:46 CET+01:00				",The Local,African migrant's body found on French Riviera motorway,"The body of a young African migrant has been found on the motorway that links the French Riviera city of Nice to Italy.
Police believe the man in his twenties fell from a shack he had been staying in on some sort of ledge above the road near the town of Roquebrune-Cap-Martin.
He was barefoot when he was found and was in a sleeping bag on the side of the road. An autopsy is due to be carried out to determine the cause of death.
Police found a diary in which he recounted his daily life and the lengthy trip that had taken him from his home country to Europe, written in English, among his affairs, local media reported.
The death came less than a week after a 15-year-old Afghan migrant died after apparently being hit by a car on a road near Calais in the north of France.
Another migrant, an Iraqi national, is in a critical state after he was hit by a car on a motorway on Christmas Eve near the port of Dunkirk.
At least 15 migrants have died in southern France since September 2015, according to a count kept by AFP news agency.
The latest victim there likely came via the Italian border town of Ventimiglia, which has become a launching pad for migrants who make it to Italy and seek to head north into France.
Increased border patrols have made it much harder for them to do so, so many are now braving the snow-clad Alps further north in efforts to evade immigration police and reach France from Italy.
They often take treacherous high-altitude passes that locals warn will lead to deaths.
A rally to warn of the dangers to migrants in crossing passes in the Alps during the winter. Photo: AFP
The migrants have typically been refused asylum in Italy, and want to try their luck in France -- although under the so-called Dublin Regulation, France has the right to send them back across the border.
Until recently it was relatively easy to cross into France thanks to the unmanned border between the two countries.
But monitoring has tightened as the volume of arrivals has grown in recent years.
READ ALSO: Migrants are risking death to cross the Italian Alps into France
And French President Emmanuel Macron has vowed that his government will be ""inflexible"" in its policy of expelling economic migrants who have no right to asylum.
Macron's centrist government has promised to open up new legal avenues for refugees to travel to France, while cracking down on others who are in France to avoid poverty back home, rather than war or persecution.
""We can't take all of the world's misery,"" Macron has said."
https://www.thelocal.fr/20180406/paris-calls-for-help-to-house-thousands-of-canal-migrants,migrant,555,"
				6 April 2018
				10:03 CEST+02:00			 
					10:03 CEST+02:00				",AFP/The Local,"Paris calls for urgent help to house city's 2,000 canal migrants","Paris Mayor Anne Hidalgo says the French government needs to urgently find shelter for more than 2,000 migrants setting up makeshift camps alongside the city's canals, calling the situation ""unacceptable"". It may worsen as warmer weather approaches.
President Emmanuel Macron is seeking to centralise France's response to an influx of migrants in recent years as part of a new immigration bill being debated in parliament this week.
A migrant camp, mainly home to Afghans, has been spreading along the Canal Saint-Martin in recent months, and has now swelled to some 800 people.
Another 1,500 people, mostly Eritreans and Sudanese, have converged under an overpass on the Canal St Denis further to the north.
And the arrival of warmer weather could quickly swell their ranks, as seen at previous camps that have been dismantled in the capital in recent years.
READ ALSO: No seasonal cheer for migrants in tents along Paris canal
""If nothing is done, in two weeks there will be 3,000,"" Hidalgo told AFP, adding that she had asked the central government to find shelter but had so
far ""not had a response"".
The greater Paris region currently has room to shelter just 750 migrants, many of whom hope for refugee status but may be facing expulsion under Macron's tougher approach.
Some have arrived in Paris from the northern port of Calais, where migrants have flocked for years hoping to stow away on trucks to Britain.
Officials in the area have deployed a heavy police presence to ensure that no more camps like the huge ""Jungle"" site that was razed in 2016 are set up.
The Local spoke to migrants at the Canal Saint Martin at Christmas time. Many were teenagers and had imagined something very different when they had imagined France.
“Teachers in school taught us about France and what a wonderful place it was,” said Khater, who said he was 15 years old, as he stood by the dozens of tents strung along the banks of the Canal Saint-Martin that now serve as home for hundreds of migrants.
“I didn't think it would be like this,” he said, surveying the squalid scene along the canal, whose banks in summer host hundreds of trendy youngsters drinking beer or wine late into the night.
On Wednesday, UN human rights experts deplored an ""inhumane situation"" in Calais and elsewhere in northern France, urging the government to provide
water and emergency shelters.
""We are concerned about increasingly regressive migration policies and the inhumane and substandard conditions suffered by migrants,"" the UN's special
rapporteur on migrant rights, Felipe Gonzalez Morales, said in a statement from Geneva.
The government's draft law criminalises illegal border crossings and speeds up procedures to deport economic migrants, while offering faster asylum
procedures.
But several NGOs and other critics say the new laws will lead to thousands of deportations, and the government has already abandoned a proposal to deport
failed asylum-seekers to third countries deemed ""safe"".
France received a record 100,000 asylum applications last year and offered refugee status to around 30,000 people, official figures show. Forced
expulsions numbered 14,900.
""We're lying to the French by saying this is a temporary crisis that we'll fix with an immigration law,"" Hidalgo said.
""Let's be practical: Find shelter for the people sleeping in the camps, and then we can look at their situations,"" she said."
https://www.thelocal.fr/20180115/migrant-electrocuted-train-italy-to-france,migrant,213,"
				15 January 2018
				15:39 CET+01:00			 
					15:39 CET+01:00				",The Local,Migrant electrocuted on top of train from Italy to France,"French police discovered the partially burned body of a man on the roof of a train travelling from northern Italy to southern France.
READ ALSO: Migrants are risking death to cross the Italian Alps into France
His body was found as the regional train arrived early on Sunday morning in Menton, in the south of France, its first stop after Ventimiglia station in Italy.
Police suspect that the man climbed on top of the train to make the 15-minute journey across the border and may have grabbed hold of an overhead electric line to avoid being thrown off.
Passengers reported hearing three loud bangs and seeing flames, France Info reported.
It is the fifth such incident on the cross-border train line in a year, according to Ansa, most recently in August. Four people died of their injuries, while one was rescued.
While the number of people arriving in Italy via the Mediterranean fell significantly in the past six months, migrants already in Italy continue to risk their lives attempting to cross into other European countries illegally.
Rescue teams in the mountains between north-western Italy and France have warned of an “emergency” as migrants try to hike across the border despite heavy snow and freezing temperatures, many of them without proper clothing or equipment."
https://www.thelocal.fr/20180618/majority-of-french-reject-safe-harbour-for-aquarius-migrants,migrant,285,"
				18 June 2018
				14:21 CEST+02:00			 
					14:21 CEST+02:00				",AFP,Majority of French 'reject safe harbour for Aquarius migrants',"A majority of French citizens support the government's decision not to offer safe harbour to a ship carrying 630 rescued migrants after Italy refused to let it dock, an opinion poll released Monday showed.
Fifty-six percent of respondents said they backed the government, while 42 percent said it should have offered to let the ship dock, according to the OpinionWay poll.
The Aquarius, run by French charity SOS Mediterranee, was eventually allowed to dock in Spain on Sunday after being stranded for days while both Italy and Malta refused to let the migrants ashore.
Local leaders on the French island of Corsica had offered to welcome the Aquarius, but the move was slapped down by the central government, which argued that under international law the ship had to dock at the closest port.
READ ALSO:
First Aquarius migrants arrive to cheers in Spain
'I never meant to offend you': Macron tries to smooth over migrant row with Italy
Photo: AFP
Tensions flared after President Emmanuel Macron accused Rome of ""irresponsibility"", although he later said he had not meant to offend France's southern neighbour.
Macron is under pressure to close down migration routes from Africa amid strong anti-immigration sentiment in his country.
France has said it will examine asylum requests from Aquarius migrants who want to come over from Spain on a ""case-by-case basis"", government spokesman Benjamin Griveaux said Sunday, although he did not know how many might make the requests.
Rome's decision put the migrant influx back to the fore ahead of a EU summit on June 28-29, where leaders are supposed to hammer out an overhaul of
the bloc's asylum rules.
The OpinionWay poll was carried out among 1,020 adults online from June 13-15."
https://www.thelocal.fr/20170316/france-to-close-another-sprawling-migrant-camp-on-north-coast,migrant,403,"
				16 March 2017
				09:16 CET+01:00			 
					09:16 CET+01:00				",AFP/The Local,France to close another sprawling migrant camp on north coast,"France announced on Wednesday that security forces would start dismantling another huge migrant camp on its northern coast near the
port of Dunkirk ""as soon as possible"" after clashes at the site.
The population of the Grande-Synthe camp has swelled to about 1,400 to 1,500 people since the destruction last October of the squalid ""Jungle"" camp near Calais, about 40 kilometres (25 miles) away.
""It's no longer just a question of re-establishing public order"" in the camp, Interior Minister Bruno Le Roux told a hearing at the French Senate.
France will proceed with a ""progressive dismantling of the camp which should start as soon as possible,"" he said, adding that ""we can't let things continue like this.""
For more than a decade France's northern coast has been a magnet for refugees and migrants trying to reach Britain, with French authorities repeatedly tearing down camps in the region.
The decision has angered the charities that have provided aid to migrants in the area.
Sue Jex, Head of UK Operations for refugee support charity Care4Calais, said: “We are appalled that the desperately needed shelter for refugees in Grande-Synthe will be dismantled, following the demolition of the nearby Calais Jungle last year.
""We have all seen the terrible consequences of the demolition of the Jungle – this pushed many of the vulnerable refugees arriving in the north of France into living conditions far worse than those in the Jungle ever were.
""They are now faced with unsafe, unsanitary, and undignified conditions, many sleeping rough because they have nowhere else to go.""
The Grande-Synthe camp, populated mostly by Kurds at present, was built by the humanitarian group Doctors Without Borders (MSF) to house migrants and refugees who otherwise sleep in tents or makeshift shelters.
They gather along the northern coast in France seeking to break into trucks heading to Britain or pay smugglers to help them get across the Channel.
Police intervened at the camp after five men were injured in a fight at the start of the month. Another man was stabbed in November.
Several thousands of people from the Jungle were sent to accommodation around France last October, leading to fierce criticism from the far-right National Front party and other groups.
The Socialist government, which is determined to try to stop another camp from springing up in Calais, has criticised Britain for reneging on a deal to resettle hundreds of underage migrants from the camp."
https://www.thelocal.fr/20180615/french-police-taunt-and-mistreat-migrant-children,migrant,636,"
				15 June 2018
				08:34 CEST+02:00			 
					08:34 CEST+02:00				",AFP,"French police mistreat migrant children and cut soles off their shoes, Oxfam claims","Children as young as 12 and other vulnerable migrants have physically abused, detained and forcibly returned to Italy by French border guards in breach of international norms, Oxfam said Friday.
The ""Nowhere but Out"" report comes amid tensions between France and Italy over French President Emmanuel Macron's criticism of Rome over its rejection of a migrant ship carrying 629 people rescued from the Mediterranean.
Oxfam said some 16,500 refugees and migrants -- a quarter of them unaccompanied children -- passed through Ventimiglia, a small town about seven kilometres (four miles) from the French border, in the nine months to April.
The report said children complained about being ""physically and verbally abused, and detained overnight in cells without food, water or blankets and with no access to an official guardian,"" all contrary to French and EU law.
Oxfam staff and partners said there were cases where border guards cut the soles of the shoes of child migrants or stole their phone SIM cards.
""In one case, a very young Eritrean girl was forced to walk back across the border along a road with no pavement carrying her 40-day-old baby,"" it said.
Most of the migrants were fleeing persecution and war in countries such as Sudan, Eritrea, Syria and Afghanistan.
Many of them are trying to reach other countries like France, Britain, Sweden and Germany where they hope to join relatives or friends.
""Since France tightened border controls in 2015, thousands of people have been stranded in Ventimiglia without sufficient assistance or access to basic services,"" Oxfam said.
""Hundreds of refugees and other migrants sleep rough under a flyover, with no access to drinkable water, shelter or heating.""
'Pushed us off the train'
""French police officers are not upholding international standards. They taunt children and mistreat them.... Some children have had the soles of their
shoes cut off before being sent back to Italy,"" said Chiara Romagno, Oxfam's OpenEurope project leader in Ventimiglia.
""The resolution of people to reach their loved ones in other countries, and the lack of sufficient safe and regular pathways to do so leaves them no choice but to try until they succeed,"" Romagno said.
Michael, a 15-year-old from Sudan's troubled Darfur region, said he and a friend tried to enter France but the ""police pushed us off the train.
""Then they pushed us in a van in the railway station car park. We were given a document (refus d'entree, refusal of entry) in the van and we were put on another train going back to Italy, without any explanation.""
The report said Roja Camp, the official camp set up outside Ventimiglia, was vastly overstretched and that the ""heavy police presence at the entrance and compulsory fingerprinting deter many from staying"" there.
Most migrants preferred to live rough, sleeping under a motorway outside town with no sanitation facilities or clean water.
""In Ventimiglia, there are no arrangements to take care of the returned children. Once off the train, they are left to fend for themselves,"" the report said.
Oxfam said France should immediately stop and adequately sanction the ""illegal practices of the French police at the French-Italian border"", ensure the right to seek asylum for all foreign children in French territory and take care of them according to the provisions of national, European and other international laws.
An EU scheme to distribute migrants equitably around the bloc has failed miserably, with central European members flatly refusing the quotas and others, including France, falling far short of their allocated target.
Italy has received more than 700,000 migrants and refugees since 2013.
Many West Africans try to continue on to France, where they speak the language and often have relatives, only to find the border shut to them.
Thousands of those who manage to sneak across the Alps have been detained and sent back to Italy."
https://www.thelocal.fr/20180715/pro-migrant-protests-on-france-italy-border,migrant,223,"
				15 July 2018
				09:47 CEST+02:00			 
					09:47 CEST+02:00				",AFP,Pro-migrant protests on France-Italy border,"Several thousand people protested Saturday on the France-Italy border against European states closing their frontiers to migrants, AFP journalists said.
They said about 3,000 people -- mostly Italian, French, German, Dutch and Spanish -- marched from the small Italian town of Ventimiglia the four kilometres to the border with France which has imposed tight restrictions in an effort to turn back an influx of migrants.
There was a heavy police presence.
""A dignified welcome for refugees in a Europe without frontiers,"" one poster read while others recalled the hundreds of migrants who have lost their lives on the risky Mediterranean sea crossing from North Africa.
Migrant aid groups, which organised the march, said it was to denounce ""the brutality of the national and international policies"" recently adopted as European states seek to halt a fresh influx.
Italy's new right-wing government has cracked down especially hard, refusing permission for several ships carrying rescued migrants to dock in its ports.
Rome has also demanded that its European Union peers do much more to help Italy, which along with Greece has received most migrants, pressing efforts to stop them coming at source.
Ventimiglia has seen thousands of migrants from North Africa, the Middle East and beyond pass through as they try to get into France.
READ ALSO: In 'Calais of Italy' tension soars over migrant crisis"
